休閒男鞋, Timberland 男款中灰色磨砂革輕質帆船鞋|A2J6Q
休閒男鞋, HEY DUDE(男) 無帶直套式加厚水洗棉布輕量休閒鞋  - 意識綠
休閒男鞋, Clarks 休閒鞋 Glide Chukka 中筒 男鞋
休閒男鞋, HEY DUDE(男) 四孔透氣棉布輕量休閒鞋  - 泰山灰
休閒男鞋, Converse 休閒鞋 Jack Purcell 穿搭 男女鞋 基本款 簡約 漆皮 開口笑 情侶鞋 白 黑 168135C
休閒男鞋, Clarks 皮鞋 Conwell Plain 男鞋
休閒男鞋, PQ 真皮菱格面小圓頭德比鞋 男鞋 - 棕(另有黑)
休閒男鞋, Timberland 男款黑色磨砂革經典六吋靴|A27UQ
休閒男鞋, NIKE KAWA ADJUST 休閒鞋拖鞋男鞋藍色-834818404【FEEL 9S】
休閒男鞋, FitFlop SURFER FRESHWEAVE 運動風夾腳涼鞋 萊姆綠
休閒男鞋, TEVA 原廠貨 男 Alp Premier 機能運動涼鞋/雨鞋/水鞋 大西洋藍
休閒男鞋, Crocs卡駱馳 (中性鞋) 經典迷彩克駱格 206454-001
休閒男鞋, Timberland 男款黑灰網面魔鬼貼束帶涼鞋|A23KS
休閒男鞋, FitFlop CHI厚底涼鞋巧克力棕
休閒男鞋, Converse 休閒鞋 All Star 帆布 穿搭 男女鞋
休閒男鞋, Clarks 涼拖鞋 TriCove Sun 三瓣底 男鞋
休閒男鞋, Crocs卡駱馳 (中性鞋) 經典迷彩克駱格 206454-0GI
休閒男鞋, Crocs卡駱馳 (中性鞋) 經典人字拖 206119-410
休閒男鞋, FitFlop ETHAN SLIDES 可調整式魔鬼氈涼鞋 靚黑色
休閒男鞋, FitFlop ARLO SLIDES 經典扣環可調式涼鞋-男(黑色)
休閒男鞋, Converse 休閒鞋 Breakpoint 男女鞋
休閒男鞋, (男)VANS Old Skool Zip 經典皮革拉鍊休閒鞋*白色
休閒男鞋, Converse 休閒鞋 One Star 穿搭 男女鞋
休閒男鞋, Crocs卡駱馳 (中性鞋) 經典人字拖 206119-309
休閒男鞋, 美國Chaco。男 經典舒壓運動涼鞋CH-BLM01HG43 (藍風妄想)
休閒男鞋, Converse 低筒休閒鞋 男女款 酒紅色 70S NO.162059C
休閒男鞋, Timberland 男款小麥黃絨面Radford 6吋防水靴
休閒男鞋, Converse 休閒鞋 All Star 70 低筒 男女鞋
休閒男鞋, Timberland 男款勃根紅經典三孔帆船鞋|50009
休閒男鞋, Timberland 女款中灰色磨砂革休閒厚底涼鞋|A2FG6
休閒男鞋, ECCO FLOWT M 簡約休閒涼拖鞋 男鞋-深灰色
休閒男鞋, Timberland 男款中棕色磨砂革防潑水經典六吋靴|10001
休閒男鞋, (男)VANS Authentic 眩暈棋盤格綁帶休閒鞋*黑白
休閒男鞋, FitFlop TM-BANDO TM LEATHER BACK-STRAP-黑色
休閒男鞋, Timberland 男款中棕色經典六吋靴|73542
休閒男鞋, 康威士 Converse All Star 男鞋 女鞋
休閒男鞋, Converse 休閒鞋 Jack Purcell 穿搭 男女鞋 開口笑 基本款 帆布 鴛鴦 情侶鞋 藍 綠 167922C
休閒男鞋, Clarks UN 一字頭縫線素面正裝紳士鞋 黑色
休閒男鞋, Royal Elastics 休閒鞋 Smooth 男鞋
休閒男鞋, (男)VANS Era 拼接撞色綁帶休閒鞋*牛仔藍
休閒男鞋, FitFlop LOAFF SKATES CANVAS NEOPRENE黑
休閒男鞋, Timberland 男款深綠色磨砂革休閒中筒靴|A2DPU
休閒男鞋, Converse 休閒鞋 All Star 高筒 穿搭 男女鞋
休閒男鞋, Crocs卡駱馳(男鞋)LiteRide幾何龐克徒步繫帶鞋 206113-066
休閒男鞋, (男)VANS Classic Slip-On 撞色棋盤格休閒懶人鞋
休閒男鞋, TEVA Terra Fi 5 Universal 多功能運動涼鞋款 男 灰色 TV1102456GBRC
休閒男鞋, TEVA Hurricane XLT 水陸涼鞋 黑色 男 TV4156BLK
休閒男鞋, Royal Elastics 休閒鞋 Pastor JP 男鞋
休閒男鞋, Converse 休閒鞋 All Star 高筒 男女鞋
休閒男鞋, Timberland 男款海軍藍織面休閒鞋|A29J9
休閒男鞋, TRAVEL FOX(男)  當下 硬底子復刻休閒帆布鞋 - 永恆黑
休閒男鞋, CONVERSE 中性款高筒運動休閒帆布鞋 米白 -NO.162053C
休閒男鞋, GOOD YEAR 男超輕量水陸兩用休閒洞洞鞋 sa93709 魔法Baby
休閒男鞋, Converse 休閒鞋 Pro Leather 穿搭 男女鞋 經典款 皮革 簡約 情侶鞋 火焰印花 白 黃 167935C
休閒男鞋, Royal Elastics 休閒鞋 Adelaide 男鞋
休閒男鞋, Converse 帆布鞋 All Star 70 男女鞋
休閒男鞋, Converse 休閒鞋 All Star 高筒 穿搭 男女鞋
休閒男鞋, Royal Elastics 休閒 Icon Genesis 男鞋
休閒男鞋, HANNFORT COZY可機洗平織布後踩氣墊鞋-男-條紋米
休閒男鞋, Converse 休閒鞋 Lucky Star 穿搭 男女鞋
休閒男鞋, Timberland 男款銹鐵棕磨砂革輕質帆船鞋|A2HS1
休閒男鞋, Converse 休閒 Pro Leather OX 男女鞋
休閒男鞋, FitFlop UBERKNIT 輕量繫帶高筒休閒鞋(午夜藍/都會白)
休閒男鞋, Royal Elastics Bishop Checked男鞋
休閒男鞋, Converse 休閒鞋 All Star 高筒 穿搭 男女鞋
休閒男鞋, FitFlop ETHAN SLIDES 可調整式魔鬼氈涼鞋 暗紅色
休閒男鞋, Converse 休閒鞋 One Star 穿搭 男女鞋
休閒男鞋, Crocs 卡駱馳 (男鞋) 聖克魯茲樂福鞋 205708-22Z
休閒男鞋, FitFlop RYKER BACK-STAP SANDALS魔鬼氈後帶涼鞋 午夜藍
休閒男鞋, Hush Puppies  Bounce Max 高效彈力休閒男鞋-淺灰
休閒男鞋, CONVERSE Chuck Taylor All Star  -男女基本款高紅休閒鞋- NO.M9621C
休閒男鞋, Converse 休閒鞋 Pro Leather OX 男女鞋
休閒男鞋, 男時尚休閒鞋 sd7017 魔法Baby
休閒男鞋, Converse 休閒鞋 ONE STAR OX 低筒 運動 男鞋
休閒男鞋, (男)VANS SK8-Hi 潮流素色休閒高筒休閒鞋*藍色
休閒男鞋, CONVERSE-紅色高筒帆布鞋-NO.164944C
休閒男鞋, (男)VANS Silp-On SF 條紋潮流休閒懶人鞋*藍白
休閒男鞋, PQ 真皮菱格面小圓頭德比鞋 男鞋 - 黑(另有棕)
休閒男鞋, PQ 真皮 雕花繫帶德比鞋 男鞋 - 黑(另有棕)
休閒男鞋, Crocs卡駱馳 (中性鞋) 經典LOGO狂熱圖案拖鞋 206124-103
休閒男鞋, Royal Elastics 休閒鞋 Pastor JP 男鞋
休閒男鞋, Converse 休閒鞋 One Star 低筒 運動 男女鞋
休閒男鞋, (男)VANS Slide-On 素色休閒拖鞋*黑色
休閒男鞋, (男)VANS Era 拼接撞色綁帶休閒鞋*卡其紅
休閒男鞋, 男Q彈緩震防滑拖鞋 sd5146 魔法Baby
休閒男鞋, Timberland 男款小麥黃磨砂革休閒中筒靴|A2D6U
休閒男鞋, Converse 休閒鞋 All Star 低筒 男女鞋
休閒男鞋, Clarks 休閒鞋 Glaston Mid 中筒 男鞋
休閒男鞋, Converse 休閒鞋 All Star 高筒 穿搭 男女鞋
休閒男鞋, Converse 休閒鞋 All Star 高筒 穿搭 男女鞋
休閒男鞋, TEVA Winsted 經典織帶涼鞋 男 竹深橄欖 TV1017419BDOLV
休閒男鞋, PQ 真皮 雕花繫帶德比鞋 男鞋 - 棕(另有黑)
休閒男鞋, Crocs卡駱馳 (中性鞋) Reviva 人字拖 205545-3TQ
休閒男鞋, Converse All Star 70 男鞋 女鞋
休閒男鞋, FitFlop BANDO SANDAL IN LIZARD PRINTED-棕
休閒男鞋, Converse 休閒鞋 All Star 高筒 穿搭 男女鞋
休閒男鞋, (男)VANS Authentic 經典素色休閒款*紅色
休閒男鞋, Clarks 休閒鞋 Un Voyage Lace 男鞋
休閒男鞋, TEVA Original Universal Premier 經典織帶涼鞋 男 圖騰海軍藍 TV1015192BBNY
休閒男鞋, (男)VANS Slide-On 棋盤格休閒拖鞋*黑色
休閒男鞋, *NIKE BENASSI JDI 拖鞋 運動拖鞋 基本款 白黑 男女尺寸 343880-100
休閒男鞋, ECCO BIOM C-TRAIL M 縱橫越野健步運動鞋 男-深灰/黑/橘紅
休閒男鞋, (男)VANS Slide-On 棋盤格休閒拖鞋*紅色
休閒男鞋, FitFlop(男) LOAFF TM SKATES CANVAS綠
休閒男鞋, (男)VANS Slip-On SF 經典素色懶人鞋*黃綠
休閒男鞋, W&M 超軟羊皮綁帶厚底鞋休閒鞋 男鞋 -深咖(另有黑)
休閒男鞋, Converse One Star Premium Suede -男女款情侶鞋- NO.158369C
休閒男鞋, 軟Q緩震運動休閒拖鞋 sd0559 魔法Baby
休閒男鞋, FitFlop RYKER BACK-STAP SANDALS魔鬼氈後帶涼鞋 淺褐
休閒男鞋, Crocs卡駱馳 (中性鞋) 電波紋卡駱班人字拖 206475-103
休閒男鞋, Converse 休閒鞋 All Star 低筒 穿搭 男女鞋
休閒男鞋, (男)VANS SK8-Hi 撞色印花高筒休閒鞋*黑色
休閒男鞋, (男)VANS Era 拼接棋盤格綁帶休閒鞋*藍色
休閒男鞋, 勃肯BIRKENSTOCK 447081。哈里森長筒休閒鞋(核果色)
休閒男鞋, Crocs 卡駱馳 (中性鞋) 厚底卡駱班撞色涼拖 205693-100
休閒男鞋, FitFlop TRAKK夾腳涼鞋黑色
休閒男鞋, Converse 帆布鞋 One Star 男鞋
休閒男鞋, Converse One Star Pro 男鞋 女鞋
休閒男鞋, (男)VANS TRI-LOCK 棋盤格織帶涼鞋*黑色
休閒男鞋, Converse 休閒鞋 All Star 簡約 穿搭 男女鞋
休閒男鞋, CONVERSE-70 經典紅色帆布鞋-NO.164949C
休閒男鞋, Clarks 休閒鞋 Un Voyage Lace 男鞋
休閒男鞋, SAPATOTERAPIA 巴西簡約素面直套皮鞋男鞋-黑
休閒男鞋, TEVA 原廠貨-男 Ember Moc 菠蘿麵包鞋 午夜海軍藍
休閒男鞋, OT鬼塚虎-MEXICO 66 MID RUNNER 休閒鞋 (白底銀邊)
休閒男鞋, HANNFORT 休閒鞋 CARIBBEAN 2Way後踩運動休旅鞋-男-黑
休閒男鞋, 台灣製迪士尼米奇授權雙釦時尚拖鞋sd3027 魔法Baby
休閒男鞋, ECCO SOFT 7 M 單色拼接設計輕便休閒鞋 男鞋-藍
休閒男鞋, Crocs 卡駱馳 (男鞋) 尤肯維卓越克駱格 205177-060
休閒男鞋, native LENNOX 懶人鞋 洞洞鞋 男鞋 黑色 11105000-1105 no867
休閒男鞋, TEVA 原廠貨 男 Arrowood Slip-On 輕量休閒鞋 (黑)
休閒男鞋, Crocs 卡駱馳 (男鞋) LiteRide男士便鞋 205679-066
休閒男鞋, 男鞋 台灣製紳士型休閒布鞋sd7227 魔法Baby
休閒男鞋, SANUK 麻布寬版懶人鞋-男款(深咖啡色)1011665 BNG
休閒男鞋, FitFlop TRAKK II NEOPRENE TOE-THONG-午夜藍
休閒男鞋, HANNFORT CARIBBEAN編織牛皮休閒鞋-男-毛毯灰
休閒男鞋, HANNFORT CARIBBEAN編織牛皮休閒鞋-男-毛毯灰
休閒男鞋, Crocs 卡駱馳 (男鞋) LiteRide男士繫帶鞋 205162-066
休閒男鞋, HANNFORT COZY可機洗英倫風格紋布氣墊懶人鞋-男-深咖
休閒男鞋, 男鞋 台灣製輕量休閒晴雨洞洞鞋sd7222 魔法Baby
休閒男鞋, CCILU 幾何飛織網布休閒運動鞋-男款-301325001銀黑色
休閒男鞋, TEVA Hurricane Volt 經典織帶涼鞋 白色 男 TV1015224WHT
休閒男鞋, HANNFORT CANYON牛皮紳士氣墊短靴-男-質感棕
休閒男鞋, native AP MOC 阿波羅 休閒鞋 舒適 灰色 男鞋 女鞋 21102401-8292 no525
休閒男鞋, Converse 休閒鞋 One Star HanByeol 男女鞋 經典款 一顆星 漆皮 情侶穿搭 簡約 灰 白 168133C
休閒男鞋, ECCO LHASA時尚雕花舒適緩震紳士正裝鞋 男-棕
休閒男鞋, ECCO RECIPRICO 商務休閒素面紳士樂福鞋 男-黑
休閒男鞋, Rider BLOCKBUSTER系列人字夾腳拖鞋(男款)-藍
休閒男鞋, 台灣製工學設計流線拖鞋 sd0604 魔法Baby
休閒男鞋, SANUK 趣味塗鴉休閒鞋-男款(紅色)SMF10989 AICN
休閒男鞋, OT鬼塚虎-SERRANO 休閒鞋 男女 (藍底紅白邊)
休閒男鞋, TEVA Original Universal Premier 經典織帶涼鞋 男 圖騰海軍藍 TV1015192BBNY
休閒男鞋, Converse 休閒鞋 All Star 低筒 穿搭 男女鞋 基本款 簡約 情侶鞋 帆布 拼接 白 米白 167673C
休閒男鞋, SANUK 針織透氣懶人鞋-男款(咖啡色)
休閒男鞋, OT鬼塚虎-Mexico 66 SD 休閒鞋 男女(黃)
休閒男鞋, Converse 帆布鞋 Deckstar 運動 男鞋 女鞋
休閒男鞋, PAMAX 帕瑪斯【超機能頂級氣墊】最佳比例厚度，全雙PU抗菌-AIR003
休閒男鞋, OnitsukaTiger Mexico66 休閒鞋1183A348-300
休閒男鞋, FitFlop SPORTY-POP CANVAS SNEAKER-黑色
休閒男鞋, SANUK-PICK POCKET 紳士休閒鞋-男款(墨綠)
休閒男鞋, TRAVEL FOX(男) 我的天空 超軟苯染牛皮二孔經典親膚帆船鞋 - 經典咖
休閒男鞋, OT鬼塚虎-FABRE BL-S 2.0 休閒鞋 男女(藍)
休閒男鞋, Crocs 卡駱馳 (男鞋) 男士激浪涉水涼鞋 203965-060
休閒男鞋, Crocs卡駱馳 (中性鞋) 經典LOGO圖案克駱格 206450-103
休閒男鞋, FitFlop UBERKNIT 輕量繫帶高筒休閒鞋(午夜藍/經典紅)
休閒男鞋, OT鬼塚虎-TAI-CHI-REB 休閒鞋 男女 (黃底黑邊)
休閒男鞋, (男/女)Ponic&Co美國加州環保防水編織懶人鞋-白灰
休閒男鞋, SANUK 素面窄版休閒鞋-男款(灰黑色)
休閒男鞋, FitFlop ANDOR HIGH-TOP SNEAKERS-黑
休閒男鞋, HANNFORT CANYON牛皮紳士氣墊短靴-男-紳士黑
休閒男鞋, TEVA 原廠貨 男 Arrowood Slip-On 輕量休閒鞋 (灰)
休閒男鞋, native JEFFERSON 男/女鞋-花卉藍
休閒男鞋, SANUK 渲染草編底休閒鞋-男款(桃紅色)SMF10556 RBST
休閒男鞋, Kai Shin 高筒安全工作鞋 黑色 M-PLA939A01
休閒男鞋, FitFlop BANDO厚底涼鞋黑色
休閒男鞋, OT鬼塚虎-TAI-CHI-REB 休閒鞋 男女 (白底紅藍邊)
休閒男鞋, TEVA 原廠貨 男 Omnium 2 護趾水陸機能涼鞋/雨鞋/水鞋 橄欖綠
休閒男鞋, FitFlop LOAFF CANVAS SKATES-黑色
休閒男鞋, ECCO KYLE 超柔軟牛皮兩穿懶人鞋 男-深褐
休閒男鞋, native JEFFERSON 懶人鞋 洞洞鞋 防水 雨天 白 男鞋 女鞋 11100100-1999 no422
休閒男鞋, CCILU 輕量防水兩穿休閒鞋-男款-301303027極簡白
休閒男鞋, OnitsukaTigerx迪士尼聯名 Mexico66 米妮紅
休閒男鞋, native HOWARD 船型鞋 懶人鞋 黑色 男女鞋 11101100-1100 no930
休閒男鞋, Crocs 卡駱馳 (中性鞋)波浪紋卡駱班 205573-4HQ
休閒男鞋, TEVA Universal Trail 多功能運動涼鞋款 男 CTC峽谷圖騰藍橘 TV1106786CTCN
休閒男鞋, Onitsuka Tiger MEXICO 66 休閒1183A033金
休閒男鞋, (男)VANS Classic Slip-On 潮流編織休閒懶人鞋*咖啡色
休閒男鞋, TRAVEL FOX(男) 無重力 超輕舒適牛皮直套式休閒紳士鞋 - 飄浮黑
休閒男鞋, Crocs卡駱馳 (男鞋) LiteRide拼接撞色步行鞋 205788-37P
休閒男鞋, SAPATOTERAPIA 巴西男士皮革帆船鞋男鞋深棕另有咖
休閒男鞋, native LENNOX BLOCK 懶人鞋 洞洞鞋 男鞋 白色 迷彩灰邊 11105002-8815 no929
休閒男鞋, 棉麻清涼拖鞋 sd0614 魔法Baby
休閒男鞋, Converse 休閒鞋 All Star 高筒 穿搭 男女鞋
休閒男鞋, ECCO COOL M 360度環繞防水休閒運動鞋 男鞋-黑色
休閒男鞋, OT鬼塚虎-EMPIRICAL LO 2.0 休閒鞋 男 (綠)
休閒男鞋, WALKING ZONE 輕量系列 超彈力飛線編織運動休閒 男鞋-黑(另有藍)
休閒男鞋, SAPATOTERAPIA 巴西男士寬版直套工作鞋 黑另有深咖
休閒男鞋, (男)VANS Era 59 經典素色休閒鞋*酒紅色
休閒男鞋, SAPATOTERAPIA 巴西男透氣休閒鞋卡其另有深藍
休閒男鞋, Onitsuka Tiger GSM 男女休閒鞋 D5K2Y-100
休閒男鞋, (男)VANS Era 59 經典素色休閒鞋*藍色
休閒男鞋, HANNFORT COZY可機洗平織布後踩氣墊鞋-男-可可
休閒男鞋, FitFlop GOGH MOC LEATHER SLIDES-深褐色
休閒男鞋, HANNFORT COZY可機洗樂福氣墊休閒鞋-男-海軍藍
休閒男鞋, Onitsuka Tiger Mexico 66 Slip-On 休閒鞋1182A087-100
休閒男鞋, FitFlop UBERKNIT 輕量繫帶高筒休閒鞋(迷彩綠)
休閒男鞋, (男)VANS Old Skool 經典素面休閒鞋*藍色
休閒男鞋, ECCO VITRUS I雅致男士正裝德比鞋 男-棕
休閒男鞋, Clarks 步步清新2孔式鞋面縫線設計休閒男鞋 深灰色
休閒男鞋, native ZURICH 涼鞋 帆布 男鞋 女鞋 黑色 61105800-1001 no749
休閒男鞋, HANNFORT COZY可機洗帆布氣墊懶人鞋-男-沈穩灰
休閒男鞋, HANNFORT COZY可機洗平織布後踩氣墊鞋-男-條紋米(8H)
休閒男鞋, SANUK 素面拉環設計休閒鞋-男款(鐵灰色)SMF10971 BCMB
休閒男鞋, OnitsukaTigerx迪士尼 Mexico66 PS 米妮黑
休閒男鞋, Crocs 卡駱馳 (男鞋) 尤肯維卓越克駱格 205177-22Z
休閒男鞋, SAPATOTERAPIA 巴西男士雕花繫帶皮鞋 男鞋黑另有棕
休閒男鞋, Converse 休閒鞋 All Star 低筒 穿搭 男女鞋 基本款 簡約 情侶款 斑馬紋 三星黑標 米白 黑 167811C
休閒男鞋, Royal Elastics 休閒鞋 Bishop Bolt 男鞋
休閒男鞋, Hush Puppies Bounce 超彈力便鞋-棕褐
休閒男鞋, OT鬼塚虎 Mexico 66 Paraty 休閒鞋1183A437-001
休閒男鞋, Crocs 卡駱馳 (中性鞋) 厚底卡駱班 205681-6QB
休閒男鞋, TEVA 原廠貨 男 Sanborn Universal 輕量運動涼鞋/雨鞋/水鞋 (橄欖綠)
休閒男鞋, Travel Fox(男) NEW BLACK 馬卡龍彩色帆船 - 紅
休閒男鞋, PALLADIUM Pallaville TRNG SO 男女休閒鞋 75550029 灰
休閒男鞋, TEVA 原廠貨-男 Original Moto 金屬扣環皮革涼鞋/雨鞋/水鞋 鴿子灰
休閒男鞋, FitFlop SPORTY-POP CANVAS SNEAKER-迷彩綠
休閒男鞋, OnitsukaTigerx迪士尼聯名 Mexico66 PS 米奇黑
休閒男鞋, (男)VANS SK8-Hi 潮流素色休閒高筒休閒鞋*黑色
休閒男鞋, SANUK 窄版素面內印花休閒鞋-男款(灰色)SMF10668 CHRC
休閒男鞋, 台灣製休閒拖鞋 sd0608 魔法Baby
休閒男鞋, FitFlop CHRISTOPHE休閒鞋黑色
休閒男鞋, native JEFFERSON 懶人鞋 洞洞鞋 防水 雨天 黑色 男鞋 女鞋 11100100-1105 no452
休閒男鞋, Onitsuka Tiger鬼塚虎-GSM 休閒鞋 男女(白底紫邊)
休閒男鞋, TEVA 原廠貨 男 Mush II 寬版織帶夾腳拖鞋/雨鞋/水鞋-荊棘咖啡棕
休閒男鞋, TEVA 原廠貨-男 Terra-Float 2 運動涼鞋/雨鞋/水鞋 深橄欖綠
休閒男鞋, TEVA Original Universal Premier 經典織帶涼鞋 男 圖騰海軍藍 TV1015192BBNY
休閒男鞋, (男)VANS Old Skool 拼接休閒鞋*藍色
休閒男鞋, 台灣製運動風輕量夾腳拖鞋 sd5168 魔法Baby
休閒男鞋, TEVA Ember Moc 男經典波羅麵包鞋 炭灰 TV1018226CLGY
休閒男鞋, Nike Kawa 男女款 黑色 拖鞋 防水拖鞋 Shower 運動 休閒 排汗 彈性 輕盈 拖鞋 832528-001
休閒男鞋, Converse 籃球鞋 ERX 260 高筒 運動 男鞋
休閒男鞋, ECCO COOL M 360度環繞防水休閒運動鞋 男鞋-咖啡色
休閒男鞋, Royal Elastics 休閒鞋 Rider 運動 男鞋
休閒男鞋, Converse Chuck Taylor 帆布鞋 男鞋 女鞋
休閒男鞋, TEVA 原廠貨 男 Hurricane XLT2 機能運動涼鞋/雨鞋/水鞋-GC100美國大峽谷款
休閒男鞋, FitFlop GOGH MOC NUBUCK SLIDES-羽毛灰
休閒男鞋, TEVA 原廠貨 男 Hurricane Toe Pro 護趾水陸機能涼鞋/雨鞋/水鞋 電光藍
休閒男鞋, HANNFORT COZY可機洗平織布後踩氣墊鞋-男-條紋藍
休閒男鞋, PALLADIUM PAMPA HI STRAP LEA 男女休閒鞋 75558012 黑
休閒男鞋, ECCO BIOM C-TRAIL M 縱橫越野健步運動鞋 男-暖灰/黑
休閒男鞋, SAPATOTERAPIA 巴西 經典素面直套紳士皮鞋男鞋黑
休閒男鞋, SANUK復古水洗帆布綁帶休閒鞋-男款(軍綠色)
休閒男鞋, TEVA Terra Fi 5 Sport 多功能運動涼鞋 深灰 男 TV1099441DKSW
休閒男鞋, SANUK 現代騎士系列綁帶休閒鞋-男款(咖啡色)SMF11165 BNDL
休閒男鞋, SAPATOTERAPIA 巴西型男針織布拼接皮革休閒鞋 男鞋-黑(另有藍)
休閒男鞋, ECCO SOFT 7 M 單色拼接設計輕便休閒鞋 男鞋-駝色/棕色
休閒男鞋, HANNFORT COZY可機洗平織布後踩氣墊鞋-男-條紋黑
休閒男鞋, FitFlop BANDO TM BACK-STRAP SANDALS 迷彩綠
休閒男鞋, ECCO AQUET M 透氣休閒套入式樂福鞋 男-黑色
休閒男鞋, SANUK VAGABOND 內刷毛寬版帆布懶人鞋-男款(灰色)
休閒男鞋, SANUK 復古水洗帆布綁帶休閒鞋-男款(藍色)SMF11010 BLU
休閒男鞋, TEVA Original Universal Premier 男 休閒涼鞋 黑(TV1015192BLK)
休閒男鞋, SAPATOTERAPIA 巴西男士 平穩樂福休閒鞋 深藍
休閒男鞋, OT鬼塚虎 Mexico 66 Paraty 休閒鞋1183A437-100
休閒男鞋, TEVA 原廠貨-男 Hurricane XLT2 機能運動涼鞋/雨鞋/水鞋 幾何黑
休閒男鞋, SANUK 現代騎士系列綁帶休閒鞋-男款(黑色)SMF11165 BLK
休閒男鞋, WALKING ZONE 輕量系列 超彈力飛線編織運動休閒 男鞋-藍(另有黑)
休閒男鞋, OT鬼塚虎-TAI-CHI-REB 休閒鞋 男女 (白底紅邊)
休閒男鞋, HANNFORT 懶人鞋 CARIBBEAN  2way後踩鞋-男-質感棕
休閒男鞋, (男)VANS SK8-Hi 拼接圖騰高筒休閒鞋*藍色
休閒男鞋, (男)VANS Chima Ferguson Pro 經典素色休閒鞋*白色
休閒男鞋, SAPATOTERAPIA 巴西男士 直套皮鞋-黑(另有棕)
休閒男鞋, OT鬼塚虎-Mexico 66 Baja 休閒鞋 男女(白底紅邊)
休閒男鞋, 男Q彈緩震防滑拖鞋 sd5147 魔法Baby
休閒男鞋, (男)VANS Slip-On 經典休閒懶人鞋*紅色
休閒男鞋, OT鬼塚虎-OK BASKETBALL MT 休閒鞋 男(藍)
休閒男鞋, Hush Puppies Bounce Max 高效彈力休閒男便鞋-深藍
休閒男鞋, SANUK 水洗帆布綁帶休閒鞋-男款(黑色)
休閒男鞋, 【TEVA】Original Universal Moto 男 休閒涼鞋 灰(TV1019412WLDD)
休閒男鞋, TEVA Hurricane Drift 男 極輕量涼鞋 深藍 TV1100270ECL
休閒男鞋, Onitsuka Tiger GSM 男女休閒鞋1183A180-251
休閒男鞋, Royal Elastics 休閒 Bishop 套腳 男鞋 經典 皮革 球鞋 穿搭 白 黑 01701009
休閒男鞋, 男軟Q緩震按摩休閒拖鞋 sd0577 魔法Baby
休閒男鞋, SANUK-HEMP 素面麻布內條紋懶人鞋-男款(深藍色)
休閒男鞋, SANUK 竹節紋帆布懶人鞋-男款(黑色)
休閒男鞋, PQ 極簡方頭寬楦商務男皮鞋 綁帶基本款-黑
休閒男鞋, ECCO SCINAPSE MEN S 潮流襪套緩震運動鞋 男 藍
休閒男鞋, Clarks 皮鞋 Un Kenneth Way 西裝 男鞋
休閒男鞋, Converse 休閒鞋 All Star 高筒 男女鞋
休閒男鞋, Converse 休閒鞋 All Star 高筒 男女鞋
休閒男鞋, 成人男款海灘夾腳拖鞋 sd0156 魔法Baby
休閒男鞋, 成人男款海灘夾腳拖鞋 sd0155 魔法Baby
休閒男鞋, Clarks UN 真皮百搭正裝休閒鞋 黑色
休閒男鞋, Royal Elastics 休閒鞋 Icon 男鞋
休閒男鞋, ECCO EXOSTRIKE 突破極限低筒運動戶外靴 男-深灰
休閒男鞋, (男) Dr.Martens 1460 經典8孔刷色馬汀馬丁靴-咖啡
休閒男鞋, native APEX 2.0 登峰男/女靴-橄欖綠x噴墨
休閒男鞋, Converse 休閒鞋 All Star 高筒 穿搭 女鞋
休閒男鞋, Rider STRIKE系列人字夾腳拖鞋(男款)-深藍
休閒男鞋, Royal Elastics 休閒鞋 London 男鞋
休閒男鞋, Converse 休閒鞋 All Star 高筒 聯名 男女鞋
休閒男鞋, Clarks 皮鞋 Glement Slip 正裝 男鞋
休閒男鞋, Royal Elastics 休閒鞋 Icon Genesis 男鞋
休閒男鞋, Clarks 工藝世家-高質感皮面復刻工藝布洛克拷花紳士鞋 黑色
休閒男鞋, Clarks 皮鞋 Tilden Walk 正裝 西裝 男鞋
休閒男鞋, Converse 休閒鞋 All Star 高筒 穿搭 男女鞋
休閒男鞋, Rider STRIKE系列人字夾腳拖鞋(男款)-亮藍
休閒男鞋, ECCO SOFT 8 M 簡約套入式休閒鞋 男-黑
休閒男鞋, Royal Elastics 休閒鞋 Icon 低筒 男鞋
休閒男鞋, Onitsuka Tiger Mexico66 Paraty 休閒鞋1183A339-401
休閒男鞋, Converse 休閒鞋 PL 76 復古 簡約 男女鞋
休閒男鞋, FitFlop(男) LOAFF TM SKATES CANVAS藍
休閒男鞋, Royal Elastics 休閒鞋 Knight 男鞋
休閒男鞋, Clarks 步步清新 全皮面2孔式鞋帶直率休閒鞋 黑色
休閒男鞋, ECCO FLEXURE T-CAP M 輕彈皮革百搭休閒鞋 男-黑
休閒男鞋, Fly London(男) 哲學之思 手染自然色系綁帶休閒鞋 - 咖啡
休閒男鞋, ECCO CREPETRAY MENS 蜜糖牛奶休閒鞋 男-藍
休閒男鞋, Royal Elastics 休閒鞋 Duke 色塊 男鞋
休閒男鞋, ECCO ST.1 M 輕盈套入式緩震運動休閒鞋 男-黑
休閒男鞋, Royal Elastics 休閒鞋 Ketella 男鞋
休閒男鞋, ECCO LHASA時尚雕花舒適緩震紳士正裝鞋 男-黑
休閒男鞋, 成人男款海灘人字拖 sd0160 魔法Baby
休閒男鞋, Clarks 休閒鞋 Cotrell Edge 真皮 男鞋
休閒男鞋, Converse 休閒鞋 One Star 低筒 穿搭 男女鞋
休閒男鞋, Royal Elastics 休閒鞋 Adelaide 男鞋
休閒男鞋, Converse 休閒鞋 All Star 高筒 男女鞋
休閒男鞋, Royal Elastics 休閒鞋 London Hi 男鞋
休閒男鞋, Converse 休閒鞋 All Star 高筒 穿搭 男女鞋
休閒男鞋, Clarks運動行風 織面透氣襪套式鞋口輕量三瓣底男休閒鞋 黑色
休閒男鞋, Onitsuka Tiger MEXICO 66 SLIPON D7G0N藍
休閒男鞋, Converse 休閒鞋 All Star 低筒 穿搭 男鞋
休閒男鞋, Royal Elastics 休閒鞋 Icon Manhood 男鞋
休閒男鞋, Royal Elastics 休閒鞋 Icon 運動 男鞋
休閒男鞋, LACOSTE 男用真皮運動休閒鞋-黑色
休閒男鞋, 時尚紳士休閒拖鞋 sk0492 魔法Baby
休閒男鞋, Onitsuka Tiger HORIZONIA 休閒鞋 1183A206-401
休閒男鞋, ECCO SOFT 1 MENS 極簡舒適潮流休閒鞋 男-黑
休閒男鞋, Fly London(男) 哲學之思 手染自然色系綁帶休閒鞋 - 釉藍
休閒男鞋, Converse 休閒鞋 All Star 低筒 穿搭 男女鞋
休閒男鞋, OnitsukaTiger x迪士尼 Mexico Delegation 白
休閒男鞋, Royal Elastics 休閒鞋 Icon Z 男鞋
休閒男鞋, ECCO CROSS X 潮流運動休閒鞋-藍
休閒男鞋, Royal Elastics 休閒鞋 Icon 男鞋
休閒男鞋, Onitsuka Tiger MEXICO 66 男女休閒鞋1183A198
休閒男鞋, Converse Jack Purcell Jack 男女鞋
休閒男鞋, HANNFORT COZY 小豬動物家族懶人鞋-女-芋粉
休閒男鞋, Converse 休閒鞋 Shearling All Star 女鞋
休閒男鞋, Royal Elastics 休閒鞋 King 復古 男鞋
休閒男鞋, ECCO FLEXURE T-CAP M 輕彈皮革百搭休閒鞋 男-白
休閒男鞋, Onitsuka Tiger SERRANO女休閒鞋1182A077-400
休閒男鞋, Converse 休閒鞋 Pro Leather 運動 男女鞋
休閒男鞋, Converse 休閒鞋 One Star 低筒 穿搭 男女鞋
休閒男鞋, Royal Elastics 休閒鞋 Icon 復古 男鞋
休閒男鞋, KangaROOS 帆布厚底餅乾鞋 CRUST藍標袋鼠鞋系列 黑米 91260
休閒男鞋, Clarks 步步清新 簡約復古精緻縫線設計休閒男鞋 砂岩色
休閒男鞋, Clarks 科履行蹤 英式經典柔軟麂皮切爾西靴 深咖色
休閒男鞋, ECCO SOFT 8 M 柔軟皮革簡約休閒鞋 男-綠
休閒男鞋, Native Howard 透氣 防水 懶人鞋 男鞋 女鞋
休閒男鞋, Clarks 摩登經典-英倫時尚素面正裝休閒鞋 棕褐色
休閒男鞋, native JEFFERSON 男/女鞋-霧灰 x 香蕉黃
休閒男鞋, Onitsuka Tiger TSUNAHIKI 休閒鞋1183A085橘
休閒男鞋, Converse 休閒鞋 All Star 穿搭 男女鞋
休閒男鞋, 成人男款海灘夾腳拖鞋 sd0153 魔法Baby
休閒男鞋, ECCO COOL 2.0 360度環繞防水休閒運動鞋-黑
休閒男鞋, Converse 休閒鞋 One Star 低筒 穿搭 男女鞋
休閒男鞋, ECCO SOFT 7 M 經典簡約套入式休閒鞋 男-灰
休閒男鞋, OnitsukaTiger x迪士尼 Mexico Delegation 紅
休閒男鞋, native-JEFFERSON-男-女鞋-成熟普普風
休閒男鞋, Royal Elastics 休閒鞋 Adelaide  男鞋
休閒男鞋, Onitsuka Tiger Mexico 66 Slip-On 休閒鞋1182A087-101
