休閒男鞋, Converse 帆布鞋 All Star 低筒 運動 男鞋
休閒男鞋, Royal Elastics 休閒鞋 Bishop Hydra 男鞋
休閒男鞋, Royal Elastics 休閒鞋 Bishop 低筒 男鞋
休閒男鞋, Royal Elastics 休閒鞋 Pastor 低筒 男鞋
休閒男鞋, Converse 休閒鞋 All Star 低筒 男女鞋
休閒男鞋, Converse 休閒鞋 All Star 高筒 聯名 男女鞋
休閒男鞋, Converse 休閒鞋 Jack Purcell 穿搭 男女鞋 開口笑 基本款 帆布 鴛鴦 情侶鞋 黑 灰 167920C
休閒男鞋, Converse 休閒鞋 All Star 高筒 穿搭 男女鞋
休閒男鞋, Converse Chuck Taylor 休閒 女鞋
休閒男鞋, Royal Elastics 休閒鞋 Bishop Color 男鞋
休閒男鞋, Clarks 休閒鞋 Hale Lace 皮革 男鞋
休閒男鞋, Royal Elastics 休閒鞋 Pastor 低筒 男鞋
休閒男鞋, Royal Elastics 休閒鞋 Pastor 低筒 男鞋
休閒男鞋, Royal Elastics Icon Manhood 男鞋
休閒男鞋, Clarks 休閒皮鞋 Un Geo Lo 男鞋
休閒男鞋, Converse 休閒鞋 All Star 低筒 穿搭 男女鞋
休閒男鞋, Royal Elastics 休閒鞋 Pastor 低筒 男鞋
休閒男鞋, Native JEFFERSON PRINT男女款白藍幾何休閒鞋 -NO.11100101-8779
休閒男鞋, CCILU 編織平底休閒鞋-男款-301260001黑色
休閒男鞋, 男新潮拉風休閒拖鞋 sd5114 魔法Baby
休閒男鞋, 真皮扣飾兩穿涼拖鞋 男鞋
休閒男鞋, 台灣製成人舒適拖鞋(2雙一組) sd0013魔法Baby
休閒男鞋, Converse 休閒鞋 All Star 男女鞋
休閒男鞋, Converse 休閒鞋 All Star 男女鞋
休閒男鞋, Converse 休閒鞋 One Star 低筒 穿搭 男女鞋
休閒男鞋, Royal Elastics 休閒鞋 Genesis 穿搭 男鞋
休閒男鞋, Royal Elastics Bishop Checked男鞋
休閒男鞋, Clarks 休閒鞋 Cotrell Free 套腳 男鞋
休閒男鞋, Converse 休閒鞋 All Star 低筒 穿搭 男女鞋
休閒男鞋, Royal Elastics 休閒鞋 Icon 男鞋
休閒男鞋, Royal Elastics Prince Albert 男鞋
休閒男鞋, Royal Elastics Prince Albert 男鞋
休閒男鞋, Royal Elastics Icon Manhood 男鞋
休閒男鞋, Royal Elastics 休閒鞋 Smooth 男鞋
休閒男鞋, Clarks 休閒鞋 Oakland Seam 男鞋
休閒男鞋, Converse 休閒鞋 Jack Purcell 男女鞋
休閒男鞋, Royal Elastics Prince Albert 男鞋
休閒男鞋, Clarks 休閒鞋 Hale Lace 皮革 男鞋
休閒男鞋, Royal Elastics 休閒鞋 Icon 套腳 男鞋
休閒男鞋, Royal Elastics 休閒鞋 Adelaide 男鞋
休閒男鞋, Royal Elastics 休閒鞋 Icon Manhood 男鞋
休閒男鞋, Clarks 休閒鞋 Un Voyage Lace 男鞋
休閒男鞋, Royal Elastics Icon Manhood 男鞋
休閒男鞋, Royal Elastics 休閒鞋 Rider 男鞋
休閒男鞋, Royal Elastics 休閒鞋 SBI 低筒 穿搭 男鞋
休閒男鞋, Royal Elastics 休閒鞋 Genesis 低筒 穿搭 男鞋
休閒男鞋, Royal Elastics 休閒鞋 Rider 套腳 男鞋
休閒男鞋, Clarks 休閒鞋 Banbury Mid 中筒 男鞋
休閒男鞋, Royal Elastics 休閒鞋 Cruiser-Trek 男鞋
休閒男鞋, Royal Elastics Midnight Rider 男鞋
休閒男鞋, Royal Elastics 休閒鞋 Icon Genesis 穿搭 男鞋
休閒男鞋, Royal Elastics 休閒鞋 Icon Genesis 穿搭 男鞋
休閒男鞋, Converse 休閒鞋 One Star 低筒 穿搭 男鞋
休閒男鞋, Royal Elastics 休閒鞋 Meister 男鞋
休閒男鞋, Royal Elastics Icon Manhood 男鞋
休閒男鞋, Clarks 休閒鞋 Hale Rise 中筒 男鞋
休閒男鞋, Clarks 皮鞋 Banbury Limit 正裝 男鞋
休閒男鞋, Clarks 休閒鞋 Nature II 外出 荔枝紋 男鞋
休閒男鞋, Clarks 休閒鞋 Un Abode Go 男鞋
休閒男鞋, Royal Elastics Icon Manhood 男鞋
休閒男鞋, Converse Chuck Taylor 休閒  男鞋 女鞋
休閒男鞋, Royal Elastics 休閒鞋 Icon Manhood 男鞋
休閒男鞋, Royal Elastics 休閒鞋 Icon Cross 男鞋
休閒男鞋, Clarks 休閒鞋 Un Abode Go 男鞋
休閒男鞋, Clarks 皮鞋 Banbury Lace 正裝 男鞋
休閒男鞋, Royal Elastics 休閒鞋 Icon Genesis 男鞋
休閒男鞋, Clarks 涼拖鞋 TriCove Sun 三瓣底 男鞋
休閒男鞋, Clarks 休閒皮鞋 Un Geo Lace 男鞋
休閒男鞋, Clarks 涼拖鞋 Un Trek Part 男鞋
休閒男鞋, Royal Elastics Icon Genesis 男鞋
休閒男鞋, Palladium PAMPA HI ORGANIC 男休閒鞋 軍綠色
休閒男鞋, Royal Elastics 休閒鞋 Icon Manhood 男鞋
休閒男鞋, Royal Elastics 休閒鞋 Genesis 穿搭男鞋
休閒男鞋, Royal Elastics 休閒鞋 Bishop Hydra 男鞋
休閒男鞋, Clarks 休閒鞋 Glide Chukka 中筒 男鞋
休閒男鞋, Converse All Star Hi 基本款 休閒 男鞋 女鞋
休閒男鞋, Clarks 休閒鞋 Glaston Mid 中筒 男鞋
休閒男鞋, Royal Elastics 休閒鞋 Cruiser-Trek 男鞋
休閒男鞋, Clarks 休閒鞋 Un Costa Step 男鞋
休閒男鞋, Royal Elastics 休閒鞋 Icon Genesis 穿搭 男鞋
休閒男鞋, Clarks 休閒鞋 Raharto Way 真皮 皮革 男鞋
休閒男鞋, Royal Elastics Icon Manhood 男鞋
休閒男鞋, Royal Elastics 休閒鞋 Smooth 男鞋
休閒男鞋, Royal Elastics Icon Manhood 男鞋
休閒男鞋, Converse 休閒鞋 Jack Purcell 穿搭 男女鞋 基本款 簡約 漆皮 開口笑 情侶鞋 黑 白 168134C
休閒男鞋, Royal Elastics 休閒鞋 Icon Genesis 男鞋
休閒男鞋, Royal Elastics 休閒鞋 Adelaide 男鞋
休閒男鞋, Royal Elastics 休閒鞋 Adelaide 男鞋
休閒男鞋, Clarks 皮鞋 Un Aldric Park 正裝 男鞋
休閒男鞋, Palladium PAMPA HI ORGANIC 男休閒鞋 白色
休閒男鞋, Converse 休閒鞋 All Star 高筒 穿搭 男女鞋 基本款 三星黑標 拼接 情侶鞋 藍 黑 167828C
休閒男鞋, Clarks 涼拖鞋 Vine Cedar 真皮 皮革 男鞋
休閒男鞋, Royal Elastics 休閒鞋 Genesis 穿搭男鞋
休閒男鞋, Clarks 休閒鞋 Un Lisbon Lace 男鞋
休閒男鞋, Clarks 皮鞋 Banbury Limit 正裝 男鞋
休閒男鞋, 休閒鞋 Converse All Star 基本款 男鞋 女鞋
休閒男鞋, Clarks 休閒鞋 TriVerve Slip 男鞋
休閒男鞋, Clarks 休閒鞋 Un Rise Lace 男鞋
休閒男鞋, Royal Elastics 休閒鞋 Icon Genesis 男鞋
休閒男鞋, Clarks 休閒鞋 Un Trail Step 外出 男鞋
休閒男鞋, Royal Elastics Prince Albert 男鞋
休閒男鞋, Royal Elastics Icon Manhood 男鞋
休閒男鞋, Clarks 涼鞋 TriCove Sun 男鞋
休閒男鞋, Clarks 皮鞋 Un Sheridan Go 男鞋
休閒男鞋, Royal Elastics 休閒鞋 Prince 男鞋
休閒男鞋, Teva 涼鞋 Original Universal 男鞋
休閒男鞋, PALLADIUM PAMPA OX ORIGINALE 男休閒鞋 75331060 黑
休閒男鞋, Kai Shin 專業鋼頭安全工作鞋 黑色 M-PLU603YI01-E
休閒男鞋, Clarks 休閒鞋 Un Rise Step 男鞋
休閒男鞋, PALLADIUM Pampa HI Originale TC 男女休閒鞋 75554060 黑
休閒男鞋, Kai Shin 寬楦 鋼包頭 安全工作鞋 M-PLU401YI01-E
休閒男鞋, Kai Shin 高筒 鋼包頭 安全工作鞋 褐色 M-G6010C00-ST
休閒男鞋, Kai Shin 鋼包頭 安全工作鞋 褐色 MGA574C00
休閒男鞋, Kai Shin 鋼包頭 防穿刺 安全工作鞋 鵝黃色 U-312B02
休閒男鞋, SANUK VAGABOND CHILL 復古格紋內刷毛寬版懶人鞋-男款(黑色)
休閒男鞋, 男鞋 台灣製輕量休閒晴雨洞洞鞋sd7221 魔法Baby
休閒男鞋, Native JEFFERSON 男女款粉色休閒鞋 -NO.11100100-6801
休閒男鞋, (男)Ponic&Co美國加州環保防水洞洞半包式拖鞋-灰褐色
休閒男鞋, 男流線新潮運動拖鞋 sd0616 魔法Baby
休閒男鞋, Timberland 男款黑色磨砂革側拉鍊靴|A41AE
休閒男鞋, 男水陸兩用輕便鞋 sd0497 魔法Baby
休閒男鞋, 男輕量美型夾腳拖鞋 sd0534 魔法Baby
休閒男鞋, 男軟Q緩震舒適拖鞋 sd5120 魔法Baby
休閒男鞋, PQ 真皮縫線造型綁帶皮鞋 男鞋 - 棕(另有黑)
休閒男鞋, Kai Shin 鋼包頭 安全工作鞋 咖啡色 M-PTL273A03
休閒男鞋, 男韓系耐磨防踢餅乾鞋 sa93029 魔法Baby
休閒男鞋, SANUK 復古人字編織紋休閒鞋-男款(灰色)
休閒男鞋, KANGAROOS 男 RUNAWAY ROOS復古跑鞋(黑)
休閒男鞋, 男韓系耐磨防踢餅乾鞋 sa93020 魔法Baby
休閒男鞋, HANNFORT COZY可機洗百搭帆布氣墊拖鞋-男-卡其
休閒男鞋, KangaROOS 輕量編織幻彩反光慢跑鞋 RUN SWIFT粉芋紫 91093
休閒男鞋, W&M 真皮滾邊防滑休閒鞋 男鞋 - 黑(另有可可)
休閒男鞋, 男鞋 台灣製時尚運動風拖鞋sd7141 魔法Baby
休閒男鞋, TEVA 原廠貨 男 Omnium Drift 水陸輕量護趾涼鞋/雨鞋/水鞋-黑色
休閒男鞋, ECCO CORKSPHERE 1 M 時尚鏤空透視休閒鞋 男-黑
休閒男鞋, Kai Shin 皮革安全鞋 黑色 MGU020N01-KP
休閒男鞋, 輕量水陸兩用輕便鞋 sd7041 魔法Baby
休閒男鞋, PAMAX帕瑪斯-兼具運動鞋、休閒鞋、慢跑鞋-PP135-BBB-男女
休閒男鞋, TEVA 原廠貨-男 Arrowood 2 Low WP 低筒防潑水休閒鞋 黑
休閒男鞋, 軟Q止滑室外拖鞋 藍 sd0121 魔法Baby
休閒男鞋, 成人吸震耐磨運動型夾腳拖鞋 sd7002 魔法Baby
休閒男鞋, Kai Shin 鋼包頭 防穿刺 低筒 安全工作鞋 U-401BPDS01
休閒男鞋, SANUK-CHIBA WAFFLE格紋編織寬版懶人鞋-男款(咖啡色)
休閒男鞋, HANNFORT COZY可機洗帆布氣墊懶人靴-男-沈穩黑
休閒男鞋, WALKING ZONE 多功能防水防污防塵噴霧
休閒男鞋, 男蓆面清涼極輕拖鞋 sd5126 魔法Baby
休閒男鞋, CCILU 彈性織布運動休閒鞋-男款-301301027白色
休閒男鞋, W&M 直套式增高厚底男皮鞋-黑(另有卡其)
休閒男鞋, SANUK-CHIBA 寬版懶人鞋-男款(鐵灰色)
休閒男鞋, SAPATOTERAPIA 巴西雕花綁帶紳士男鞋黑另有棕
休閒男鞋, SAPATOTERAPIA 巴西輕量質感紳士 男皮鞋-咖
休閒男鞋, SANUK VAGABOND CHILL 復古格紋內刷毛寬版懶人鞋-男款(灰色)
休閒男鞋, 男潮款休閒拖鞋 sd5048 魔法Baby
休閒男鞋, SAPATOTERAPIA 巴西男士雕花繫帶皮鞋男鞋棕另有黑
休閒男鞋, W&M 交叉寬帶 露齒涼鞋 男鞋-棕(另有黑)
休閒男鞋, 男運動鞋 台灣製男款休閒健走鞋sd7164 魔法Baby
休閒男鞋, Kai Shin 鋼包頭 安全工作鞋 黃褐色 M-G6010N02-ST
休閒男鞋, TEVA 原廠貨-男 Arrowood 2 Low WP 低筒防潑水休閒鞋 橄欖綠
休閒男鞋, SANUK 復古帆布懶人鞋-男款(藍色)
休閒男鞋, 男軟Q緩震按摩休閒拖鞋 sd0576 魔法Baby
休閒男鞋, native JEFFERSON 男/女鞋-金平糖黑
休閒男鞋, NATIVE JEFFERSON 男女鞋深藍色情侶休閒鞋 NO.11100100-4201
休閒男鞋, W&M 皮質彈性帶直套式運動休閒鞋 男鞋 - 棕(另有黑)
休閒男鞋, SANUK VICE TX內格紋懶人鞋-男款(咖啡色)
休閒男鞋, 美國Chaco。男 戶外運動涼鞋 沙灘款CH-ETM01HE25 (顫動深藍)
休閒男鞋, HANNFORT COZY 小豬動物家族懶人鞋-女-藕棕
休閒男鞋, TEVA 原廠貨 男 Ember Moc 菠蘿麵包鞋-美國大峽谷 GC100湖水藍
休閒男鞋, 男時尚新潮休閒運動拖鞋 sd5160 魔法Baby
休閒男鞋, 男台灣製輕量高彈力運動拖鞋 sa93770 魔法Baby
休閒男鞋, KANGAROOS 男 COMBAT 經典口袋鞋(藍黑)
休閒男鞋, HANNFORT COZY可機洗樂福氣墊休閒鞋-男-質感黑
休閒男鞋, CCILU 舒適網布休閒運動鞋-男款-301322001酷炫黑
休閒男鞋, 涼鞋．阿亮代言G.P情侶款磁扣排水休閒舒適海灘涼拖鞋．寶藍/黑紅/綠【鞋鞋俱樂部】【255-G9243】
休閒男鞋, 台灣製減壓足弓夾腳拖  sd0006 魔法Baby
休閒男鞋, PLAY BOY休閒拖鞋(2雙一組) 咖 sh0007 魔法Baby
休閒男鞋, 美國Chaco。男 戶外運動涼鞋 沙灘款CH-ETM01HE27 (松綠口風琴)
休閒男鞋, 男極輕量休閒懶人鞋 sd7009 魔法Baby
休閒男鞋, SANUK 素面舒適綁帶休閒鞋-男款(藍色)SMF11194 BLU
休閒男鞋, TEVA Arrowood 2 Mid WP 男休閒鞋 中筒 黑
休閒男鞋, (男/女)Ponic&Co美國加州環保防水綁帶休閒鞋*灰色
休閒男鞋, TEVA 原廠貨 男 Arrowood Slip-On 輕量休閒鞋 (藍)
休閒男鞋, ECCO SOFT 8 MEN'S 簡約休閒鞋-黑
休閒男鞋, W&M-真皮人字拖夾腳拖 男鞋-黑(另有咖)
休閒男鞋, Onitsuka Tiger CALIFORNIA 78 EX 男女休閒鞋(白)
休閒男鞋, Native JEFFERSON BLOCK 男女款淺藍休閒鞋 -NO.11100102-8766
休閒男鞋, SANUK 口袋系列牛仔帆布懶人鞋-男款(咖啡色)
休閒男鞋, HANNFORT RS8彈性布復古氣墊休閒鞋-男-低調藍
休閒男鞋, WALKING ZONE 皮革直套運動休閒鞋 男鞋 - 黑(另有藍)
休閒男鞋, 男台灣製輕量高彈力夾腳運動拖鞋 sa93766 魔法Baby
休閒男鞋, 成人 吸震耐磨美型運動拖鞋 sd7001 魔法Baby
休閒男鞋, 亞麻蓆清涼拖鞋 sd5099 魔法Baby
休閒男鞋, WALKING ZONE 絨面皮革直套開車鞋 男鞋 - 藍(另有灰)
休閒男鞋, HANNFORT CANYON網布休閒鞋-男-曜岩黑
休閒男鞋, 男時尚潮款休閒拖鞋 sd5084 魔法Baby
休閒男鞋, WALKING ZONE 極簡雅痞懶人鞋休閒鞋 男鞋-灰棕(另有藍)
休閒男鞋, SAPATOTERAPIA 巴西真皮雙拼接時尚休閒鞋 男鞋-黑
休閒男鞋, 男軟Q緩震工學足弓舒適拖鞋 sd5111 魔法Baby
休閒男鞋, HANNFORT COZY可機洗百搭帆布氣墊拖鞋-男-深藍(8H)
休閒男鞋, Timberland 男款中灰色磨砂革輕質皮鞋|A2J64
休閒男鞋, TEVA 原廠貨-男 Arrowood 2 Mid WP 中筒防潑水休閒鞋 海軍藍
休閒男鞋, TEVA Original Universal Moto 男休閒涼鞋 灰
休閒男鞋, native JEFFERSON 男/女鞋-鴿子灰x反射光
休閒男鞋, ECCO SOFT 8 MEN S 簡約撞色鬆緊帶設計休閒鞋 男-黑
休閒男鞋, TEVA Terra-Float Univ 2.0 男休閒涼鞋
休閒男鞋, 男鞋 台灣製時尚潮流高筒休閒布鞋sd7166 魔法Baby
休閒男鞋, Timberland 男款小麥黃色保暖6吋靴|6717B
休閒男鞋, TEVA 原廠貨-男 Arrowood 2 Mid WP 中筒防潑水休閒鞋 黑
休閒男鞋, PQ 真皮扣飾兩穿涼拖鞋 男鞋 - 藍(另有咖)
休閒男鞋, W&M 直套式增高厚底男皮鞋-卡其(另有黑)
休閒男鞋, Native JEFFERSON 男女款牛奶藍 情侶休閒鞋 -NO.11100102-9219
休閒男鞋, Kai Shin 鋼包頭 防穿刺 安全工作鞋 黑色 U-312B01
休閒男鞋, HANNFORT ICE萊卡彈力運動休閒鞋-男-勁量黑
休閒男鞋, WALKING ZONE 皮革綁帶壓紋休閒鞋 男鞋 - 黑(另有棕)
休閒男鞋, WALKING ZONE(男)素面時尚棒球車線踩腳鞋-米(另有咖/藍)
休閒男鞋, native JEFFERSON 男/女鞋-花卉白
休閒男鞋, (男)Ponic&Co美國加州環保防水編織懶人鞋-藍白紅
休閒男鞋, native JIMMY CITYLITE 獵鴨男/女靴-橄欖綠
休閒男鞋, WALKING ZONE 針織透氣綁帶運動鞋 男鞋-藍(另有黑)
休閒男鞋, Kai Shin 安全工作鞋 褐色 M-PLA574FG02
休閒男鞋, SANUK 復古帆布懶人鞋-男款(黑色)
休閒男鞋, SANUK 經典素面帆布懶人鞋-男款(鐵灰色)SMF1001 CHR
休閒男鞋, Native JEFFERSON 男女款黑色情侶休閒鞋-NO.11100100-1105
休閒男鞋, 男新潮美型海灘夾腳拖鞋 sd7066 魔法Baby
休閒男鞋, W&M 真皮滾邊休閒懶人鞋 男鞋 - 紅棕(另有藍)
休閒男鞋, WALKING ZONE 皮質直套輕量運動休閒鞋 男鞋 - 藍(另有灰棕)
休閒男鞋, 極輕休閒夾腳拖鞋 sk0618 魔法Baby
休閒男鞋, W&M 真皮彈性防滑休閒鞋 男鞋 - 橘棕(另有黑)
休閒男鞋, WALKING ZONE X Kellykiw夢想太空人親子鞋- 塗鴉白
休閒男鞋, 軟Q緩震止滑拖鞋 灰 sd0181 魔法Baby
休閒男鞋, SANUK PICK POCKET TWEED 混紗口袋懶人鞋-男款(藍色)
休閒男鞋, HANNFORT COZY可機洗帆布氣墊懶人靴-男-軍墨綠
休閒男鞋, W&M 皮質綁帶防滑休閒鞋 男鞋 - 灰咖(另有紅棕)
休閒男鞋, WALKING ZONE 極致舒適工藝車縫耐磨休閒男鞋-咖(另有藍)
休閒男鞋, 美國Chaco男越野運動涼鞋限量標準款CH-ACM01EH97 (優勝美地)
休閒男鞋, SANUK 口袋系列懶人鞋-男款(褐色)SMF1032 TAN
休閒男鞋, SANUK 男款US11 牛仔布拼接綁帶休閒鞋(咖啡色)
休閒男鞋, 超軟Q輕量透氣舒適拖鞋 sd0566 魔法Baby
休閒男鞋, PLAY BOY休閒拖鞋(2雙一組) 深藍 sh0006 魔法Baby
休閒男鞋, SANUK 口袋系列牛仔帆布懶人鞋-男款(灰色)
休閒男鞋, 男休閒海灘拖鞋 sd5034 魔法Baby
休閒男鞋, SANUK 男款US10 牛仔布拼接綁帶休閒鞋(咖啡色)
休閒男鞋, 男軟Q舒適拖鞋 sd5064 魔法Baby
休閒男鞋, SANUK 收邊款素面懶人鞋-男款(深藍色)SMF10629 DKNV
休閒男鞋, 亞麻蓆清涼拖鞋 sd5100 魔法Baby
休閒男鞋, PAMAX帕瑪斯【頂級專利氣墊、透氣布面止滑鞋】 PP668A09
休閒男鞋, TEVA Ember Moc 男經典波羅麵包鞋 黑
休閒男鞋, native JEFFERSON 男/女鞋-貝殼白x小星星
休閒男鞋, 軟Q止滑室內外兩用拖鞋 sd8006 魔法Baby
休閒男鞋, 台灣製減壓舒適拖鞋(2雙一組) sd0017魔法Baby
休閒男鞋, 台灣製減壓足弓夾腳拖  sd0032 魔法Baby
休閒男鞋, Fitkicks 摺疊輕量休閒鞋 男 設計款 (黑)
休閒男鞋, SAPATOTERAPIA 巴西型男針織布拼接皮革休閒鞋 男鞋-藍(另有黑)
休閒男鞋, TEVA Terra-Float Univ 2.0 男休閒涼鞋
休閒男鞋, 老人當家 海夫 ASAHI 快步主義 健走鞋 M021 日本製
休閒男鞋, Native 男女款粉白色情侶休閒鞋-NO.11101801-8812
休閒男鞋, PAMAX帕瑪斯-超彈力氣墊高抓地力戰鬥安全靴-PX8711EH
休閒男鞋, 男輕量水陸兩用涼鞋  sd7081 魔法Baby
休閒男鞋, native JEFFERSON 男/女鞋-豆黃x秋海棠橘
休閒男鞋, SAPATOTERAPIA 巴西方頭綁帶紳士皮鞋 男鞋-咖
休閒男鞋, Kai Shin 高筒安全工作鞋 褐色 M-G5050C00-KP
休閒男鞋, 男潮款休閒拖鞋 sd5047 魔法Baby
休閒男鞋, 男軟Q緩震按摩顆粒健康拖鞋 sd5155 魔法Baby
休閒男鞋, HANNFORT CARIBBEAN編織牛皮休閒鞋-男-極簡黑
休閒男鞋, (男/女)Ponic&Co美國加州環保防水綁帶休閒鞋*紅色
休閒男鞋, 美國Chaco。男 越野沙灘夾腳拖鞋CH-PLM01HF43 (瞬光水綠)
休閒男鞋, ECCO COOL M 360度環繞防水休閒運動鞋 男鞋-黑色
休閒男鞋, 男軟Q舒適按摩顆粒拖鞋 sd0509 魔法Baby
休閒男鞋, Fly London(男)- WARMUP 暖男專用 都會輕量運動鞋-烈陽紅
休閒男鞋, Timberland 男款馬鞍棕空氣彈力休閒鞋|A2E8G
休閒男鞋, WALKING ZONE 極致舒適工藝車縫耐磨休閒男鞋-藍(另有咖)
休閒男鞋, W&M 時尚機能休閒夾腳拖鞋 男鞋-棕(另有黑)
休閒男鞋, 台灣製運動風拖鞋 sd7105 魔法Baby
休閒男鞋, PAMAX帕瑪斯-兼具運動鞋、休閒鞋、慢跑鞋-PP369-BW
休閒男鞋, native JEFFERSON 男/女鞋-金平糖灰
休閒男鞋, 拖鞋．阿亮代言G.P 輕量舒適雙帶拖鞋．綠/黑灰/藍【鞋鞋俱樂部】【255-G8547M】
休閒男鞋, TEVA Ember Moc 男經典波羅麵包鞋 午夜海軍藍
休閒男鞋, PAMAX帕瑪斯-兼具運動鞋、休閒鞋、慢跑鞋-PP369-ABR
休閒男鞋, PQ 真皮雕花壓紋造型綁帶皮鞋 男鞋 - 黑(另有棕)
休閒男鞋, W&M 透氣拼接直套運動休閒鞋 男鞋 - 藍(另有黑)
休閒男鞋, 台灣製減壓足弓夾腳拖  sd0028 魔法Baby
休閒男鞋, SANUK 牛仔布內漸層綁帶休閒鞋-男款(墨綠色)SMF10627 OTN
休閒男鞋, W&M Fit 系列 健走健塑鞋 亮皮直套休閒男鞋-咖
休閒男鞋, Onitsuka Tiger MEXICO 66 PARATY TH6P4N
休閒男鞋, Kai Shin 高筒安全工作鞋 褐色 M-G6010C00-KP
休閒男鞋, 軟Q緩震止滑拖鞋 綠 sd0182 魔法Baby
休閒男鞋, 涼鞋． 阿亮代言G.P排水透氣休閒涼鞋．黑/黑紅/寶藍【鞋鞋俱樂部】【255-G9251】
休閒男鞋, PQ 經典流線型繫帶皮鞋 男鞋 - 咖(另有黑)
休閒男鞋, Timberland 男款黑色帆布休閒鞋|A1ZRT
休閒男鞋, SANUK 蠟帆布休閒鞋-男款(藍色)
休閒男鞋, 成人男款夾腳拖鞋 sd8036 魔法Baby
休閒男鞋, 男新潮拉風休閒拖鞋 sd5115 魔法Baby
休閒男鞋, ECCO ECCO SOFT 8 M 時尚單色套入式休閒鞋  男-黑
休閒男鞋, SANUK 男款US12 牛仔布拼接綁帶休閒鞋(咖啡色)
休閒男鞋, PAMAX帕瑪斯-兼具運動鞋、休閒鞋、慢跑鞋-PP369-BYY
休閒男鞋, PAMAX帕瑪斯-兼具運動鞋、休閒鞋、慢跑鞋-PP369-WBOO
休閒男鞋, HANNFORT 休閒鞋 CARIBBEAN 2Way後踩運動休旅鞋-男-海軍藍
休閒男鞋, W&M (男)帥性交叉 真皮氣墊感涼鞋-咖(另有黑)
休閒男鞋, TEVA Ember Lace 男經典波羅麵包鞋 中筒 黑
休閒男鞋, W&M 皮質綁帶防滑休閒鞋 男鞋 - 紅棕(另有灰咖)
休閒男鞋, 美國Chaco男越野舒壓運動涼鞋標準款CH-ZLM01HE04 (蚻鶧v釦)
休閒男鞋, SANUK PICK POCKET TWEED 混紗口袋懶人鞋-男款(棕色)
休閒男鞋, 男經典時尚雙扣休閒拖鞋 sd5033 魔法Baby
休閒男鞋, 高彈性吸震止滑拖鞋 sd5130 魔法Baby
休閒男鞋, W&M 真皮滾邊防滑休閒鞋 男鞋 - 可可(另有黑)
休閒男鞋, PAMAX帕瑪斯-超機能頂級雙氣墊機能鞋-PP0001-01-男女
休閒男鞋, SANUK 素面帆布懶人鞋-男款(灰色)SMF1001 GRY
休閒男鞋, Timberland 男款淺駝色磨砂革綁帶帆船鞋|A2CHN
休閒男鞋, SANUK 復古運動外型設計款休閒鞋-男款(藍色)
休閒男鞋, Fly London(男)- WARMUP 暖男專用 都會輕量運動鞋-藍海藍
休閒男鞋, Kai Shin 安全工作鞋 深咖色 M-G4040A03-KP
休閒男鞋, 【PAMAX帕瑪斯】【超彈力氣墊止滑鞋】透氣布面、夜間反光、抗滑鞋、工作鞋
休閒男鞋, Timberland 童款小麥黃經典防水6吋靴|12709
休閒男鞋, HEY DUDE(男) 四孔透氣棉布輕量休閒鞋  -漾輕灰
休閒男鞋, SANUK-CHIBA 寬版懶人鞋-男款(墨綠色)
休閒男鞋, 男軟Q舒適休閒拖鞋 sd5161 魔法Baby
休閒男鞋, SANUK 素面內印花綁帶休閒鞋-男款(深灰色)
休閒男鞋, HANNFORT COZY可機洗英倫風格紋布氣墊懶人鞋-男-黑
休閒男鞋, TEVA Original Universal Kasina 男 休閒涼鞋 迷彩
休閒男鞋, W&M 透氣拼接直套運動休閒鞋 男鞋 - 藍(另有黑)
休閒男鞋, 男鞋 台灣製時尚潮流高筒休閒鞋sd7172 魔法Baby
休閒男鞋, 成人男款海灘人字拖 sd0157 魔法Baby
休閒男鞋, 成人男款海灘拖鞋 sd8003 魔法Baby
休閒男鞋, PQ 真皮縫線造型綁帶皮鞋 男鞋 -黑
休閒男鞋, W&M 皮質可調式魔鬼氈涼鞋 男鞋 - 咖(另有黑)
休閒男鞋, Converse Breakpoint Pro 男女鞋
休閒男鞋, Timberland 男款白色織面休閒鞋|A29HZ
休閒男鞋, HEY DUDE(男) 四孔透氣棉布輕量休閒鞋  - 雅仕棕
休閒男鞋, Converse 休閒鞋 All Star 高筒 穿搭 男女鞋 基本款 簡約 三星黑標 帆布 情侶款 167862C
休閒男鞋, PAMAX 帕瑪斯【頂級專利氣墊、戶外休閒工作靴】健康機能鞋、寬楦型
休閒男鞋, Timberland 男款磚紅色防水皮革六吋靴|A1ZK8
休閒男鞋, Kai Shin 高筒安全工作鞋 深咖啡 MGU532A03-KP
休閒男鞋, SANUK 素面麻布懶人鞋-男款(墨綠色)SMF1010 OLV
休閒男鞋, PAMAX帕瑪斯-兼具運動鞋、休閒鞋、慢跑鞋-PP369-WOBO
休閒男鞋, Native JEFFERSON 男女款休閒鞋 -NO.11100100-4271
休閒男鞋, SAPATOTERAPIA 巴西男士透氣休閒鞋 深藍另有卡其
休閒男鞋, PQ 時尚貴族風 雕花男皮鞋- 黑(另有咖)
休閒男鞋, SAPATOTERAPIA 巴西牛皮繫帶休閒鞋 男鞋-藍(另有黑)
休閒男鞋, PQ 素面側車線紳士德比鞋 男鞋 - 棕(另有黑)
休閒男鞋, 軟Q止滑室內外兩用拖鞋 sd8018 魔法Baby
休閒男鞋, SAPATOTERAPIA 巴西男士百搭皮革休閒鞋 男鞋-黑
休閒男鞋, PAMAX帕瑪斯-兼具運動鞋、休閒鞋、慢跑鞋-PP369-BWOO
休閒男鞋, HANNFORT CARIBBEAN編織休閒鞋-男-灰
休閒男鞋, W&M 皮質彈性帶直套式運動休閒鞋 男鞋 - 黑(另有棕)
休閒男鞋, 【PAMAX帕瑪斯】【超彈力氣墊止滑鞋】透氣布面、夜間反光、抗滑鞋、工作鞋
休閒男鞋, W&M 皮質柔軟舒適拖鞋 男鞋 - 黑(另有咖)
休閒男鞋, W&M MODARE 素色 透氣舒適彈性 男鞋-黑(另有藍)
休閒男鞋, Converse 戶外鞋 Golf le Fleur 運動 男女鞋 麂皮 小花 舒適 聯名球鞋 情侶穿搭 藍 黃 168180C
休閒男鞋, Converse All Star 1970 男鞋 女鞋
休閒男鞋, 成人男款海灘拖鞋 sd8004 魔法Baby
休閒男鞋, PAMAX帕瑪斯-第一機能止滑運動鞋、休閒鞋、慢跑鞋-PP369-BY
休閒男鞋, PAMAX帕瑪斯-兼具運動鞋、休閒鞋、慢跑鞋-PP369-BWP
休閒男鞋, PQ 都會紳士雕花綁帶皮鞋 男鞋 - 黑
休閒男鞋, 男潮款休閒拖鞋 sd5072 魔法Baby
休閒男鞋, (男/女)Ponic&Co美國加州環保防水綁帶休閒鞋*藍色
休閒男鞋, 涼鞋．阿亮代言G.P舒適排水透氣休閒涼鞋．黑/黑紅/藍【鞋鞋俱樂部】【255-G9262】
休閒男鞋, PAMAX帕瑪斯-兼具運動鞋、休閒鞋、慢跑鞋-PP369-BWY
休閒男鞋, HANNFORT ICE編織網布流線休閒鞋-男-動感黑
休閒男鞋, 真皮扣飾兩穿涼拖鞋 男鞋
休閒男鞋, 男時尚帥氣休閒拖鞋 sd7069 魔法Baby
休閒男鞋, PQ 雕花繫帶德比鞋 男鞋 - 黑
休閒男鞋, PQ 嚴選W壓紋紳士皮鞋 男鞋 - 黑
休閒男鞋, Converse Chuck Taylor MC18 男女鞋
休閒男鞋, Converse 休閒鞋 All Star 男女鞋
休閒男鞋, ECCO ST.1 LITE M 皮革防水運動休閒鞋 男-白
休閒男鞋, Timberland 男款黑色花紋滾邊大齒靴|A2DS2
休閒男鞋, Fly London(男)-BAND潮意志 都會輕量直套運動鞋-強力黑
休閒男鞋, Timberland 男款中駝色絨面革休閒鞋|A24RB
休閒男鞋, FitFlop TRAKK II 經典全皮革夾腳涼鞋-男(勃根地酒紅色)
休閒男鞋, SAPATOTERAPIA 巴西男士百搭繫帶皮革休閒鞋 男鞋-黑
休閒男鞋, HEY DUDE(男) 無帶直套式加厚水洗棉布輕量休閒鞋  - 放空灰
休閒男鞋, ECCO MELBOURNE 紳士商務正裝樂福鞋 男鞋-褐色
休閒男鞋, W&M 素面綁帶紳士德比鞋 男鞋 - 黑
休閒男鞋, FitFlop FINEKNIT運動風繫帶休閒鞋 炭灰色
休閒男鞋, Kai Shin 安全工作鞋 黑色 MGA574F01
休閒男鞋, Kai Shin 高筒安全工作鞋 黃褐色 MGU020N02-KP
休閒男鞋, FitFlop CHI TM  BACK-STRAP SANDALS 黑
休閒男鞋, Timberland 男款黑色素面防水六吋靴
休閒男鞋, CONVERSE Chuck Taylor All Star -中性情侶基本款黑色低筒休閒鞋-  NO.M5039C
休閒男鞋, HEY DUDE(男) 四孔加厚水洗棉布輕量休閒鞋  - 年代藍
休閒男鞋, Converse 休閒鞋 PL 76 男鞋 女鞋
休閒男鞋, Timberland 男款小麥色兩穿迷彩反折靴|A1HAE
休閒男鞋, 法國公雞牌運動鞋 LZF7024299-女-黑
休閒男鞋, FitFlop LOAFF SKATES CANVAS NEOPRENE藍
