休閒男鞋, Timberland 男款藍色舒適經典休閒鞋|A21CW
休閒男鞋, Timberland 男款小麥黃正絨面皮革休閒鞋
休閒男鞋, Timberland 男款黑色全粒面休閒鞋|A1XSX
休閒男鞋, Timberland 男款淺褐色絨面革休閒牛津鞋|A1XGB
休閒男鞋, Timberland 男款泥炭色拼接休閒鞋|A1XNL
休閒男鞋, Timberland 男款小麥黃磨砂革休閒靴|A1Z3K
休閒男鞋, Timberland 男款深綠色布魯克林休閒鞋|A2J2Y
休閒男鞋, Onitsuka Tiger Mexico 66 Slip-On 休閒鞋1183A360-103
休閒男鞋, Timberland 男款銹鐵棕磨砂革運動休閒鞋|A2HRP
休閒男鞋, Timberland 男款深棕色全粒面經典帆船鞋|25077
休閒男鞋, Timberland 男款深咖啡避震防滑低筒防水鞋|A11MO
休閒男鞋, Timberland 男款中駝色磨砂革靴|A28BS
休閒男鞋, Timberland 男款深棕色磨砂革帆船鞋|A17YV
休閒男鞋, Timberland 男款黑色磨砂革休閒鞋|A23VT
休閒男鞋, Timberland 男款馬鞍棕鋸齒皮革鞋|A2A25
休閒男鞋, Timberland 男款橄欖絨面革休閒鞋|A2AJP
休閒男鞋, Timberland 男款黑色磨砂革帆船皮鞋|A17YR
休閒男鞋, Timberland 男款淺灰褐絨面革拚接運動鞋|A2441
休閒男鞋, Timberland 男款中棕色絨面革拚接運動鞋|A247S
休閒男鞋, OnitsukaTiger Mexico66 休閒鞋1183A348-100
休閒男鞋, Timberland 男款黑色絨面革防水登山鞋|A1PG2
休閒男鞋, Timberland 男款小麥色磨砂革牛津休閒鞋|A2BUN
休閒男鞋, Timberland 男款葡萄葉綠織布布蘭克林鞋|A2D8G
休閒男鞋, Onitsuka Tiger MEXICO 66 SD 男女休閒鞋 米
休閒男鞋, FitFlop iQUSHION 輕量人體工學戲水夾腳拖-男(淺木色)
休閒男鞋, Timberland 男款中棕色絨面革防水登山鞋|A267W
休閒男鞋, FitFlop SPORTYSTEP TOE-THONGS 夾腳涼鞋 淺灰色
休閒男鞋, Timberland 男款中灰色布魯克林休閒鞋|A2J3A
休閒男鞋, Timberland 男款中灰色磨砂革休閒牛津鞋|A2AJE
休閒男鞋, Timberland 男款橄欖全粒面綁帶帆船鞋|A2HUJ
休閒男鞋, Timberland 男款黑色布魯克林休閒鞋|A2J3W
休閒男鞋, Converse CHUCK TAYLOR ALL STAR 70 Fuzzy Bunny 男女款-NO.155447C
休閒男鞋, Onitsuka Tiger MEXICO 66 SLIP-ON D3K0N
休閒男鞋, (男)VANS Slip-On Pro 經典素色懶人鞋*黑色
休閒男鞋, Onitsuka Tiger x 米奇90週年聯名款 MEXICO 66 白
休閒男鞋, Onitsuka Tiger GSM 男女休閒鞋 D5K2Y-101
休閒男鞋, Timberland 男款中棕色磨砂革經典六吋靴|73543
休閒男鞋, (男)VANS Old Skool 經典素面休閒鞋*紅色
休閒男鞋, Timberland 男款黑色絨面革拚接運動鞋|A24V2
休閒男鞋, FitFlop TRAKK II 經典全皮革夾腳涼鞋-男(海軍藍)
休閒男鞋, Onitsuka Tiger Mexico 66 Slip-On 休閒鞋1183A239-401
休閒男鞋, 法國公雞牌運動鞋 LWL7301599-中性-黑
休閒男鞋, Onitsuka Tiger MEXICO 66 男女休閒鞋1183A013
休閒男鞋, 法國公雞牌運動鞋 LWK7301299-中性-黑
休閒男鞋, FitFlop CHI 簡約交叉背帶涼鞋 深褐色
休閒男鞋, Onitsuka Tiger Mexico 66聯名款 男女休閒鞋1183A472-001
休閒男鞋, Timberland 男款黑色織布布蘭克林鞋|A2D7T
休閒男鞋, 法國公雞牌運動鞋 LGK7301790-中性-白
休閒男鞋, OnitsukaTiger Mexico66 休閒鞋1183A359-101
休閒男鞋, Timberland 男款鐵銹色皮革人字拖|A2AV2
休閒男鞋, Onitsuka Tiger MEXICO 66 休閒1183A033銀
休閒男鞋, Timberland 男款中藍色帆布休閒帆船鞋|A2B14
休閒男鞋, Clarks 科履行蹤 率性保暖防水綁帶中筒男靴 黑色
休閒男鞋, Onitsuka Tiger MEXICO 66 休閒 D508K金
休閒男鞋, *Adidas Yeezy Boost 350 V2 Black 黑天使 鞋帶反光 運動 休閒 女鞋 FU9006
休閒男鞋, FitFlop BANDO厚底涼鞋淺木色
休閒男鞋, Onitsuka Tiger MEXICO 66 休閒1182A007粉
休閒男鞋, Timberland 男款淺灰色絨面革防水靴|A23ET
休閒男鞋, FitFlop BANDO CROC-EFFECT SLIDE巧克力色
休閒男鞋, Onitsuka Tiger GSM 男女休閒鞋 D6H1L-0101
休閒男鞋, Timberland 童款小麥黃經典防水6吋靴|12909
休閒男鞋, Timberland 男款黑色磨砂革休閒中筒靴|A2DPJ
休閒男鞋, Onitsuka Tiger OK Basketball W 休閒鞋 1182A040-101
休閒男鞋, Converse Chuck Taylor All Star -男女基本款高筒白色休閒鞋-  NO.M7650C
休閒男鞋, Onitsuka Tiger GSM 男女休閒鞋 D837L-9090
休閒男鞋, FitFlop TRAKK II NEOPRENE TOE-THONG-黑色
休閒男鞋, FitFlop SURFER FRESHWEAVE 運動風夾腳涼鞋 午夜藍
休閒男鞋, Converse Chuck Taylor All Star  -男女基本款低筒白色休閒鞋-  NO.M7652C
休閒男鞋, Onitsuka Tiger Tiger Corsair 男女款休閒鞋 紅
休閒男鞋, Crocs卡駱馳 (中性鞋) 經典LOGO圖案克駱格 206450-066
休閒男鞋, FitFlop BOSTON LEATHER LOAFERS 輕量休閒鞋 黑色
休閒男鞋, FitFlop ETHAN TOE THONGS 簡約休閒夾腳涼鞋 暗紅色
休閒男鞋, CONVERSE-70 灰色帆布鞋-NO.164951C
休閒男鞋, Timberland 男款淺棕色磨砂革磨砂革經典六吋靴|A27UF
休閒男鞋, CONVERSE ALL STAR HIGH - -男女基本款高黑休閒鞋- - NO.M9160C
休閒男鞋, 法國公雞牌運動鞋 LGK7301839-中性-藏青
休閒男鞋, FitFlop ETHAN BACK STAP SANDALS 魔鬼氈後帶涼鞋 黑
休閒男鞋, Timberland 男款棕色防水經典6吋靴|A1H8Q
休閒男鞋, Timberland 男款深綠絨面革系帶鞋|A24SV
休閒男鞋, Crocs卡駱馳 (中性鞋) 電波紋卡駱班涼拖 206476-103
休閒男鞋, CONVERSE-深藍高筒帆布鞋-NO.164945C
休閒男鞋, 法國公雞牌運動鞋 LGK73019-75-中性-紅
休閒男鞋, FitFlop LAWRENCE 輕量繫帶休閒鞋(紅褐色)
休閒男鞋, Clarks 科履行蹤  粗獷風2孔D型鞋眼扣寬口低筒靴 深灰色
休閒男鞋, TEVA 原廠貨 男 Hurricane XLT2 機能運動涼鞋/雨鞋/水鞋-圖騰黑
休閒男鞋, OT鬼塚虎-DELEGATION EX 休閒鞋 男女(白底藍紅邊)
休閒男鞋, Converse 低筒休閒鞋 中性鞋 帆布鞋 黃色麂皮 ALL STAR NO.163760C
休閒男鞋, FitFlop CHRISTOPHE休閒鞋白色
休閒男鞋, (男)VANS Michoacan SF 潮流素色復古休閒鞋*藍色
休閒男鞋, 法國公雞牌運動鞋 LWL7301672-女-粉
休閒男鞋, CONVERSE-灰色高筒帆布鞋-NO.164946C
休閒男鞋, OT鬼塚虎-MEXICO 66 SLIP-ON 休閒鞋 男女(白底粉橘墨綠邊)
休閒男鞋, 勃肯BIRKENSTOCK 1009962。GIZEH吉薩 夾腳拖鞋(黑色)
休閒男鞋, Onitsuka Tiger California78 EX 休閒鞋 1183A031-001
休閒男鞋, Converse 低筒休閒鞋 男女款帆布鞋 ONE STAR 麂皮 黃色 NO.163245C
休閒男鞋, FitFlop ANDOR HIGH-TOP SNEAKERS-淺褐
休閒男鞋, Timberland 男款深棕色皮革人字拖|A2AVD
休閒男鞋, 【CAT】PROPULSION CT 防水塑鋼網布工作靴(91123)
休閒男鞋, OnitsukaTigerx迪士尼聯名 Mexico66 PS 米奇白
休閒男鞋, Onitsuka Tiger GSM 女休閒鞋 1182A035-101
休閒男鞋, Hush Puppies Bounce Max 高效彈力休閒男便鞋-淺棕色
休閒男鞋, Onitsuka Tiger LAWNSHIP 2.0 休閒鞋 1183A240-001
休閒男鞋, CONVERSE-70 粉色帆布鞋-NO.164952C
休閒男鞋, Clarks 步步清新 簡約復古精緻縫線設計休閒男鞋 赭色
休閒男鞋, Onitsuka Tiger CALIFORNIA 78 EX D800N黑
休閒男鞋, OT鬼塚虎-Mexico 66 SD 休閒鞋 男女(米色)
休閒男鞋, OT鬼塚虎-MEXICO 66 休閒鞋 男女 D507L-0152
休閒男鞋, OT鬼塚虎-Mexico 66 Slip-On 休閒鞋 男女(白)
休閒男鞋, OT鬼塚虎-MEXICO 66 SLIP-ON 休閒鞋 男女(白底藍綠邊)
休閒男鞋, TEVA 原廠貨 男 Original Universal 經典緹花織帶涼鞋/雨鞋/水鞋-90S彩色
休閒男鞋, FitFlop ETHAN TOE THONGS 簡約休閒夾腳涼鞋 靚黑色
休閒男鞋, TEVA 原廠貨 男 Mush II 寬版織帶夾腳拖鞋/雨鞋/水鞋-荊棘黑
休閒男鞋, FitFlop TM-BANDO MEN S CROC EFFECT-深褐色
休閒男鞋, Dr.Martens經典3孔馬汀馬丁鞋-男款-黑色
休閒男鞋, FitFlop COLLINS SLIP-ON SKATE SHOES-淺褐
休閒男鞋, FitFlop TM-TOURNO LACE-UP SNEAKERS黑
休閒男鞋, Clarks 步步清新 簡約復古細緻縫線切爾西款男靴 深灰色
休閒男鞋, FitFlop KANO-黑色
休閒男鞋, 【CAT】PROPULSION CT 防水塑鋼網布工作靴(91125)
休閒男鞋, Timberland 男款黑色絨面Radford 6吋防水靴
休閒男鞋, TEVA 原廠貨-男 Terra-Float 2 運動涼鞋/雨鞋/水鞋 深灰
休閒男鞋, OT鬼塚虎-Mexico 66 Slip-On 休閒鞋 男女(灰底白邊)
休閒男鞋, FitFlop GOGH MOC LEATHER SLIDES-黑色
休閒男鞋, TEVA 原廠貨 男 Hurricane XLT2 ALP 機能運動涼鞋/雨鞋/水鞋-CTC黑灰色
休閒男鞋, TEVA 原廠貨 男 Terra-Float Slide 休閒拖鞋/雨鞋/水鞋 (黑白)
休閒男鞋, TRAVEL FOX(男) 我的天空 超軟苯染牛皮二孔經典親膚帆船鞋 - 映海藍
休閒男鞋, TEVA 原廠貨 男 Terra-Float 2 Knit 輕量運動涼鞋/雨鞋/水鞋 黑
休閒男鞋, CONVERSE-男女款復古芥末黃休閒鞋-NO.162063C
休閒男鞋, Crocs 卡駱馳 (中性鞋) 厚底卡駱班 205434-6QB
休閒男鞋, OT鬼塚虎-Mexico 66 休閒鞋 男女 (白)
休閒男鞋, *Nike Kawa Shower Slide White 防水 拖鞋 白藍 832528-100
休閒男鞋, Crocs卡駱馳 (中性鞋) 卡駱班LOGO狂熱圖案克駱格 206381-066
休閒男鞋, Timberland 男款深灰色磨砂革六吋靴|A41C6
休閒男鞋, 法國公雞牌運動鞋 LWL7301495-中性-灰
休閒男鞋, OT鬼塚虎-DELEGATION EX 休閒鞋 男女(白底綠黃邊)
休閒男鞋, FitFlop KANO-淺褐色
休閒男鞋, Crocs卡駱馳 (中性鞋) 經典人字拖 206119-001
休閒男鞋, Onitsuka Tiger CALIFORNIA 78 EX D800N紅
休閒男鞋, OT鬼塚虎-MEXICO 66 SLIP-ON 休閒鞋 男女(米色黑邊)
休閒男鞋, OT鬼塚虎-MEXICO 66 休閒鞋 男女(白色)
休閒男鞋, Clarks 樂活都市 運動板鞋風套入便鞋 黑色
休閒男鞋, Clarks 步步清新 簡約復古精緻縫線設計休閒男鞋 棕褐色
休閒男鞋, 【CAT】FOXFIELD 防水鋼頭工作靴(723368)
休閒男鞋, Crocs卡駱馳 (男鞋) 激浪男士人字拖 206242-4HE
休閒男鞋, Onitsuka Tiger鬼塚虎-GSM 休閒鞋 男女(白底紅藍邊)
休閒男鞋, Clarks 運動行風織面透氣襪套式鞋口輕量三瓣底休閒鞋 海軍藍
休閒男鞋, Clarks 樂活休閒-輕戶外防潑水真皮休閒鞋 深棕色
休閒男鞋, Timberland 男款經典中筒防水黃靴
休閒男鞋, OT鬼塚虎-MEXICO 66 SD SLIP-ON 休閒鞋 男女(米色)
休閒男鞋, TEVA Omnium Drift 水陸機能涼鞋 男 黑色 TV1107829BLK
休閒男鞋, TEVA 原廠貨 男 Omnium 2 護趾水陸機能涼鞋/雨鞋/水鞋 藍橄欖綠
休閒男鞋, CONVERSE JACK PURCELL 開口笑 男女款 NO.1S962
休閒男鞋, TEVA 原廠貨 男 Terra-Float Slide 休閒拖鞋/雨鞋/水鞋 (海軍藍)
休閒男鞋, WALKING ZONE 經典款 帆船雷根鞋 男鞋 黑藍(另有咖啡)
休閒男鞋, OT鬼塚虎-Mexico 66 休閒鞋 男女(白底銀邊)
休閒男鞋, TEVA 原廠貨 男 Original Universal 緹花織帶涼鞋/雨鞋/水鞋 圖騰黑
休閒男鞋, TEVA 原廠貨-男 Original Puff 經典緹花織帶涼鞋/雨鞋/水鞋 (橄欖綠)
休閒男鞋, Timberland 男款黑色織面休閒鞋|A2BY5
休閒男鞋, OT鬼塚虎-FABRE BL-S 2.0 休閒鞋 男女(白色)
休閒男鞋, Hush Puppies WDC 男綁帶休閒鞋-煙灰色
休閒男鞋, FitFlop ARKEN SPORTY SNEAKERS 運動風繫帶休閒鞋 藍
休閒男鞋, Timberland 男款深綠網面魔鬼貼束帶涼鞋|A23KH
休閒男鞋, OT鬼塚虎-MEXICO 66 SLIP-ON 休閒鞋 男女(灰色底白邊)
休閒男鞋, Crocs 卡駱馳 (男鞋) 激浪克駱格 202251-23K
休閒男鞋, Clarks 樂活休閒 全皮面寬楦感套入式輕量便鞋 海軍藍
休閒男鞋, OT鬼塚虎-MEXICO 66 休閒鞋 男女(白底黑橘邊)
休閒男鞋, FitFlop ARKEN SNEAKERS 運動風繫帶休閒鞋 靚黑色
休閒男鞋, Clarks 運動行風-防潑水輕戶外三瓣底休閒鞋 黑色拼色
休閒男鞋, OT鬼塚虎-MEXICO 66 休閒鞋 男女(白底黃邊)
休閒男鞋, TRAVEL FOX(男) 稳石登山越野防水禦寒防震專業戶外登山鞋 -灰
休閒男鞋, CCILU 輕量防水兩穿休閒鞋-男款-301303021酷炫黑
休閒男鞋, CCILU 輕量防水兩穿休閒鞋-男款-301303004水泥灰
休閒男鞋, OT鬼塚虎-MEXICO 66 SD 休閒鞋 男女(白底紅邊)
休閒男鞋, FitFlop FINEKNIT 運動風繫帶休閒鞋 黑色
休閒男鞋, OnitsukaTigerx迪士尼聯名 Mexico66 米奇白
休閒男鞋, TEVA 原廠貨 男 Hurricane Drift 水陸輕量涼鞋/雨鞋/水鞋-深藍
休閒男鞋, Dr.Martens-經典8孔馬汀馬丁靴-男款-黑色
休閒男鞋, Crocs 卡駱馳 (男鞋) 激浪涉水涼鞋 203965-354
休閒男鞋, OT鬼塚虎-MEXICO 66 SD MR 休閒鞋 男女(米底紅藍邊)
休閒男鞋, CCILU 輕量防水兩穿休閒鞋-男款-301303153海洋藍
休閒男鞋, Rider 休閒舒適人字夾腳拖鞋(男款)-藍黑
休閒男鞋, TEVA 原廠貨 男 Universal Premier 運動涼鞋/雨鞋/水鞋 (深灰)
休閒男鞋, SAPATOTERAPIA 巴西男士皮革帆船鞋男鞋咖另有深棕
休閒男鞋, CCILU 洞洞輕量防水休閒鞋-男款-301284021酷炫黑
休閒男鞋, Crocs 卡駱馳 (男鞋) LiteRide男士繫帶鞋 205162-060
休閒男鞋, Crocs 卡駱馳 (男鞋) 聖克魯茲樂福鞋 205708-060
休閒男鞋, Crocs 卡駱馳 (男鞋) LiteRide徒步繫帶鞋 204967-060
休閒男鞋, 美國Chaco。男 越野運動涼鞋-標準款CH-ZCM01H405 (黑)
休閒男鞋, 男潮款帆布鞋 白 sd7098 魔法Baby
休閒男鞋, 巴西品牌 巴西 男 R1 AD 時尚機能夾腳拖 (果凍綠)
休閒男鞋, Clarks 步步清新 側邊開口鞋帶設計休閒鞋 砂岩色
休閒男鞋, Dr.Martens-經典8孔馬汀馬丁靴-男款-櫻桃紅
休閒男鞋, Crocs 卡駱馳 (中性鞋) 卡駱班勁級克駱格 206122-462
休閒男鞋, Hush Puppies Wallabee 休閒男高筒靴-黑
休閒男鞋, TEVA 原廠貨-男 Original Universal 緹花織帶涼鞋/雨鞋/水鞋 (黑)
休閒男鞋, Crocs 卡駱馳 (男鞋) LiteRide男士便鞋 205170-4HB
休閒男鞋, TRAVEL FOX(男) 山之語登山越野防水禦寒防震專業戶外登山鞋- 灰粉
休閒男鞋, Crocs卡駱馳 (中性鞋) 經典特林克駱格 206340-0DA
休閒男鞋, TEVA Terra-Float 2 Universal 男 休閒涼鞋 橄欖黑(TV1091349NBOM)
休閒男鞋, Hush Puppies 真皮厚底男板鞋-棕色
休閒男鞋, Crocs 卡駱馳 (中性鞋) 厚底卡駱班撞色涼拖 205693-001
休閒男鞋, W&M 超軟牛皮彈性釦厚底鞋休閒鞋 男鞋 -深咖(另有黑)
休閒男鞋, OT鬼塚虎-TIGER HORIZONIA 休閒鞋 男女(橘藍底白邊)
休閒男鞋, 男軟Q緩震休閒拖鞋 sd5006 魔法Baby
休閒男鞋, Crocs 卡駱馳 (男鞋) 男士激浪涉水鞋 203963-0DW
休閒男鞋, Hush Puppies 紳士皮革樂福男鞋-深灰色
休閒男鞋, OT鬼塚虎-MEXICO 66 SD SLIP-ON 休閒鞋 男女(銀色)
休閒男鞋, OT鬼塚虎-MEXICO 66 SLIP-ON 休閒鞋 男女(灰藍底白邊)
休閒男鞋, WALKING ZONE 撞色款 帆船雷根鞋 男鞋-深藍底(另有咖啡底)
休閒男鞋, Crocs 卡駱馳 (中性鞋) 卡駱班勁級克駱格 206122-066
休閒男鞋, Dr.Martens-經典3孔馬汀馬丁鞋-男款-櫻桃紅
休閒男鞋, Hush Puppies 經典款帆布休閒男鞋-白色
休閒男鞋, TEVA 原廠貨 男 Hurricane XLT2 水陸機能涼鞋/雨鞋/水鞋-CTC峽谷圖騰藍橘
休閒男鞋, Crocs 卡駱馳 (男鞋) LiteRide男士便鞋 205170-066
休閒男鞋, TRAVEL FOX(男) 米羅全牛皮防水設計紳士防震休閒鞋-風範黑
休閒男鞋, Clarks 步步清新 側邊開口鞋帶設計休閒鞋 黑色
休閒男鞋, ECCO BIOM C-TRAIL M 縱橫越野健步防水運動鞋 男-黑/白/灰
休閒男鞋, TRAVEL FOX(男) 時光機 高底輕量復刻休閒運動老爹鞋 - 健走黑
休閒男鞋, Crocs 卡駱馳 (男鞋) 激浪男士酷網涉水鞋 205701-3TF
休閒男鞋, Clarks 自然家族 縫線設計舒適好走厚底休閒鞋 紅褐色
休閒男鞋, TEVA 原廠貨 男 Original Denim 緹花織帶涼鞋/雨鞋/水鞋 單寧藍
休閒男鞋, Clarks UN 極簡素面圓頭套入式正裝紳士鞋 紅褐色
休閒男鞋, TEVA Hurricane XLT2 水陸機能涼鞋 男 深灰查拉布萊克 TV1019234CBGRY
休閒男鞋, TEVA Hurricane Drift 男 極輕量涼鞋 黑色
休閒男鞋, Clarks 樂活休閒 光面皮革寬楦感套入式輕量便鞋 黑色
休閒男鞋, TRAVEL FOX(男) VIBRAM大底防水抗寒專業進口戶外登山鞋-黃
休閒男鞋, *NIKE KAWA SHOWER 黑底白勾 防水拖鞋 832655-001
休閒男鞋, OT鬼塚虎-Mexico 66 SD 休閒鞋 男女(咖啡底紅白邊)
休閒男鞋, Crocs 卡駱馳 (中性鞋) Be you厚底卡駱班 205699-001
休閒男鞋, Crocs 卡駱馳 (男鞋) 聖克魯茲帆布人字拖 205612-22Y
休閒男鞋, Crocs卡駱馳 (中性鞋) 電波紋卡駱班人字拖 206475-02W
休閒男鞋, Crocs 卡駱馳 (男鞋) Reviva男士便鞋 205807-26L
休閒男鞋, TEVA Terra Fi Lite 水陸機能涼鞋 男 漫步者黑 TV1001473RRBK
休閒男鞋, Hush Puppies Bounce 超彈力便鞋-深藍
休閒男鞋, TRAVEL FOX(男) VIBRAM大底防水抗寒專業進口戶外高筒登山鞋-黑黃
休閒男鞋, KangaROOS 帆布厚底餅乾鞋 CRUST 藍標袋鼠鞋系列 米棕 91279
休閒男鞋, TEVA Hurricane Sock 男 水陸機能涼鞋 黑色
休閒男鞋, Crocs卡駱馳 (中性鞋) 經典特林克駱格 206340-206
休閒男鞋, Crocs 卡駱馳 (男鞋) 都會街頭洛卡花紋便鞋 204966-066
休閒男鞋, Crocs 卡駱馳 (中性鞋) Shine on厚底卡駱班 205699-737
休閒男鞋, FitFlop TM-TRAKK II TM LEATHER-深褐色
休閒男鞋, KangaROOS 帆布厚底餅乾鞋 CRUST 藍標袋鼠鞋系列 棕白 91271
休閒男鞋, TEVA Hurricane Drift 男 極輕量涼鞋 白色
休閒男鞋, Hush Puppies Bounce Max 黃金大底休閒鞋-黑色
休閒男鞋, Crocs 卡駱馳 (中性鞋) 卡駱班勁級克駱格 206122-07I
休閒男鞋, WALKING ZONE 撞色款 帆船雷根鞋 男鞋-咖啡底(另有深藍底)
休閒男鞋, ECCO MULTI-VENT M 全方位城市戶外運動休閒鞋 男-酒紅/灰/白
休閒男鞋, Hush Puppies 百搭皮革休閒男鞋-黑色
休閒男鞋, Crocs 卡駱馳 (男鞋) 男士激浪迷彩涼鞋 206010-97G
休閒男鞋, PAMAX帕瑪斯-高抓地力氣墊安全鞋-P04601H-工作休閒-男女
休閒男鞋, TEVA Hurricane Toe Pro 2 護趾水陸機能涼鞋 電光藍 男
休閒男鞋, Crocs 卡駱馳 (男鞋) Reviva男士便鞋 205807-2U6
休閒男鞋, *NIKE BENASSI DUO ULTRA SLIDE 819717-010 女鞋
休閒男鞋, Clarks 工藝世家-杏仁頭鞋型復刻設計紳士鞋(防潑水) 黑色
休閒男鞋, 【CAT】HOLTON  SRC 鋼頭靴-黑(708026)
休閒男鞋, Crocs 卡駱馳 (中性鞋) 立體花朵厚底卡駱班 205746-737
休閒男鞋, WALKING ZONE 撞色款 帆船雷根鞋 男鞋-深藍底(另有咖啡底)
休閒男鞋, Crocs 卡駱馳 (中性鞋) 卡駱班 11016-725
休閒男鞋, TEVA Voya Flip 男休閒拖鞋 黑
休閒男鞋, TEVA 原廠貨 男 Hurricane Volt 經典緹花織帶涼鞋/雨鞋/水鞋 (灰)
休閒男鞋, Crocs 卡駱馳 (中性鞋) 厚底卡駱班 205631-6QB
休閒男鞋, Crocs 卡駱馳 (男鞋) 男士LiteRide徒步繫帶鞋 204967-616
休閒男鞋, 勃肯BIRKENSTOCK 447101。哈里森長筒休閒鞋(黑)
休閒男鞋, KangaROOS 帆布厚底餅乾鞋 CRUST藍標袋鼠鞋系列 起司黃 91264
休閒男鞋, TRAVEL FOX(男)虎爪 登山越野防水禦寒防震專業戶外登山鞋 - 桔
休閒男鞋, KangaROOS 帆布厚底餅乾鞋 CRUST 藍標袋鼠鞋系列 梅紅 91272
休閒男鞋, Dr.Martens OCTAVIUS-復古4孔馬汀馬丁鞋-男款-深咖啡
休閒男鞋, Crocs 卡駱馳 (男鞋) 男士LiteRide徒步繫帶鞋 204967-37P
休閒男鞋, (男)Ponic&Co美國加州環保防水洞洞綁帶帆船鞋-卡其
休閒男鞋, (男)Dr.Martens ADRIAN 流蘇休閒鞋*黑色
休閒男鞋, Hush Puppies Sockletweaver 男健步鞋-藍
休閒男鞋, HANNFORT RS8真皮洞洞透氣休閒鞋-獨特棕
休閒男鞋, TEVA Mush II 男 休閒夾腳拖 荊棘咖啡棕 TEVA4168BCRF
休閒男鞋, Clarks UN 寬楦舒適正裝紳士鞋 黑色
休閒男鞋, TEVA Hurricane XLT2 Cross Strap 男休閒涼鞋 深藍
休閒男鞋, TEVA Sanborn Universal 涼鞋 男
休閒男鞋, KANGAROOS 男 NEON 越野老爹鞋(黑)
休閒男鞋, 【CAT】EXCAVATOR SUPERLITE 全方位塑鋼鞋(91196)
休閒男鞋, Crocs 卡駱馳 (中性鞋) 卡駱班勁級克駱格 206122-3TL
休閒男鞋, OT鬼塚虎-Mexico 66 SD 休閒鞋 男(深藍)
休閒男鞋, PAMAX帕瑪斯-高抓地力氣墊安全鞋-P00101H-★戶外休閒★男女
休閒男鞋, Crocs 卡駱馳 (男鞋) LiteRide男士步行鞋 204967-066
休閒男鞋, SAPATOTERAPIA 巴西男雕花綁帶紳士德比鞋 棕另有黑
休閒男鞋, 男水陸兩用輕便洞洞鞋 sd5001 魔法Baby
休閒男鞋, OT鬼塚虎-LAWNSHIP 2.0 休閒鞋 男女(白)
休閒男鞋, Hush Puppies 經典款帆布休閒男鞋-灰色
休閒男鞋, KangaROOS 經典撞色復古越野慢跑鞋 藍標老爹鞋 淺卡藍 91181
休閒男鞋, Clarks UN 全真皮經典男士正裝紳士鞋 棕褐色
休閒男鞋, OT鬼塚虎-MEXICO 66 休閒鞋 男女 (白底紅邊)
休閒男鞋, OT鬼塚虎-MEXICO 66 休閒鞋 男女 (粉底藍邊)
休閒男鞋, OT鬼塚虎-MEXICO 66 SD 休閒鞋 男女(黑底紅邊)
休閒男鞋, OT鬼塚虎-TIGER CORSAIR EX 休閒鞋 男女(藍底橘邊)
休閒男鞋, OT鬼塚虎-SERRANO 休閒鞋 男女 (黑底白邊)
休閒男鞋, TEVA 原廠貨 男 Alp Premier 機能運動涼鞋/雨鞋/水鞋 焦糖色
休閒男鞋, IronSteel T-1231 防水襪套快旋鈕鞋扣高筒安全鞋
休閒男鞋, Crocs 卡駱馳 (男鞋) 聖克魯茲HC便鞋 205674-267
休閒男鞋, Clarks UN 極簡素面圓頭正裝紳士鞋 棕褐色
休閒男鞋, Clarks 步步清新 全皮面復古簡約風正裝休閒鞋 棕褐色
休閒男鞋, OT鬼塚虎-DELECITY 休閒鞋 男女 (白/黃)
休閒男鞋, KANGAROOS 男 NEON 越野老爹鞋(白/黑/卡其)
休閒男鞋, Timberland 男款深紅色磨砂革休閒靴|A29HN
休閒男鞋, Hush Puppies 真皮厚底男板鞋-黑色
休閒男鞋, PAMAX 帕瑪斯-防穿刺+鋼頭-高抓地力安全鞋-經濟實用-PZ10101PPH
休閒男鞋, WALKING ZONE 時尚樂福鞋 莫卡辛男鞋-黑 (另有咖)
休閒男鞋, OT鬼塚虎-Tiger Corsair 休閒鞋 男女(白底紅邊)
休閒男鞋, Crocs 卡駱馳 (男鞋) 聖克魯茲HC便鞋 205674-001
休閒男鞋, native JEFFERSON 男/女鞋-自信普普風
休閒男鞋, Hush Puppies Bounce Max 高效彈力皮革休閒鞋-黑色
休閒男鞋, TEVA Voya Flip 男休閒拖鞋 焦糖色
休閒男鞋, TEVA Hurricane XLT2 水陸機能涼鞋 男 CTC峽谷圖騰藍橘 TV1019234CTCN
休閒男鞋, TRAVEL FOX(男) 亞力斯 歐洲進口全牛皮綁帶減壓休閒鞋 -著墨黑
休閒男鞋, Clarks 樂活休閒 光面皮革寬楦綁帶輕量休閒鞋 黑色
休閒男鞋, CCILU 幾何飛織網布休閒運動鞋-男款-301325009銀藍色
休閒男鞋, TEVA Terra-Float 2 Knit Universal 男休閒涼鞋
休閒男鞋, Crocs 卡駱馳 (男鞋) Reviva男士便鞋 205807-462
休閒男鞋, ECCO COOL 2.0 360度環繞防水休閒運動鞋-藍
休閒男鞋, TRAVEL FOX(男) 雕線歐洲進口牛皮防水設計紳士防震休閒鞋 -立體黑
休閒男鞋, Crocs 卡駱馳 (男鞋) 都會街頭洛卡便鞋  202363-3Q7
休閒男鞋, Crocs卡駱馳 (中性鞋) 經典特林克駱格 206340-700
休閒男鞋, WALKING ZONE 可踩腳 牛皮樂福鞋休閒鞋 男鞋 - 藍(另有棕)
休閒男鞋, HANNFORT 帆布鞋 CARIBBEAN 懶人鞋-男-黑
休閒男鞋, TEVA Original Universal Sport 男 經典涼鞋 檸檬黃
休閒男鞋, 【CAT】ALASKA 2.0 ST 輕量鋼頭鞋-黑(90864)
休閒男鞋, TRAVEL FOX(男) 風動 登山越野防水禦寒防震專業戶外登山鞋 - 灰
休閒男鞋, 男新潮美型海灘夾腳拖鞋 sd7067 魔法Baby
休閒男鞋, 【TEVA】Sanborn Universal 女 輕量戶外涼鞋 黑(TV1015160BLK)
休閒男鞋, TRAVEL FOX(男)英倫情人 抛光牛皮雕花綁帶都會紳士皮鞋 -精神黑
休閒男鞋, Crocs 卡駱馳 (中性鞋) 冰炫卡駱班 205574-6PI
休閒男鞋, TRAVEL FOX(男) 時光機 高底輕量復刻休閒運動老爹鞋 - 高中白
休閒男鞋, Rider STRIKE GRAPHICSE系列人字夾腳拖鞋(男款)-白
休閒男鞋, TEVA Hurricane XLT2 男休閒涼鞋 灰TV1019234KBGR
休閒男鞋, 美國Chaco。男 越野舒壓運動涼鞋-夾腳款CH-ZLM02H405 (黑)
休閒男鞋, (男) Dr.Martens 經典3989 撞色雕花3孔牛津鞋*黑白
休閒男鞋, PAMAX 帕瑪斯-防穿刺+鋼頭-高抓地力安全鞋-抗菌除臭-PA3502PPH
休閒男鞋, Hush Puppies Expert 針織綁帶男休閒鞋-深藍色
休閒男鞋, 超軟Q輕量透氣舒適拖鞋 sd0567 魔法Baby
休閒男鞋, Clarks 工藝世家-高質感皮面復刻工藝素面正裝紳士鞋 棕褐色
休閒男鞋, SANUK-CHIBA WAFFLE格紋編織寬版懶人鞋-男款(淺灰色)
休閒男鞋, TRAVEL FOX(男) VIBRAM大底防水抗寒專業進口戶外登山鞋 - 君子黑
休閒男鞋, TRAVEL FOX(男) 大齡男子牛皮輕量大底側釦式休閒鞋 -方便黑
休閒男鞋, TEVA Sanborn Universal 涼鞋 鎖鏈黑 男
休閒男鞋, TEVA Sanborn Universal 經典緹花織帶涼鞋 男 影深灰 TV1015156DKSW
休閒男鞋, ECCO COOL M 360度環繞防水休閒鞋 男-咖啡色
休閒男鞋, Crocs 卡駱馳 (男鞋) 激浪男士酷網涉水鞋 205701-07X
休閒男鞋, Crocs 卡駱馳 (男鞋) LiteRide男士繫帶鞋 205678-066
休閒男鞋, PAMAX 帕瑪斯【超彈力氣墊、止滑安全鞋】鋼頭鞋、廚師鞋，男女鞋
休閒男鞋, W&M 超軟牛皮彈性釦厚底鞋休閒鞋 男鞋 -黑(另有深咖)
休閒男鞋, Crocs 卡駱馳 (男鞋) 聖克魯茲簡約樂福鞋 202972-2U6
休閒男鞋, WALKING ZONE 時尚樂福鞋 莫卡辛男鞋-咖 (另有黑)
休閒男鞋, Clarks UN 寬楦舒適正裝紳士鞋 棕褐色
休閒男鞋, CCILU 舒適網布休閒運動鞋-男款-301322004水泥灰
休閒男鞋, OT鬼塚虎-MEXICO 66 休閒鞋 男女 (藍底黃邊)
休閒男鞋, TEVA Winsted 經典織帶涼鞋 男 竹黑色 TV1017419BMBLC
休閒男鞋, TEVA Peralta Chukka 休閒鞋 橄欖綠 男
休閒男鞋, OT鬼塚虎-California 78 ex 休閒鞋 男(黑底白邊)
休閒男鞋, ECCO IRVING 城市時尚風格套入式休閒鞋 男-黑
休閒男鞋, OT鬼塚虎-MEXICO 66 休閒鞋 男女 (米色底藍邊)
休閒男鞋, TEVA Alp 經典設計織帶涼鞋 男 TV1015849AVC
休閒男鞋, Crocs 卡駱馳 (男鞋) 男士激浪涉水鞋 203963-0FR
