智慧穿戴, 【小米手環4】繁體中文版 運動手環
智慧穿戴, Pormate Apple Watch 38mm 滿版強化玻璃保護貼(Guardio)
智慧穿戴, GARMIN QUICKFIT 22mm 快拆錶帶
智慧穿戴, JSmax L-SMART QS100智慧多功能運動健康管理手環
智慧穿戴, 小米手環4雙色撞色錶帶腕帶
智慧穿戴, GARMIN Vivofit jr2 小童手環(迪士尼系列)
智慧穿戴, Amazfit Bip米動手錶青春版米蘭金屬錶帶
智慧穿戴, Philip Stein翡麗詩丹運動手環
智慧穿戴, CITY Apple Watch Series 3/2/1 42mm滿版全膠曲面玻璃貼
智慧穿戴, Samsung Galaxy Watch Active2 智慧手錶-鋁製/44mm
智慧穿戴, Apple Watch 不鏽鋼七珠蝶扣錶帶-贈拆錶器40mm
智慧穿戴, 【u-ta】升級款圓款觸控智慧心律手錶TW1(心律版)
智慧穿戴, Apple Watch 1/2/3代 保護殼 超薄防摔 電鍍軟殼 手錶保護套
智慧穿戴, AHAStyle AirPods.watch.iPhone三合一矽膠充電底座
智慧穿戴, My Watch 運動守護藍牙智慧手環(睡眠監測/計步) MY10
智慧穿戴, mijobs 小米手環 3 專用充電線
智慧穿戴, GOLiFE Care-Xe 智慧悠遊觸控心率手環-急速配
智慧穿戴, 黑加手環1S NFC
智慧穿戴, GARMIN INSTINCT 22mm 矽膠替換錶帶
智慧穿戴, MR 小米手環3/4通用單色矽膠運動替換錶帶
智慧穿戴, JSmax SA-P10智慧手環專用心率帶(配件)
智慧穿戴, Samsung 三星 Galaxy Watch Active 智慧手錶
智慧穿戴, Apple Watch Nike+S3 38mm 鋁金屬錶殼搭運動型錶帶(LTE版)
智慧穿戴, GARMIN Vector 3S 踏板升級組
智慧穿戴, 美國NOMADxHORWEEN皮革 Apple Watch 42/44mm錶帶-經典款
智慧穿戴, 小米手環4專用充電座(20cm)
智慧穿戴, E-books V2 藍牙VR遊戲搖桿
智慧穿戴, GARMIN vivoactive 3 行動支付心率智慧腕錶
智慧穿戴, 小米手環2代 彩色腕帶 替換帶 加贈保護貼
智慧穿戴, 人因 ERGOLINK MWB214心律智慧監測運動手錶
智慧穿戴, Apple Watch Nike+ (GPS)42mm 太空灰色鋁金屬錶殼+黑色Nike運動型錶帶
智慧穿戴, Adpe 米蘭磁吸不銹鋼 小米手環3代 4代 通用錶帶
智慧穿戴, 【LTE版】Samsung Galaxy Watch 智慧型手錶 (46mm)-星燦銀
智慧穿戴, Apple Watch 4/5代 40mm 防摔邊框矽膠保護殼套
智慧穿戴, Apple Watch 不鏽鋼七珠蝶扣錶帶-贈拆錶器(42mm)-黑
智慧穿戴, T.G Apple Watch 44mm 3D曲面滿版軟邊鋼化膜(手錶保護貼 玻璃膜 鋼化膜)
智慧穿戴, DUX DUCIS Apple Watch S4 (44mm) 電鍍 TPU 套組
智慧穿戴, JSmax SW-Z02 AI智慧健康管理手環
智慧穿戴, 小米手環3
智慧穿戴, 犀牛盾 Apple Watch 40mm Crashguard NX防摔邊框保護殼
智慧穿戴, 【AFAMIC 艾法】C80 高階3D動態智能心率手環(心率偵測 訊息提示 運動數據)
智慧穿戴, GOLiFE極簡都市雙肩包(多功能筆電後背包)
智慧穿戴, 防摔專家 Apple Watch 完美包覆 輕薄透明保護殼-44mm
智慧穿戴, AHAStyle Apple Watch 專用運動矽膠錶帶 簡約款(42/44mm)
智慧穿戴, GARMIN USB傳輸充電線(1公尺)
智慧穿戴, Apple Watch Series 3(GPS+網路) 38mm太空灰色鋁金屬錶殼+黑色錶帶
智慧穿戴, 【福利品】OMATE Racer 運動藍牙智能手錶
智慧穿戴, 全包覆經典系列 Apple Watch Series 3/2/1 (42mm) 9H鋼化玻璃貼+錶殼 一體式保護殼
智慧穿戴, MR AMAZFIT米動手錶青春版不鏽鋼五珠鏈式錶帶-贈拆錶器
智慧穿戴, GARMIN 跑步動態感測器
智慧穿戴, GARMIN fenix 5S Plus 行動支付音樂GPS複合式心率腕錶
智慧穿戴, T.G Apple Watch 42mm 3D曲面滿版軟邊鋼化膜(手錶保護貼 玻璃膜 鋼化膜)
智慧穿戴, x-doria Apple Watch 44mm 刀鋒360X系列 全包覆透明保護殼
智慧穿戴, GARMIN SWIM 2 GPS光學心率游泳錶
智慧穿戴, Apple Watch Series 4(GPS+網路)44mm銀色鋁金屬錶殼+白色錶帶
智慧穿戴, 【藍牙版】SAMSUNG Galaxy Watch 42mm 智慧手錶 玫瑰金
智慧穿戴, Mi Band 4 小米手環 4 高透光亮面耐磨保護貼(2入)
智慧穿戴, Samsung Galaxy Watch Active2 智慧手錶-鋁製/44mm
智慧穿戴, 小米手環3米蘭金屬錶帶腕帶
智慧穿戴, Adpe 小米3 / 小米4 純色矽膠手環錶帶
智慧穿戴, JSmax BY21-C6PRO 智慧健康管理手環
智慧穿戴, (2入)Apple Watch series 1,2,3 專用清透水感保護套
智慧穿戴, SUUNTO 3 Fitness 保持健康與活力生活的體適能運動腕錶 (經典黑)
智慧穿戴, 小米手環2特級充電線(副廠)
智慧穿戴, 小米手環3經典超纖皮革錶帶腕帶
智慧穿戴, LUCCIDA Apple Watch 運動矽膠錶帶
智慧穿戴, 小米手環4威尼斯精鋼3珠錶帶
智慧穿戴, Twelve South HiRise Deluxe iPhone 充電立架 - 金色
智慧穿戴, Rearth 三星 Gear S3/Galaxy Watch 46mm 強化玻璃保護貼
智慧穿戴, TicWatch E2 輕量運動智慧手錶-黑色
智慧穿戴, 小米手環4經典超纖皮革錶帶腕帶
智慧穿戴, Apple Watch TPU軟質保護殼-44mm/兩色可選
智慧穿戴, Philip Stein翡麗詩丹睡眠手環-【優雅款】
智慧穿戴, Rearth Apple Watch S4 44mm 高質感金屬錶環殼
智慧穿戴, E-books V4 智慧手環錶帶
智慧穿戴, Apple Watch Series 4(GPS+網路)40mm銀色鋁金屬錶殼+白色錶帶
智慧穿戴, 小米手環3威尼斯精鋼錶帶
智慧穿戴, 蘋果手錶 Apple iWatch白金版通用充電線(副廠)
智慧穿戴, Garmin QUICK RELEASE 矽膠錶帶
智慧穿戴, GARMIN Approach S60 中文高爾夫GPS腕錶
智慧穿戴, 小米手環3單色錶帶腕帶(副廠)
智慧穿戴, GOLiFE Care-Xe 智慧悠遊觸控心率手環
智慧穿戴, Apple Watch 3D曲面全覆蓋超薄鋼化保護貼 42mm 黑色
智慧穿戴, Samsung Galaxy Watch Active2 44mm鋁製藍牙 R820
智慧穿戴, MIUI 小米手環4代充電線(副廠) 迷你便攜專用充電器 USB充電
智慧穿戴, Fitbit Charge 3 編織錶帶
智慧穿戴, MISFIT  RAY時尚智能手環皮革款_金屬黑 (公司貨)
智慧穿戴, Apple Watch 1/2/3/4/5代 尼龍編織腕帶 時尚針扣錶帶
智慧穿戴, ANTIAN 小米手環4 撞色雙排釦腕帶 防水矽膠錶帶 炫彩時尚舒適腕帶 替換手錶帶
智慧穿戴, GARMIN QUICK RELEASE 矽膠錶帶
智慧穿戴, 小米手環3米蘭金屬錶帶腕帶-磁吸版
智慧穿戴, Amazfit Bip米動手錶青春版充電線(副廠)
智慧穿戴, 美國 NOMAD APPLE WATCH 專用防水機能皮革錶帶-44/42mm-棕
智慧穿戴, Philip Stein翡麗詩丹日間手環-【星鑽白】
智慧穿戴, GARMIN Approach S40 GPS高爾夫腕錶
智慧穿戴, GARMIN fenix 5S Plus 行動支付音樂GPS複合式心率腕錶
智慧穿戴, Qii TicWatch S2/E2 玻璃貼 (兩片裝)
智慧穿戴, Moshi Travel Stand for Apple Watch 旅行充電座
智慧穿戴, 二合一 時尚純色 Apple watch 40mm 保護殼
智慧穿戴, GARMIN VIVOMOVE HR 時尚智慧腕錶
智慧穿戴, Philip Stein翡麗詩丹睡眠手環-【經典款】
智慧穿戴, Apple Watch Nike+ 行動網路,38mm太空灰鋁金屬配黑色Nike運動型錶帶
智慧穿戴, [無卡分期-12期]三星 Galaxy Watch Active2 44mm鋁製藍牙R820
智慧穿戴, Apple Watch 1/2/3/4/5 米蘭尼斯金屬錶帶 磁吸替換帶
智慧穿戴, Philip Stein翡麗詩丹日間手環-【經典棕】
智慧穿戴, GARMIN vivoactive 3 Music GPS音樂智慧錶
智慧穿戴, Apple Watch 1/2/3代 鋼化膜 滿版 手錶膜 防爆 手錶保護貼
智慧穿戴, Philip Stein翡麗詩丹日間手環-【經典芥末】
智慧穿戴, HUAWEI華為 Watch GT 運動智慧手錶 (曜石黑矽膠錶帶)
智慧穿戴, Samsung Galaxy Watch 42mm (LTE) 智慧手錶
智慧穿戴, i-gotU Q68HR 心律無線智慧手環
智慧穿戴, JTLEGEND Apple Watch Series 4 (44mm)鋼化玻璃保護貼
智慧穿戴, 【YOMIX 優迷】米動手錶Stratos 3/青春版2 BipS 親膚矽膠平面款錶帶(加贈高清防刮錶面貼)
智慧穿戴, Samsung Galaxy Watch Active2 40mm鋁製藍牙 R830*
智慧穿戴, 【小米手環4】繁體中文版 運動手環
智慧穿戴, GARMIN fenix 5系列充電傳輸線
智慧穿戴, CITY BOSS for Apple watch一體成形式玻璃加保護殻- 40mm
智慧穿戴, GARMIN fenix 5X Plus 行動支付音樂GPS複合式心率腕錶
智慧穿戴, Spigen Apple Watch Series 4 Liquid Crystal-保護
智慧穿戴, GARMIN vivomove style 指針智慧腕錶(尼龍錶帶)
智慧穿戴, GARMIN vivomove luxe 指針智慧腕錶(米蘭式編織錶帶)
智慧穿戴, GARMIN 星際大戰vívofit jr. 2 光明與黑暗
智慧穿戴, 二合一 時尚純色 Apple watch 44mm 保護殼
智慧穿戴, (贈2色錶帶)【MTK】時尚金屬彩屏生活防水心率手環mi6
智慧穿戴, T.G 小米手環4代 高透3D防爆水凝膜螢幕保護貼(2入)
智慧穿戴, 萬磁王 APPLE Watch 手錶保護殼40mm
智慧穿戴, GARMIN Approach G80 高爾夫GPS訓練儀
智慧穿戴, QinD Apple Watch (40mm) 金剛隱形膜
智慧穿戴, Morbido蒙彼多 Apple Watch 42mm運動型錶帶
智慧穿戴, Apple Watch Nike+S3 42mm 鋁金屬錶殼搭運動型錶帶(LTE版)
智慧穿戴, AmazingThing Garmin Forerunner 735XT 螢幕保護貼
智慧穿戴, Voice caddie 智慧手錶 T-1 GOLF WATCH (黑色) T1-B
智慧穿戴, Kooper酷跑 運動手環/健康/IP68防水(多項健康數據監測)
智慧穿戴, AmazingThing Apple Watch S4 44mm 滿版強化玻璃保護貼
智慧穿戴, ICARER 瘋馬紋系列 Apple Watch 手工真皮錶帶
智慧穿戴, 西歐科技時尚運動智能手環CME-X8-H60(鋼琴黑)
智慧穿戴, Huawei 華為 Band 3 PRO 藍芽手環
智慧穿戴, Spigen Apple Watch (42mm) Rugged Armor彈性防震保護殼
智慧穿戴, Morbido蒙彼多 Apple Watch 44mm皮製錶帶 矢車菊藍
智慧穿戴, My Watch 運動健康管家藍牙智慧手環(Line提醒/心率)MY14
智慧穿戴, Apple Watch Series 5(GPS+網路)40mm金色鋁金屬錶殼+粉沙錶帶
智慧穿戴, [無卡分期-12期]Apple Watch Nike S5(GPS+網路)40mm太空灰鋁錶殼黑錶帶
智慧穿戴, Emporio Armani Connected 指針式智慧錶-銀x雙色
智慧穿戴, GARMIN HRM-Dual 心率感測器
智慧穿戴, GOR 佳明 Forerunner 35 9H鋼化玻璃保護貼 非滿版2片裝
智慧穿戴, My Watch 運動時尚藍牙智慧手環(來電提醒/遠程拍照) MY16
智慧穿戴, 美國NOMADxHORWEEN Apple Watch 42/44 質樸黑皮革錶帶-經典黑
智慧穿戴, APPLE WATCH 金剛水靈膜保護貼42mm(附推膜卡)
智慧穿戴, AmazingThing Garmin Fenix 5 螢幕保護貼
智慧穿戴, Spigen Watch Series 4Rugged Armor Pro- 44mm 保護殼
智慧穿戴, hoco Apple Watch (38/40mm) 格朗鋼錶帶-黑色款
智慧穿戴, 美國NOMADxHORWEEN Apple Watch 42/44 奢華黑馬革錶帶-經典黑
智慧穿戴, Fitbit Ionic 專用原廠充電線
智慧穿戴, SB-BY-21 智慧健康管理運動手環專用錶帶
智慧穿戴, Apple Watch S5 GPS+LTE版 44mm 鋁錶殼配運動錶帶
智慧穿戴, Just Mobile HoverDock 鋁質 Apple Watch極簡立架
智慧穿戴, 美國CASE●MATE x Kodak聯名款 AppleWatch 42/44mm錶帶-藍
智慧穿戴, Apple Watch 不鏽鋼七珠蝶扣錶帶-贈拆錶器40mm
智慧穿戴, Apple Watch 42mm 全包覆軟性保護套
智慧穿戴, [無卡分期-12期]Apple Watch S5(GPS+網路)44mm太空灰鋁+黑色錶帶
智慧穿戴, Spigen Apple Watch 4 (40mm) Rugged Armor防摔保護殼
智慧穿戴, Apple Watch S5 Nike GPS版 40mm太空灰鋁錶殼黑色運動錶帶MX3T
智慧穿戴, IDI電子發熱圍巾
智慧穿戴, Apple Watch Nike+S3 38mm 鋁金屬錶殼搭運動型錶帶(LTE版)
智慧穿戴, SAMSUNG Galaxy Watch Active2 44mm UA 聯名款(藍牙)
智慧穿戴, Morbido蒙彼多 Apple Watch 44mm運動型錶帶-煤黑配黑
智慧穿戴, CITY Apple Watch Series 4 44mm 滿版全透明全膠曲面玻璃貼
智慧穿戴, 【優惠組】小米手環4+副廠錶帶1條(顏色隨機)
智慧穿戴, Apple Watch 不鏽鋼三珠蝶扣錶帶-贈拆錶器(星空銀-38mm)
智慧穿戴, Fitbit Ionic 專用原廠充電線
智慧穿戴, 韓國Spigen Slim Armor Apple Watch 輕薄型防刮保護殼
智慧穿戴, 小米手環4代快捷夾式 免拆 USB充電線(CH-808)
智慧穿戴, 美國Lander AppleWatch Series1/2/3 42mm Moab錶殼-黑
智慧穿戴, 華為 HUAWEI WATCH GT 運動款智慧手錶
智慧穿戴, Apple Watch S5 NIKE GPS版 44mm 鋁錶殼配運動錶帶
智慧穿戴, Apple Watch Series 5(GPS) 44mm太空灰鋁金屬錶殼+黑色運動錶帶
智慧穿戴, Twelve South Forte for Apple Watch 手錶立架
智慧穿戴, Emporio Armani Connected Hybrid 指針智慧錶-灰x綠框x黑
智慧穿戴, Morbido蒙彼多 Apple Watch 44mm運動型錶帶
智慧穿戴, Morbido蒙彼多 Apple Watch 38mm鍊式不鏽鋼錶帶
智慧穿戴, Apple Watch Nike S5(GPS)40mm 太空灰鋁金屬錶殼+黑色錶帶
智慧穿戴, Emporio Armani Connected 運動風指針式智慧錶-白/42mm
智慧穿戴, Apple Watch 38mm 雙色運動防水錶帶
智慧穿戴, Apple Watch Nike+ S4(GPS)44mm 銀色鋁金屬錶殼+白色錶帶
智慧穿戴, [無卡分期-12期]Apple Watch Nike S5(GPS)40mm 灰鋁+黑錶帶
智慧穿戴, Fitbit Versa 皮革錶帶
智慧穿戴, Apple Watch S3 38mm 鋁金屬錶殼搭運動型錶帶(LTE版)
智慧穿戴, 蘋果手錶 Apple Watch 3D曲面鋼化玻璃保護膜保護貼-黑色42mm
智慧穿戴, Apple Watch Nike+S5 44mm 鋁金屬錶殼搭運動型錶帶(LTE版)
智慧穿戴, XUNDD 訊迪 Apple Watch 4 (40mm) 全包金屬色防摔軟殼 (星鑽銀)
智慧穿戴, My Watch 運動守護時尚典雅藍牙智慧手環(IP67防水/心率) MY11
智慧穿戴, APPLE WATCH 金剛水靈膜保護貼44mm(附推膜卡)
智慧穿戴, g-IDEA Apple Watch 38MM 智慧型藍牙手錶防爆鋼化玻璃貼
智慧穿戴, 【hoda】Apple Watch 38mm 3D全曲面滿版9H鋼化玻璃保護貼
智慧穿戴, Apple Watch 42mm 雙色運動防水錶帶
智慧穿戴, Acer 宏碁 Leap Beads 智慧佛珠
智慧穿戴, 韓國Spigen Tough Armor 2 Apple Watch運動型防刮保護殼
智慧穿戴, 一體成形 Apple Watch 防摔錶殼 運動矽膠錶帶(42mm)
智慧穿戴, 華碩 ASUS VivoWatch 智慧手環 / HC-A04A
智慧穿戴, Morbido蒙彼多Apple Watch 44mm米蘭式磁吸不鏽鋼錶帶
智慧穿戴, 小米手環4
智慧穿戴, Apple Watch 不鏽鋼三珠蝶扣錶帶-贈拆錶器(星空銀-38mm)
智慧穿戴, Apple Watch S5 GPS版 40mm 鋁錶殼配運動錶帶
智慧穿戴, 【SHOWHAN】小米手環3/4通用 軟膜保護貼(兩片裝)/附刮卡
智慧穿戴, Apple Watch Series 3 (GPS) 38mm 太空色鋁金屬錶殼+黑色運動錶帶
智慧穿戴, Apple Watch 不鏽鋼七珠蝶扣錶帶-贈拆錶器(42mm)
智慧穿戴, Morbido蒙彼多 Apple Watch 40mm 金屬錶帶連接器(卡扣式)
智慧穿戴, [無卡分期-12期]Apple Watch S5(GPS+網路)40mm太空灰鋁金屬錶殼黑錶帶
智慧穿戴, [無卡分期-12期]Apple Watch S5(GPS+網路) 40mm金色鋁錶殼粉色運動錶帶
智慧穿戴, GOR 三星 Watch Active2 9H鋼化玻璃保護貼 非滿版
智慧穿戴, XUNDD 訊迪 Apple Watch 4 (40mm) 全包金屬色防摔軟殼 (宇宙黑)
智慧穿戴, Griffin WatchStand for Apple Watch 充電基座
智慧穿戴, 美國 NOMAD APPLE WATCH 不鏽鋼錶帶-42/44mm
智慧穿戴, 大視角3D頭戴立體藍光VR虛擬眼鏡(VR360BK)
智慧穿戴, [ZIYA] Apple Watch 無線充電器收納支架 矽膠材質 時尚飛碟款
智慧穿戴, SUUNTO 3 Fitness 保持健康與活力生活的體適能運動腕錶 (香檳金)
智慧穿戴, JSmax SB-V7 智慧健康管理手環
智慧穿戴, hoco Apple Watch (42/44mm) 格朗鋼錶帶-銀色款
智慧穿戴, 【LTE版】Samsung Galaxy Watch 智慧型手錶 (42mm)-玫瑰金
智慧穿戴, DUX DUCIS Apple Watch S2/S3-42mm 電鍍TPU套組
智慧穿戴, Fitbit Ionic 運動錶帶
智慧穿戴, Apple Watch 38mm 全包覆軟性保護套
智慧穿戴, hoco Apple Watch (38/40mm) 格朗鋼錶帶-銀色款
智慧穿戴, 小米手環2經典真皮環帶
智慧穿戴, Apple Watch 38mm 亮彩運動防水錶帶
智慧穿戴, Morbido蒙彼多 Apple Watch 44mm鍊式不鏽鋼錶帶
智慧穿戴, Apple Watch 不鏽鋼三珠蝶扣錶帶-贈拆錶器(沉穩黑-38mm)
智慧穿戴, My Watch 運動健康藍牙智慧手環(Line提醒/運動計步)MY15
智慧穿戴, PKG Apple Watch 錶面保護貼-全滿版玻璃-黑色面板(38mm)
智慧穿戴, 時尚心率藍牙智能手錶
智慧穿戴, Apple Watch 不鏽鋼三珠蝶扣錶帶-贈拆錶器40mm
智慧穿戴, JSmax BY-21 智慧健康管理手環
智慧穿戴, Apple Watch S5 GPS版 44mm 鋁錶殼配運動錶帶
智慧穿戴, Apple watch網狀透氣矽膠無扣錶帶42ｍｍ
智慧穿戴, NILLKIN Apple Watch S4 (44mm) 3D AW+ 滿版玻璃貼
智慧穿戴, JSmax VR-B5 頭戴式3D影音虛擬實境
智慧穿戴, WINDA For: ASUS Zenwatch 3 錶面保護貼(超滑疏油疏水亮面抗刮)
智慧穿戴, Apple Watch S5 GPS版 40mm 鋁錶殼配運動錶帶
智慧穿戴, Morbido蒙彼多 Apple Watch 38mm 金屬錶帶連接器(卡扣式)
智慧穿戴, ALATECH Star One GPS腕式心率智慧運動錶 (WB001)
智慧穿戴, 【Amazfit華米】米動手錶青春版2 BipS智慧運動心率智慧手錶（原廠公司貨）(2020升級版)
智慧穿戴, Apple Watch 42mm 亮彩運動防水錶帶
智慧穿戴, Fitbit Versa 專用原廠充電線
智慧穿戴, JSmax SB-CK18S專用錶帶
智慧穿戴, Apple Watch 可愛兔兔造型保護套(42mm)
智慧穿戴, 美國NOMAD 全球限量 Apple Watch 鈦金屬錶帶 -42/44mm
智慧穿戴, 西歐科技潘朵拉盒子VR 3D眼鏡 (贈送搖桿)
智慧穿戴, EPSON BT300 AR智慧眼鏡
智慧穿戴, Apple Watch Series 3 (GPS) 38mm 銀色鋁金屬錶殼+白色錶帶
智慧穿戴, HTC VIVE Cosmos Elite
智慧穿戴, Kworld 廣寰 3D-VR虛擬實境眼鏡
智慧穿戴, TCSTAR 3D立體虛擬實境VR眼鏡 EYE3DVR
智慧穿戴, JSmax SB-E18S 錶帶
智慧穿戴, elago W2 Apple Watch 人氣設計大獎充電座
智慧穿戴, My Watch 彩色運動心率藍牙智慧手環(來電提醒/運動計步)MY17
智慧穿戴, Apple Watch Series 5(GPS) 40mm太空灰鋁金屬錶殼+黑色運動錶帶
智慧穿戴, Morbido蒙彼多 Apple Watch 42mm 金屬錶帶連接器(螺絲式)
智慧穿戴, CATALYST APPLE WATCH 42mm 3代輕薄防水保護殼
智慧穿戴, QinD Apple Watch (44mm) 金剛隱形膜
智慧穿戴, Morbido蒙彼多Apple Watch 40m尼龍編織運動錶帶
智慧穿戴, Elago Apple watch 鋁合金支架
智慧穿戴, HTC VIVE Focus Plus
智慧穿戴, Apple Watch 3D曲面全覆蓋超薄鋼化保護貼 38mm 黑色
智慧穿戴, HANLIN-H19 門禁感應運動心率手錶 (IPS全彩螢幕）
智慧穿戴, Morbido蒙彼多 Apple Watch C型鋁合金充電支架
智慧穿戴, Kooper酷跑 M30 運動手環/健康/IP67防水(多項健康數據監測) 超值雙錶帶
智慧穿戴, D&A 小米手環 2 日本原膜NEW AS玻璃奈米5H 螢幕保護貼(超值2入)
智慧穿戴, Apple Watch Series 5(GPS+網路)44mm太空灰鋁金屬錶殼+黑色錶帶
智慧穿戴, Fitbit Versa 經典錶帶
智慧穿戴, E-books V3 第八代虛擬實境VR頭戴眼鏡
智慧穿戴, XUNDD 訊迪 Apple Watch 4 (44mm) 全包金屬色防摔軟殼 (銀河金)
智慧穿戴, Apple Watch (44/42mm) 雙色洞洞運動矽膠錶帶
智慧穿戴, XUNDD 訊迪 Apple Watch 4 (44mm) 全包金屬色防摔軟殼 (星鑽銀)
智慧穿戴, 【送錶帶】小米手環4組合
智慧穿戴, 【Morbido蒙彼多】Apple Watch (42mm) 鍊式不鏽鋼錶帶
智慧穿戴, [無卡分期-12期]Apple Watch Nike S5(GPS) 40mm太空灰鋁金屬錶殼黑錶帶
智慧穿戴, Morbido蒙彼多 Apple Watch 40mm鍊式不鏽鋼錶帶
智慧穿戴, PKG Apple Watch 邊框面板殼保護護殼-晶透(硬式不發黃)
智慧穿戴, E-books VR遊戲組 - 虛擬實境VR頭戴眼鏡+藍牙VR遊戲搖桿 (V3+V2)
智慧穿戴, Morbido蒙彼多 Apple Watch 40mm運動型錶帶-黑配螢光黃
智慧穿戴, Casetify Apple Watch 38/40mm 時尚錶帶-豹紋
智慧穿戴, AmazingThing Garmin Fenix 5S 螢幕保護貼
智慧穿戴, 小米手環3 深空藍
智慧穿戴, g-IDEA Apple Watch 38mm TPU 透明軟殼/鋼化玻璃貼組
智慧穿戴, 小米手環2繽紛腕帶(副廠)
智慧穿戴, Samsung Galaxy Fit 運動手環 (SM-R370)
智慧穿戴, [福利品]Acer 宏碁 Leap Beads 智慧佛珠
智慧穿戴, My Watch 運動管家藍牙智慧手環(計步/LINE提醒) MY12
智慧穿戴, Apple Watch Nike+S3 42mm 鋁金屬錶殼搭運動型錶帶(LTE版)
智慧穿戴, XUNDD 訊迪 Apple Watch 4 (40mm) 全包金屬色防摔軟殼 (銀河金)
智慧穿戴, Apple Watch Nike+ (GPS) 38mm太空灰色鋁金屬錶殼+黑色Nike錶帶
智慧穿戴, D&A Sony SmartBand Talk SWR30日本原膜HC曲面螢幕保護貼-2入
智慧穿戴, hoco Apple Watch (42/44mm) 格朗鋼錶帶-黑色款
智慧穿戴, 【hoda】Apple Watch 42mm 3D全曲面滿版9H鋼化玻璃保護貼
智慧穿戴, Apple Watch Series 5(GPS+網路)44mm銀色鋁金屬錶殼+白色錶帶
