智慧穿戴, 【小米手環4】繁體中文版 運動手環
智慧穿戴, GARMIN vivosmart 4 健康心率手環
智慧穿戴, 【Amazfit華米】米動手錶青春版2 BipS智慧運動心率智慧手錶（原廠公司貨）(2020升級版)
智慧穿戴, 【官旗】華為 HUAWEI WATCH GT2 運動版智慧手錶-46mm 曜石黑
智慧穿戴, GARMIN vivoactive 4S GPS 智慧腕錶
智慧穿戴, 小米手環3/4 腕帶 替換帶 液態硅膠 錶帶 運動智能錶帶 防水防丟
智慧穿戴, Garmin Vivomove HR 時尚智慧腕錶 運動款-時尚黑玫瑰金(小)
智慧穿戴, 【官旗】華為 HUAWEI WATCH GT2 時尚版智慧手錶-46mm 砂礫棕
智慧穿戴, GARMIN VIVOLIFE 悠遊智慧腕錶
智慧穿戴, 【Amazfit華米】米動手錶Stratos 3智能運動心率智慧手錶（原廠公司貨）
智慧穿戴, ANTIAN 小米手環4 格朗系列 金屬錶帶 替換腕帶 高端商務時尚手錶帶
智慧穿戴, Fitbit Inspire HR 智能健身手環
智慧穿戴, GARMIN Vivofit 4 健身運動手環
智慧穿戴, GARMIN VENU AMOLED GPS 智慧腕錶
智慧穿戴, 【官旗】華為HUAWEI Band 4 智慧手環
智慧穿戴, Apple Watch S5 GPS版 40mm 鋁錶殼配運動錶帶
智慧穿戴, 【GOLiFE】Care U 多功能智慧運動心率手環(彩屏觸控 健康管理)
智慧穿戴, 小米米家石英錶
智慧穿戴, Apple Watch S5 GPS版 44mm 鋁錶殼配運動錶帶
智慧穿戴, Fitbit Versa 2 健康運動智慧手錶
智慧穿戴, GARMIN vivoactive 4 GPS 智慧腕錶
智慧穿戴, Samsung Galaxy Watch Active2 智慧手錶-鋁製/40mm
智慧穿戴, GARMIN vivoactive3 行動支付心率智慧腕錶
智慧穿戴, Fitbit Charge 3 智慧手環
智慧穿戴, GARMIN vivomove 3s 指針智慧腕錶
智慧穿戴, Apple Watch S5 NIKE GPS版 44mm 鋁錶殼配運動錶帶
智慧穿戴, Dream智慧時尚運動手環 USB供電設計 IP68防水防塵
智慧穿戴, 小米手環3/4 腕帶 替換帶 尼龍編織回環式錶帶 透氣舒適 運動智能錶帶
智慧穿戴, 【官旗】華為 HUAWEI WATCH GT2 運動版智慧手錶-42mm 湖光青
智慧穿戴, 小米手環4單色錶帶腕帶(副廠)
智慧穿戴, 小米手環3/4代專用 不鏽鋼金屬錶帶 (贈錶帶調整器)
智慧穿戴, 小米手環4運動雙彩雙色撞色腕帶錶帶
智慧穿戴, 小米手環4代快捷夾式 免拆 USB充電線(CH-708)-30cm
智慧穿戴, JSmax BM-08健身運動&健康管理智慧型手環
智慧穿戴, ASUS VivoWatch SE (HC-A04A)GPS智慧手錶(血壓錶)
智慧穿戴, GARMIN Forerunner 45 GPS腕式心率跑錶
智慧穿戴, Apple Watch Series 3 GPS 42mm太空色鋁金屬錶殼+黑色運動錶帶
智慧穿戴, 【福利品】Apple Watch Series 4 (GPS+行動網路) 44mm鋁金屬錶殼
智慧穿戴, JSmax SW-V5 AI人工智能健康管理手錶
智慧穿戴, ANTIAN 小米手環4 防水耐磨個性雙色腕帶 智能運動手環錶帶 時尚舒適手錶帶
智慧穿戴, E-books V8 藍牙彩屏大錶面健康智慧手錶
智慧穿戴, D&A 小米手環 4 極薄水透膜螢幕保護貼(超值2入)
智慧穿戴, HUAWEI 華為 Watch GT 運動智慧手錶 -曜石黑
智慧穿戴, ANTIAN 小米手環4 探索版透明手環腕帶 替換錶帶 時尚舒適矽膠手錶帶
智慧穿戴, Apple Watch Series 3(GPS)38mm太空灰錶殼搭配黑色運動錶帶
智慧穿戴, GARMIN Fenix 6X Pro Solar(太陽能) 進階複合式運動GPS腕錶
智慧穿戴, Apple Watch Series 3 GPS 42mm太空色鋁金屬錶殼+黑色運動錶帶
智慧穿戴, Apple Watch Nike+ (GPS)42mm 太空灰色鋁金屬錶殼+黑色Nike運動型錶帶
智慧穿戴, GARMIN INSTINCT TACTICAL EDITION本我系列軍事戰術版
智慧穿戴, Apple Watch SERIES 3 Nike GPS太空灰色鋁金屬錶殼搭黑色運動型錶帶38mm
智慧穿戴, GARMIN LEGACY HERO 傳奇英雄系列特別版智慧腕錶
智慧穿戴, Apple Watch Series 4(GPS+網路)40mm金色鋁金屬錶殼+粉沙色錶帶
智慧穿戴, 【官旗】華為 HUAWEI Band 4e 智慧手環
智慧穿戴, Fitbit Versa 2 健康運動智慧手錶 特別款
智慧穿戴, GARMIN vivomove luxe 指針智慧腕錶(皮革錶帶)
智慧穿戴, GARMIN Approach S62 進階高爾夫GPS腕錶
智慧穿戴, 華為 HUAWEI WATCH GT 活力款智慧手錶
智慧穿戴, GOLiFE Care 3 藍牙智慧全彩觸控心率手環~速
智慧穿戴, Apple Watch S3 42mm 鋁金屬錶殼搭配運動型錶帶(GPS版)
智慧穿戴, JSmax SC-C30 智慧多功能健康管理運動手環(多項健康數據監測)
智慧穿戴, HUAWEI 華為 Watch GT2 智慧手錶-運動款 (46mm /曜石黑)
智慧穿戴, 【藍芽版】Samsung Galaxy Watch 智慧型手錶 (42mm)
智慧穿戴, Apple Watch S5 44mm 鋁金屬錶殼搭運動型錶帶(LTE版)
智慧穿戴, 小米4代專用 免拆錶帶充電線 夾式充電器
智慧穿戴, (99成新) Huawei 華為 Watch GT 運動智慧手錶-黑色(曜石黑矽膠錶帶)
智慧穿戴, GARMIN INSTINCT 本我系列GPS腕錶
智慧穿戴, 小米手環4絲絨編織尼龍運動防水錶帶腕帶
智慧穿戴, ANTIAN 小米手環4 米蘭尼斯金屬錶帶 商務腕帶 替換手環腕帶 卡扣款
智慧穿戴, ANTIAN 小米手環4 米蘭尼斯金屬錶帶 替換腕帶 商務時尚手腕帶 磁吸版
智慧穿戴, Apple Watch S5 44mm 鋁金屬錶殼配運動型錶帶(GPS)
智慧穿戴, GOLiFE Care Xu 智慧全彩悠遊心率手環(觸控螢幕)
智慧穿戴, Garmin Vivomove HR 時尚智慧腕錶 典雅款
智慧穿戴, E-books V5 藍牙多功能運動智慧手環
智慧穿戴, HUAWEI 華為 Watch GT2 智慧手錶-時尚款 (46mm/砂礫棕)
智慧穿戴, HUAWEI 華為 Watch GT 運動智慧手錶 - 曜石黑
智慧穿戴, Apple Watch S5 GPS版 44mm 鋁錶殼配運動錶帶
智慧穿戴, 【AFAMIC 艾法】C18智能心率GPS運動手環 運動手錶 磁吸錶帶
智慧穿戴, 華為 HUAWEI WATCH GT 雅緻款智慧手錶
智慧穿戴, MR 小米手環3/4通用尼龍編織運動替換錶帶
智慧穿戴, GARMIN Forerunner 45S GPS腕式心率跑錶
智慧穿戴, Samsung Galaxy Watch Active2 智慧手錶-不鏽鋼44mm
智慧穿戴, GARMIN 冰雪奇緣 2 VIVOFIT JR. 2 安娜與艾莎
智慧穿戴, GARMIN VIVOMOVE HR 時尚智慧腕錶
智慧穿戴, 【藍牙版】Samsung Galaxy Watch 智慧型手錶 (46mm)-星燦銀
智慧穿戴, 小米手環4迷彩炫彩腕帶錶帶-迷彩系列
智慧穿戴, Apple Watch Nike+S3 38mm鋁金屬錶殼搭配運動型錶帶(GPS版)
智慧穿戴, JSmax SB-V11 智慧多功能健康運動手環
智慧穿戴, GARMIN Fenix 6X 進階複合式運動GPS腕錶
智慧穿戴, Garmin Forerunner 945 全方位鐵人運動錶
智慧穿戴, Fitbit Charge4 健康智慧手環
智慧穿戴, HUAWEI 華為 Watch GT2 智慧手錶-運動款(42mm/湖光青)
智慧穿戴, Apple Watch S3 38mm 鋁金屬錶殼搭運動型錶帶(GPS版)
智慧穿戴, 小米手環4米蘭金屬錶帶腕帶-磁吸版
智慧穿戴, HUAWEI Band2 Pro 智慧手環
智慧穿戴, GARMIN Fenix 6 進階複合式運動GPS腕錶
智慧穿戴, JSmax SW-Q9 旗艦款智慧健康運動管理手錶(運動&健康數據監測)
智慧穿戴, Garmin Forerunner 245 GPS腕式心率跑錶
智慧穿戴, Garmin Forerunner 245 Music GPS腕式心率音樂跑錶
智慧穿戴, Apple Watch Series 5(GPS) 44mm金色鋁金屬錶殼+粉沙色運動錶帶
智慧穿戴, HUAWEI Band 3e專業跑步智能手環
智慧穿戴, SAMSUNG Galaxy Watch Active2 44mm 鋁製 (藍牙)
智慧穿戴, GARMIN vivomove style 指針智慧腕錶(矽膠錶帶)
智慧穿戴, Apple Watch Nike+S5 44mm 鋁金屬錶殼搭運動型錶帶(GPS版)
智慧穿戴, Apple Watch Nike+S3 42mm鋁金屬錶殼搭配運動型錶帶(GPS版)
智慧穿戴, Apple Watch Series 5(GPS) 40mm金色鋁金屬錶殼+粉沙色運動錶帶
智慧穿戴, 小米手環2經典撞色系列腕帶
智慧穿戴, E-books V10 藍牙防水大錶面運動手錶
智慧穿戴, GOLiFE GoWatch X-PRO 全方位智慧戶外運動GPS腕錶-銀色
智慧穿戴, GARMIN Fenix 6s 進階複合式運動GPS腕錶
智慧穿戴, HUAWEI Watch GT GPS運動智慧手錶-雅致款
智慧穿戴, Suunto 3 苔蘚灰 / 輕巧耐用，配置【智能訓練導引】的運動腕錶
智慧穿戴, 三星SAMSUNG Galaxy Watch Active2 44mm AL手錶
智慧穿戴, SUUNTO 5 堅固輕巧質精、絕佳電池續航力的多項目運動GPS腕錶 (經典黑)
智慧穿戴, 小米手環3雙色撞色錶帶腕帶
智慧穿戴, AI藍芽通話心律多功能智能運動手錶
智慧穿戴, E-books V4 藍牙健康運動智慧手環
智慧穿戴, Apple Watch S5 GPS版 40mm金色鋁錶殼配粉沙色運動錶帶MWV72TA
智慧穿戴, 【GOLiFE】Care P 藍牙智慧全彩觸控心率手環(腕式光學心率感測技術)
智慧穿戴, MR 小米手環3/4通用撞色矽膠運動替換錶帶
智慧穿戴, SUUNTO 9 Baro 超長電池續航力及氣壓式高度的多項目運動GPS腕錶 (經典黑)
智慧穿戴, MR 小米手環3/4通用運動矽膠替換錶帶
智慧穿戴, GARMIN INSTINCT 本我系列 GPS 腕錶
智慧穿戴, Apple Watch Series 5(44mm)鋁金屬錶殼運動型錶帶
智慧穿戴, Apple Watch Series 4(GPS+網路)44mm銀色鋁金屬錶殼+白色錶帶
智慧穿戴, SUUNTO 3 Fitness 保持健康與活力生活的體適能運動腕錶 (全黑)
智慧穿戴, 人因 ERGOLINK MWB230心律智慧監測運動手環
智慧穿戴, Samsung Galaxy Watch Active2 Under Armour聯名款
智慧穿戴, Apple Watch Series 3(GPS)42mm太空色鋁金屬錶殼+黑色運動錶帶
智慧穿戴, Apple Watch S5 40mm 鋁金屬錶殼配運動型錶帶(GPS)
智慧穿戴, 犀牛盾 Apple Watch 44mm Crashguard NX防摔邊框保護殼
智慧穿戴, GARMIN Descent MK1 GPS 潛水電腦錶 酷灰鈦金款
智慧穿戴, 小米手環4專用 高清TPU奈米保謢貼膜(軟膜) 2入組
智慧穿戴, GARMIN Forerunner 645 GPS智慧心率跑錶
智慧穿戴, mijobs 小米手環 4 / 手環 3 矽膠腕帶
智慧穿戴, 【拆封新品】HUAWEI 華為 WATCH GT 運動智慧型手錶_曜石黑矽膠錶帶 (贈原廠運動臂帶+鋼保)
智慧穿戴, 三星SAMSUNG Galaxy Watch Active2 40mm AL 手錶
智慧穿戴, Fitbit Charge 3 智慧手環 特別版
智慧穿戴, Fitbit Charge4 健康智慧手環 特別版
智慧穿戴, MR 小米手環3/4通用不鏽鋼三珠摺疊扣錶帶
智慧穿戴, Apple Watch Series 5(GPS+網路)44mm太空灰鋁金屬錶殼+黑色錶帶
智慧穿戴, SUUNTO 9 Baro 超長電池續航力及氣壓式高度的多項目運動GPS腕錶 (時尚白)
智慧穿戴, 【LTE版】Samsung Galaxy Watch 智慧型手錶 (46mm)-星燦銀
智慧穿戴, 西歐科技 智慧健康管理手錶 CME-X8-H80
智慧穿戴, Adpe 小米2 純色矽膠手環錶帶
智慧穿戴, GARMIN Vivofit jr2 小童手環 (星際大戰系列)
智慧穿戴, Apple Watch 1/2/3/4/5 尼龍編織 回環式運動錶帶
智慧穿戴, Apple Watch Nike S5(GPS)40mm 太空灰鋁金屬錶殼+黑色錶帶
智慧穿戴, GOLiFE Care 健康智慧手環(by PAPAGO!) -灰黑色 (送GOLiFE 束口袋)
智慧穿戴, 【AFAMIC 艾法】情侶優惠組合 C18+CH2 智能心率運動手環
智慧穿戴, Apple Watch Series 5(GPS) 44mm金色鋁金屬錶殼+粉沙色運動錶帶
智慧穿戴, GARMIN Forerunner 645 Music GPS智慧心率音樂跑錶
智慧穿戴, [無卡分期-12期]Apple Watch Series 5(GPS+網路)44mm金色鋁錶殼粉錶帶
智慧穿戴, JSmax SW-E04H8 智慧AI多功能健康管理手環
智慧穿戴, Samsung Galaxy Watch Active2 智慧手錶-鋁製/44mm
智慧穿戴, (贈2個錶帶)【AFAMIC 艾法】M3藍芽智能心率GPS運動手環
智慧穿戴, HUAWEI 華為 WATCH GT 運動智慧型手錶_曜石黑矽膠錶帶 (贈原廠運動臂帶等3好禮)
智慧穿戴, HUAWEI華為 原廠 Watch 2 專用運動錶帶 (公司貨-盒裝)
智慧穿戴, [無卡分期-12期]Apple Watch Nike S5(GPS+網路)44mm太空灰鋁錶殼黑錶帶
智慧穿戴, 【AFAMIC 艾法】M8藍芽智能心率GPS運動手環 運動手錶 (可更換錶帶)
智慧穿戴, MR 小米智慧手環4 米蘭式磁吸錶帶(黑色)
智慧穿戴, SUUNTO Traverse 健行、徒步、登山越野及運動鍛鍊GPS腕錶
智慧穿戴, SUUNTO Ambit3 Sport HR 進階多項目運動GPS腕錶
智慧穿戴, ASUS VivoWatch SE 智慧手錶
智慧穿戴, Apple Watch Edition(GPS+網路) 38mm白色陶瓷錶殼+柔白配石灰運
智慧穿戴, ANTIAN 小米手環3 米蘭尼斯款替換手錶錶帶 磁吸版
智慧穿戴, 小米手環 3/4代專用 尼龍錶帶
智慧穿戴, 西歐科技 智慧健康管理手錶 CME-X8-H80
智慧穿戴, 【AFAMIC 艾法】M3藍芽智能心率GPS運動手環
智慧穿戴, Apple Watch S5 GPS版 40mm太空灰鋁錶殼黑色運動錶帶MWV82TA
智慧穿戴, Apple Watch S5 GPS版 44mm金色鋁錶殼配粉沙色運動錶帶MWVE2TA
智慧穿戴, HUAWEI WATCH GT 雅致款
智慧穿戴, 【GOLiFE】Care U 多功能智慧運動心率手環
智慧穿戴, 華米 Amazfit 米動手錶青春版 20mm 不鏽鋼金屬替換錶帶 (贈錶帶調整器)
智慧穿戴, [無卡分期-12期]Apple Watch Nike S5(GPS) 44mm太空灰鋁金屬錶殼黑錶帶
智慧穿戴, SUUNTO 9 Baro 超長電池續航力及氣壓式高度的多項目運動GPS腕錶 (復古銅)
智慧穿戴, Apple Watch S5 GPS版 44mm太空灰鋁錶殼黑色運動錶帶MWVF2TA
智慧穿戴, HUAWEI華為 原廠 TalkBand B5 專用腕帶 (公司貨-盒裝)
智慧穿戴, ANTIAN 小米手環3 防水耐磨個性雙色腕帶 小米3智能運動手環腕帶
智慧穿戴, Apple Watch Series 3(GPS+網路) 42mm太空灰鋁金屬錶殼+黑色運動錶帶
智慧穿戴, Suunto 3 板岩復古銅 / 輕巧耐用，配置【智能訓練導引】的運動腕錶
智慧穿戴, MR 小米手環3/4通用 米蘭式磁吸錶帶(銀色)
智慧穿戴, Suunto 3 板岩灰 / 輕巧耐用，配置【智能訓練導引】的運動腕錶
智慧穿戴, ASUS VivoWatch SE (HC-A04A) 智慧健康錶
智慧穿戴, Samsung Galaxy Watch Active2 44mm鋁製藍牙 R820*
智慧穿戴, CATALYST APPLE WATCH 44mm 4代輕薄防水保護殼
智慧穿戴, Apple Watch S5 40mm 鋁金屬錶殼搭運動型錶帶(LTE版)
智慧穿戴, 熱銷優惠組合 C80+T3 智能心率運動手環( 動態畫面 智慧手錶 運動數據 )
智慧穿戴, [無卡分期-12期]Apple Watch S5(GPS) 40mm金色鋁金屬錶殼+粉沙色運動錶帶
智慧穿戴, SUUNTO 5 精鋼石墨灰 / 堅固輕巧質精、絕佳電池續航力的多項目運動GPS腕錶
智慧穿戴, Samsung Galaxy Watch Active2 44mm鋁製藍牙 R820
智慧穿戴, USAMS Apple Watch 5/4 米蘭尼斯磁吸金屬錶帶 送錶殼
智慧穿戴, Apple Watch Nike+S5 40mm 鋁金屬錶殼搭運動型錶帶(LTE版)
智慧穿戴, Apple Watch S5 NIKE GPS版 40mm 鋁錶殼配運動錶帶
智慧穿戴, GARMIN Vivofit jr2 小童手環(迪士尼公主系列)
智慧穿戴, Samsung Galaxy Watch Active2 44mm不鏽鋼藍牙 R820
智慧穿戴, Samsung Galaxy Watch Active2 智慧手錶-不鏽鋼44mm
智慧穿戴, 美國NOMAD 全球限量 Apple Watch 鈦金屬錶帶 -42/44mm
智慧穿戴, 兩組入 小米手環4代專用 水凝膜 高清滿版 透明 防爆防刮 螢幕保護貼
智慧穿戴, 華米 Amazfit 米動手錶青春版 20mm 純色矽膠運動替換手環錶帶
智慧穿戴, GOLiFE GoWatch X-PRO 全方位智慧戶外運動GPS腕錶-銀色
智慧穿戴, GARMIN Approach Z80 GPS 高爾夫雷射測距儀
智慧穿戴, 小尋兒童電話手錶F5
智慧穿戴, SAMSUNG Galaxy Watch Active2 44mm 不鏽鋼(藍牙)
智慧穿戴, 【AFAMIC 艾法】S3-PRO彩色遙控自拍心率GPS運動手環
智慧穿戴, SUUNTO Core Alu 時尚設計戶外功能運動錶
智慧穿戴, SUUNTO Core Crush 時尚設計戶外功能運動錶
智慧穿戴, Apple Watch 1/2/3/4/5 真皮質商務錶帶 撞色腕帶
智慧穿戴, 犀牛盾 Apple Watch 42mm Crashguard NX防摔邊框保護殼
智慧穿戴, AHOYE 藍芽智慧運動手環 計步器 黑色
智慧穿戴, Baseus倍思 悠悠球 蘋果手錶無線充  Apple Watch磁吸充電器 行動充
智慧穿戴, Apple Watch S3 42mm 鋁金屬錶殼搭運動型錶帶(LTE版)
智慧穿戴, 【AFAMIC 艾法】S3動態彩屏智能心率GPS運動手環
智慧穿戴, 雙揚i-gotU Q69HR 心率智慧手環-彩色顯示螢幕(針扣式錶扣)
智慧穿戴, AHOYE 藍芽智慧運動手環 計步器 藍色
智慧穿戴, Apple Watch Nike+S5 40mm 鋁金屬錶殼搭運動型錶帶(GPS版)
智慧穿戴, JSmax SW-CK19 旗艦智慧健康運動管理手錶(運動&健康數據監測)
智慧穿戴, AHOYE 藍芽智慧運動手環 計步器 黃色
智慧穿戴, MR 小米手環3/4通用不鏽鋼三珠摺疊扣錶帶
智慧穿戴, 熱銷優惠組合 C80+S5 智能心率運動手環 ( 動態畫面 智慧手錶 運動數據 )
智慧穿戴, 【LTE版】Samsung Galaxy Watch 智慧型手錶 (42mm) R815 -午夜黑
智慧穿戴, (贈保護貼)【SHOWHAN】小米手環4運動雙色撞色腕帶/錶帶/12色
智慧穿戴, mijobs 小米手環 4 / 手環 3 不鏽鋼腕帶(竹節款)
智慧穿戴, Amazfit Bip米動手錶青春版尼龍運動錶帶
智慧穿戴, (結帳再折)ROBOCAR POLI 波力安寶 IS愛思 4G LTE定位關懷兒童智慧手錶
智慧穿戴, Fitbit Charge 3 智能手環運動腕帶 3D鑽石紋 防水透氣硅膠錶帶
智慧穿戴, RIDATA錸德 Q-69HR 藍芽智能手環/含心律功能(彩色顯示螢幕)
智慧穿戴, Apple Watch 1/2/3/4/5 雙色款硅膠運動型錶帶
智慧穿戴, 【LTE版】SAMSUNG Galaxy Watch 42mm R815
智慧穿戴, 【AFAMIC 艾法】M3-PLUS彩色遙控自拍心率GPS運動手環 運動手錶
智慧穿戴, mijobs 小米手環 4 / 手環 3 不鏽鋼腕帶(三珠款)
智慧穿戴, SUUNTO 9 Baro 品牌大使 限量版 / 超長續航力及氣壓計的多項目運動GPS腕錶
智慧穿戴, SUUNTO 9 Baro 超長電池續航力及氣壓式高度的多項目運動GPS腕錶 (鈦金屬黑)
智慧穿戴, SUUNTO 5 精鋼黑 / 堅固輕巧質精、絕佳電池續航力的多項目運動GPS腕錶
智慧穿戴, E-books V11藍牙防水高階鋁合金手錶
智慧穿戴, 熱銷優惠組合 C80+CH2 智能心率運動手環 ( 動態畫面 智慧手錶 運動數據 )
智慧穿戴, 【JSmax】SK-B16智慧物聯IOT運動健康管理手錶
智慧穿戴, GARMIN D2 Charlie 鈦金航空錶
智慧穿戴, SUUNTO Traverse 健行、徒步、登山越野及運動鍛鍊GPS腕錶
智慧穿戴, 小米手環3代 經典青春腕帶/錶帶 加贈保護貼2張
智慧穿戴, Apple Watch Nike S5(GPS)40mm 銀色鋁金屬錶殼+白色錶帶
智慧穿戴, TicWatch Pro SmartWatch 旗艦級智慧手錶-黑色
智慧穿戴, JSmax SW-C98 智慧多功能運動健康管理手錶(運動&健康數據監測)
智慧穿戴, JSmax SW-L8智慧多功能健康管理運動手錶
智慧穿戴, GARMIN fenix 5 Plus 行動支付音樂GPS複合式心率腕錶
智慧穿戴, Apple Watch Series 3(GPS+網路) 42mm銀色鋁金屬錶殼+白色錶帶
智慧穿戴, MR 小米智慧手環4 米蘭式磁吸錶帶(黑色)
智慧穿戴, 【AFAMIC 艾法】M5動態彩屏智能心率GPS手環
智慧穿戴, 美國NOMADXHORWEEN APPLE WATCH專用自然原色皮革錶帶
智慧穿戴, Suunto 3 花崗紅 / 輕巧耐用，配置【智能訓練導引】的運動腕錶
智慧穿戴, Fitbit Charge 3 智能手環米蘭錶帶 米蘭尼斯金屬替換腕帶 回環磁吸
智慧穿戴, Apple Watch Series 1/2/3/4/5 磁性金屬錶帶
智慧穿戴, SUUNTO 5 堅固輕巧質精、絕佳電池續航力的多項目運動GPS腕錶 (勃根地 復古銅)
智慧穿戴, [無卡分期-12期Apple Watch S3(GPS+網路)42mm 太空灰鋁+黑色錶帶
智慧穿戴, Apple Watch Series 5(GPS) 44mm銀色鋁金屬錶殼+白色運動錶帶
智慧穿戴, Baesus倍思 Apple Watch無線充圓點便攜式磁吸無線充iWatch無線充
智慧穿戴, SUUNTO Core Brushed Steel 時尚設計戶外功能運動錶
智慧穿戴, Morbido蒙彼多 Apple Watch 40mm 金屬錶帶連接器(螺絲式)
智慧穿戴, GARMIN fenix 5S Plus 行動支付音樂GPS複合式心率腕錶
智慧穿戴, 【AFAMIC 艾法】熱銷款組合 C18+C80 智能心率運動手環
智慧穿戴, 【Suunto Elementum】TERRA 登山釣魚計時錶/黑底黃紋皮質錶帶限量款
智慧穿戴, (贈2色錶帶)【長江】U-ta智能觸控防水藍牙手環C1
智慧穿戴, Samsung Galaxy Watch Active2 44mm不鏽鋼藍牙 R820
智慧穿戴, Mi Band 4 小米手環 4 高透光亮面耐磨保護貼(2入)
智慧穿戴, GOLiFE Care-XC 智慧全彩觸控心率手環-急速配
智慧穿戴, IS愛思 CW-10 4G LTE定位視訊關懷兒童智慧手錶
智慧穿戴, [無卡分期-12期]Apple Watch S5(GPS) 40mm銀色鋁金屬錶殼+白色運動錶帶
智慧穿戴, 華米 Amazfit GTR 22mm 不鏽鋼金屬替換錶帶 (贈錶帶調整器)
智慧穿戴, 蘋果手錶 Apple Watch4 曲面3D鋼化玻璃保護膜保護貼44mm-黑
智慧穿戴, 華米米動 Amazfit Bip Watch 20mm 尼龍織紋回環錶帶
智慧穿戴, [無卡分期-12期]GARMIN Forerunner 935 全方位鐵人運動錶
智慧穿戴, JSmax SA-P10超智能24H健康管理手環
智慧穿戴, [無卡分期-12期]Apple Watch Series 5(GPS)40mm太空灰鋁錶殼黑運動錶帶
智慧穿戴, SUUNTO Traverse Alpha 專為狩獵釣魚征服叢林野外的GPS腕錶-迷彩綠
智慧穿戴, 2片裝 Apple Watch 4/5代 水凝膜 高清 防爆 手錶保護貼
智慧穿戴, Kooper酷跑 M30 運動手環/健康/IP67防水(多項健康數據監測) 超值雙錶帶
智慧穿戴, TicWatch S2 探索運動智慧手錶-黑色
智慧穿戴, mijobs 小米手環 4 / 手環 3 經典米蘭腕帶
智慧穿戴, Apple Watch Series 5(GPS) 44mm太空灰鋁金屬錶殼+黑色運動錶帶
智慧穿戴, Apple Watch 1/2/3/4/5 純色硅膠 運動型錶帶
智慧穿戴, GARMIN Vivofit jr2 小童手環 (復仇者系列)
智慧穿戴, TicWatch Pro SmartWatch 旗艦級智慧手錶-銀色
智慧穿戴, [JSmax] SA-V19超智能AI健康運動管理手環
智慧穿戴, Apple Watch Nike+ S3(GPS+網路)38mm太空灰鋁金屬錶殼配黑色錶帶
智慧穿戴, 華米AMAZFIT 米動 青春版手錶專用 純色保護殼
智慧穿戴, SUUNTO 5 堅固輕巧質精、絕佳電池續航力的多項目運動GPS腕錶 (時尚白)
智慧穿戴, 華米米動 Amazfit GTR 47mm 純色矽膠運動替換手環錶帶 (錶帶寬度22mm)
智慧穿戴, Apple Watch Series 4(GPS+網路)40mm銀色鋁金屬錶殼+貝殼色錶環
智慧穿戴, [無卡分期-12期]Apple Watch Series 5(GPS)40mm金色鋁錶殼粉色運動錶帶
智慧穿戴, GOLiFE Care Xu 智慧全彩悠遊心率手環
智慧穿戴, [無卡分期-12期]GARMIN Approach S60高爾夫腕錶
智慧穿戴, Apple Watch Series 3(GPS+網路) 38mm銀色鋁金屬錶殼+白色錶帶
智慧穿戴, My Watch 運動健康藍牙智慧手環(Line提醒/運動計步)MY15
智慧穿戴, GARMIN Vivofit jr2 小童手環(漫威蜘蛛人系列)
智慧穿戴, EPSON Pulsense 心率智慧手環 ( PS-100 B)
智慧穿戴, mijobs 小米手環 4 / 手環 3 不鏽鋼腕帶(竹節款)
智慧穿戴, 華米米動 Amazfit GTR 47mm 尼龍織紋回環錶帶 (錶帶寬度22mm)
智慧穿戴, GOLiFE CareP 藍牙智慧全彩觸控心率手環(腕式光學心率感測技術)
智慧穿戴, MIUI 小米手環3 原廠充電線 迷你便攜專用充電器 USB充電
智慧穿戴, 【AFAMIC 艾法】限量優惠組合 C18+S5 智能心率GPS運動手環
智慧穿戴, GOLiFE Care 3 藍牙智慧全彩觸控心率手環
智慧穿戴, 美國NOMADxHORWEEN皮革 Apple Watch 42/44mm錶帶-摩登款
智慧穿戴, GOLiFE GoWatch X-PRO 2 全方位戶外心率GPS腕錶
智慧穿戴, 美國NOMADxHORWEEN Apple Watch專用皮革錶帶-摩登38/40mm
智慧穿戴, GARMIN vívofit jr. 2 漫威蜘蛛人系列腕帶
智慧穿戴, 雙揚 i-gotU Q82 心率運動手錶-具遠端健康關懷功能
智慧穿戴, 雙揚 i-gotU Q90 心率運動手錶-具遠端健康關懷功能
智慧穿戴, Apple Watch手錶一分三充電線(一代不適用)
智慧穿戴, SUUNTO Core Ultimate Black 時尚設計戶外功能運動錶
智慧穿戴, GOLiFE GoWatch X-PRO 2 全方位戶外心率GPS腕錶-急速配
智慧穿戴, 【AFAMIC 艾法】限量優惠組合 M8藍芽智能心率GPS運動手環 2入組
智慧穿戴, Samsung Galaxy Watch 1.3吋 LTE版R805-星燦銀 (46mm)
智慧穿戴, 小米手環3專用 高清TPU奈米保謢貼膜(軟膜) 2入組
智慧穿戴, 美國 NOMAD APPLE WATCH 專用防水機能皮革錶帶-44/42mm-黑
智慧穿戴, Samsung Galaxy Watch 1.3吋藍牙版 R800-星燦銀 (46mm)
智慧穿戴, JSmax SW-HD1石英數位混合型智慧健康手錶
智慧穿戴, Spigen Apple Watch (42mm) Rugged Armor保護殼
智慧穿戴, 華米米動 Amazfit Bip Watch 20mm 米蘭尼斯磁吸式錶帶
智慧穿戴, Apple Watch 5/4/3/2/1 珍珠陶瓷蝴蝶扣錶帶 替換腕帶
智慧穿戴, Amazfit赤道月霜藍牙智慧運動手環
智慧穿戴, Apple Watch Series 3(GPS+網路) 42mm銀色鋁金屬錶殼+白色錶帶
智慧穿戴, GARMIN Approach CT10 揮桿追蹤系統(入門套組)
智慧穿戴, GARMIN fenix 5X Plus 行動支付音樂GPS複合式心率腕錶
智慧穿戴, Belkin Boost Up 三用無線充電座Apple Watch+iPhone+USB-A白
智慧穿戴, 智能觸控防水藍牙手環 (加碼贈紅/藍2色錶帶)
智慧穿戴, TicWatch C2 SmartWatch 智慧手錶-遂空黑
智慧穿戴, Apple Watch 4/5代 保護殼 超薄防摔 電鍍硅膠軟殼 手錶保護套
智慧穿戴, 美國NOMAD (Apple Watch 42/44mm專用錶帶) 堅固矽膠錶帶
智慧穿戴, apple watch iwatch蘋果手錶42mm絲絨編織尼龍錶帶腕帶(副廠)
智慧穿戴, 萬磁王 APPLE Watch 手錶保護殼44mm
智慧穿戴, Apple Watch Series 3(GPS+網路)42mm太空灰鋁金屬錶殼+黑色錶帶
智慧穿戴, MR 小米手環3/4通用金屬編織卡扣式錶帶
智慧穿戴, Apple Watch Series 4(GPS+網路)40mm太空灰鋁金屬錶殼+黑色錶環
智慧穿戴, SUUNTO 9 Baro 吉祥紅 節慶特別版 / 超長續航力及氣壓計的多項目運動GPS腕錶
智慧穿戴, GOLiFE Fit Plus藍牙智慧BMI電子體重計(by PAPAGO)-黑
智慧穿戴, TicWatch C2 SmartWatch 都會經典智慧手錶-粉色
智慧穿戴, mijobs 小米手環 4 / 手環 3 矽膠腕帶
智慧穿戴, Apple Watch 1/2/3/4/5 真皮質商務錶帶 撞款腕帶
智慧穿戴, UAG Apple Watch 42/44mm 潮流矽膠錶帶
智慧穿戴, Apple Watch series 4 免拆錶帶 環型螢幕包覆保護套
智慧穿戴, Apple Watch 5/4/3/2/1 金屬三珠不鏽鋼手錶帶 蘋果精鋼替換腕帶
