智慧穿戴, 【小米手環4】繁體中文版 運動手環
智慧穿戴, T.G Fitbit Charge 3 超薄3D防爆膜螢幕保護貼-霧面(2入)
智慧穿戴, Apple Watch 全膠硬邊3D曲面全覆蓋超薄鋼化保護貼-40mm/黑色(2入)
智慧穿戴, Promate Apple Watch 38/40mm高質感磁吸式錶帶(Lavish)
智慧穿戴, Apple Watch 可愛兔兔造型保護套(42mm)
智慧穿戴, GARMIN QUICK RELEASE 20mm VENU 矽膠錶帶
智慧穿戴, Morbido蒙彼多Apple Watch 38mm米蘭式磁吸不鏽鋼錶帶
智慧穿戴, GARMIN QUICK RELEASE 20mm 米蘭式編織錶帶
智慧穿戴, GARMIN 車架固定座
智慧穿戴, Twelve South HiRise Deluxe iPhone 充電立架 - 銀色
智慧穿戴, GARMIN QUICKFIT 26mm DLC鍍膜鈦合金錶帶
智慧穿戴, T.G Fitbit Versa 高透3D防爆水凝膜螢幕保護貼-滿版(2入)
智慧穿戴, GARMIN HRM-Tri 心率感測器
智慧穿戴, GARMIN QUICKRELEASE 18mm 矽膠錶帶
智慧穿戴, GARMIN QUICK RELEASE 20mm 義大利皮革錶帶
智慧穿戴, ELECOM Apple Watch 44mm布面錶帶-黑
智慧穿戴, NILLKIN Apple Watch S1/2/3 (42mm) 3D AW+ 玻璃貼
智慧穿戴, Apple Watch TPU軟質保護殼 38mm
智慧穿戴, CITY Apple Watch Series 3/2/1 38mm滿版全膠曲面玻璃貼
智慧穿戴, Morbido蒙彼多 Apple Watch 40mm鍊式不鏽鋼錶帶
智慧穿戴, GOLiFE Care-X smart band 智慧悠遊手環-黑色(搭贈悠遊卡錶帶)
智慧穿戴, Garmin QUICK RELEASE 皮革錶帶
智慧穿戴, GARMIN QUICKRELEASE 22mm 矽膠錶帶
智慧穿戴, Fitbit Charge 3 皮錶帶
智慧穿戴, GARMIN QUICKFIT 22mm 栗色皮革錶帶
智慧穿戴, HUAWEI華為 原廠 Watch GT 氟橡膠錶帶 (台灣公司貨)
智慧穿戴, 刀鋒Edge Apple Watch Series 5 44mm 鋁合金雙料保護殼 野性紅
智慧穿戴, GARMIN Vivoactive 3 Music GPS音樂智慧錶
智慧穿戴, 刀鋒Edge Apple Watch Series 5 44mm 鋁合金雙料保護殼 野性紅
智慧穿戴, 皇娥ATTACUS 官方品牌旗艦店-Obeat1 光學心率臂帶
智慧穿戴, Fitbit Inspire/Inspire HR 印花錶帶
智慧穿戴, DUX DUCIS Apple Watch S4 (40mm) 電鍍 TPU 套組
智慧穿戴, Scosche Rhythm24 手臂式心跳帶
智慧穿戴, Morbido蒙彼多Apple Watch 38mm尼龍編織運動錶帶
智慧穿戴, o-one 小螢膜 華為GTWatch-46mm 保護貼
智慧穿戴, 刀鋒Edge Apple Watch Series 5 40mm 鋁合金雙料保護殼 夜幕綠
智慧穿戴, GARMIN INSTINCT 替換錶帶 軍事戰術版 (迷彩)
智慧穿戴, NILLKIN Apple Watch S1/2/3 (38mm) 3D AW+ 玻璃貼
智慧穿戴, NILLKIN Apple Watch S4 (44mm) 3D AW+ 滿版玻璃貼
智慧穿戴, GARMIN LEGACY SAGA 傳奇星戰系列特別版智慧腕錶
智慧穿戴, GARMIN QUICK RELEASE 20mm 矽膠錶帶
智慧穿戴, Fitbit Inspire/Inspire HR 不鏽鋼錶帶
智慧穿戴, GARMIN AC 變壓器-快
智慧穿戴, GARMIN vivofit jr. 2 迪士尼系列腕帶
智慧穿戴, GARMIN D2 Delta PX 鈦金航空錶
智慧穿戴, Promate Apple Watch 38/40mm 經典真皮錶帶(Genio)
智慧穿戴, Spigen Apple Watch Rugged Armor-44mm防摔保護殼
智慧穿戴, AHAStyle AirPods(Pro)/iPhone/Apple Watch 鋁合金底座
智慧穿戴, GARMIN QUICK REALEASE 矽膠錶帶
智慧穿戴, Metal-Slim Apple Watch Series 4 40mm 全膠滿版保護貼
智慧穿戴, Samsung Galaxy Watch 40/42/44mm通用 米蘭尼斯磁吸式錶帶
智慧穿戴, NISDA  Apple Watch Series 4 40mm 3D滿版全膠玻璃貼
智慧穿戴, 刀鋒Edge Apple Watch Series 5 40mm 鋁合金雙料保護殼 經典黑
智慧穿戴, GARMIN HRM-RUN 心率感測器
智慧穿戴, GARMIN QUICK RELEASE 20mm 尼龍錶帶
智慧穿戴, AmazingThing Apple Watch 38mm 曲面強化玻璃保護貼 - 急速配
智慧穿戴, Garmin Forerunner 945 替換錶帶
智慧穿戴, Apple Watch 不鏽鋼七珠蝶扣錶帶-贈拆錶器(銀-42mm)
智慧穿戴, g-IDEA Apple Watch 42mm TPU 透明軟殼/鋼化玻璃貼組
智慧穿戴, Rearth Apple Watch S4/5 44mm 全包覆不鏽鋼錶框
智慧穿戴, SAMSUNG 三星 Gear S3 原廠磁力無線充電座 (盒裝)
智慧穿戴, QinD Apple Watch (40mm) 雙色矽膠保護套
智慧穿戴, ANTIAN 小米手環3 金屬替換腕帶 錶帶
智慧穿戴, Apple watch 42/44mm 菱格紋錶框帶
智慧穿戴, 刀鋒Edge Apple Watch Series 5 40mm 鋁合金雙料保護殼 經典黑
智慧穿戴, APPLE WATCH 金剛水靈膜保護貼38mm(附推膜卡)
智慧穿戴, QinD Apple Watch (44mm) 雙色矽膠保護套
智慧穿戴, 皇娥ATTACUS 官方品牌旗艦店-SC002藍牙/ANT+雙頻速度踏頻器
智慧穿戴, GARMIN INSTINCT 替換錶帶 軍事戰術版
智慧穿戴, 美國CASE●MATE x Kodak聯名款 AppleWatch 38/40mm錶帶-藍
智慧穿戴, GARMIN fenix Chronos 原廠不銹鋼錶帶
智慧穿戴, (44mm)一體成形 Apple Watch 防摔錶殼 運動矽膠手錶帶
智慧穿戴, Promate Apple Watch 42/44mm 高質感金屬錶帶Milous
智慧穿戴, GARMIN Forerunner 935 快拆組
智慧穿戴, 刀鋒Edge Apple Watch Series 5 44mm 鋁合金雙料保護殼 夜幕綠
智慧穿戴, GARMIN fenix 3 專用充電傳輸線  - 快速到貨
智慧穿戴, Apple watch 42mm 時尚 金屬鍊帶錶框
智慧穿戴, 刀鋒Edge Apple Watch Series 4(44mm)鋁合金雙料保護殼 野性紅
智慧穿戴, APPLE WATCH 金剛水靈膜保護貼40mm(附推膜卡)
智慧穿戴, AmazingThing Garmin Fenix 5S 螢幕保護貼
智慧穿戴, SCOSCHE Rhythm+ 手臂式心跳帶
智慧穿戴, Spigen Watch Series 4 Rugged Armor Pro -44mm 保護殼
智慧穿戴, T.G Fitbit Charge 3 超薄3D防爆膜螢幕保護貼-透明(2入)
智慧穿戴, GARMIN QUICK RELEASE 18mm 矽膠錶帶
智慧穿戴, 刀鋒Edge Apple Watch Series 5 40mm 鋁合金雙料保護殼 夜幕綠
智慧穿戴, 刀鋒Edge Apple Watch Series 5 44mm 鋁合金雙料保護殼 玫瑰金
智慧穿戴, T.G 華為 WATCH GT2 46mm 運動款全包覆保護殼-4色(華為專用保護殼 手錶殼 錶殼)
智慧穿戴, Rearth Apple Watch S4 高質感金屬錶環殼
智慧穿戴, 刀鋒Edge Apple Watch Series 5 44mm 鋁合金雙料保護殼 古銅金
智慧穿戴, NILLKIN Apple Watch S1/2/3 (38mm) 3D AW+ 玻璃貼
智慧穿戴, Morbido蒙彼多 Apple Watch 40mm皮製錶帶 矢車菊藍
智慧穿戴, Morbido蒙彼多 Apple Watch 42mm皮製錶帶 矢車菊藍
智慧穿戴, GARMIN QUICKFIT 26mm 尼龍錶帶
智慧穿戴, 【YOMIX 優迷】米動手錶Stratos 3/青春版2 BipS 親膚矽膠壓紋錶帶(加贈高清防刮錶面貼)
智慧穿戴, Samsung 三星 Galaxy Watch 皮革質感錶帶 -棕色/20mm
智慧穿戴, Morbido蒙彼多 Apple Watch 38mm皮製錶帶 矢車菊藍
智慧穿戴, QinD Apple Watch (42mm) 雙色矽膠保護套
智慧穿戴, UAG Apple Watch 44mm 耐衝擊保護殼
智慧穿戴, GARMIN Forerunner 645系列充電傳輸線
智慧穿戴, GARMIN QUICKFIT 22mm 石板灰不鏽鋼錶帶
智慧穿戴, GARMIN vivosmart HR專屬充電夾
智慧穿戴, GARMIN 皮帶扣固定座
智慧穿戴, QinD Apple Watch (44mm) 雙色矽膠保護套
智慧穿戴, GARMIN QuickFit 22mm 矽膠錶帶
智慧穿戴, Apple watch 44mm 透明保護軟殼
智慧穿戴, HUAWEI 原廠 Watch W1手錶 磁吸式充電底座 (密封袋裝)
智慧穿戴, ICARER 古典系列  Apple Watch 手工真皮錶帶
智慧穿戴, iMOS ASUS VivoWatch BP 3SAS 螢幕保護貼
智慧穿戴, 刀鋒Edge Apple Watch Series 5 40mm 鋁合金雙料保護殼 野性紅
智慧穿戴, GARMIN LEGACY SAGA 傳奇星戰系列皮革錶帶
智慧穿戴, HUAWEI華為 原廠 Watch GT 真皮皮革錶帶 (台灣公司貨)
智慧穿戴, 刀鋒Edge Apple Watch Series 5 44mm 鋁合金雙料保護殼 經典黑
智慧穿戴, QinD Apple Watch (40mm) 雙色矽膠保護套
智慧穿戴, GARMIN Forerunner 45S 替換錶帶
智慧穿戴, MUVIT Apple Watch Series4 (40mm) 耐衝擊保護殼-午夜藍
智慧穿戴, Apple Watch Series 3(GPS+網路) 38mm銀色鋁金屬錶殼+白色錶帶
智慧穿戴, Metal-Slim Apple Watch Series 4 44mm 全膠滿版保護貼
智慧穿戴, GARMIN QUICKFIT 26mm 咖啡棕皮革錶帶
智慧穿戴, Fitbit Inspire/Inspire HR 皮革錶帶
智慧穿戴, AmazingThing Apple Watch 42mm 曲面強化玻璃保護貼 - 急速配
智慧穿戴, Philip Stein翡麗詩丹日間手環-【環鑽黑】
智慧穿戴, Mood Booster 心和鍊 心和環 平和振波的魔法 (舒心鍊)
智慧穿戴, (2入)Apple Watch series 4 專用清透水感保護套
智慧穿戴, GARMIN  Forerunner 935 原廠矽膠錶帶
智慧穿戴, 刀鋒Edge Apple Watch Series 5 44mm 鋁合金雙料保護殼 古銅金
智慧穿戴, Philip Stein翡麗詩丹日間手環-【星鑽黑】
智慧穿戴, GARMIN Vivosmart 3 原廠充電傳輸線
智慧穿戴, Apple Watch 38mm 滿版軟性保護膜
智慧穿戴, Apple Watch 全膠軟邊3D曲面全覆蓋超薄鋼化保護貼-42mm/黑色
智慧穿戴, Qii GARMIN fenix 6S 玻璃貼 (兩片裝)
智慧穿戴, GARMIN QUICK RELEASE 20mm 矽膠錶帶
智慧穿戴, GARMIN QUICKFIT 20mm 矽膠錶帶
智慧穿戴, 皇娥ATTACUS 官方品牌旗艦店-SC003(2入裝)無磁石自行車速度踏頻感測器
智慧穿戴, GARMIN QUICKFIT 26mm 栗色皮革錶帶
智慧穿戴, GARMIN QUICKFIT 22mm 鈦金屬錶帶
智慧穿戴, Spigen Watch Series 4 Rugged Armor- 40mm 防摔保護殼
智慧穿戴, JSmax SB-C20 智慧多功能健康管理運動手環
智慧穿戴, GARMIN Vivoactive HR 專屬充電夾
智慧穿戴, 【Adep】Apple Watch 38mm 高清鋼化玻璃螢幕保護貼
智慧穿戴, GARMIN SWIM 2 替換錶帶
智慧穿戴, GARMIN QUICKFIT 26mm 石墨灰ADLC鈦錶帶
智慧穿戴, 刀鋒Edge Apple Watch Series 5 40mm 鋁合金雙料保護殼 野性紅
智慧穿戴, Philip Stein翡麗詩丹日間手環-【經典紅】
智慧穿戴, Samsung 三星 Galaxy Watch 手工皮革錶帶 -米色/20mm
智慧穿戴, GARMIN Forerunner 45 替換錶帶
智慧穿戴, QinD Apple Watch (42mm) 雙色矽膠保護套
智慧穿戴, GARMIN fenix Chronos 原廠黑色錶帶
智慧穿戴, AmazingThing Garmin Fenix 3 螢幕保護貼
智慧穿戴, HUAWEI 原廠 Watch W1手錶 磁吸式充電底座 (盒裝)
智慧穿戴, Spigen Watch Series 4 Liquid Crystal-保護殼
智慧穿戴, 【Ringke】Super Folding Stand摺疊式手機平板支架
智慧穿戴, GARMIN QuickFit 22mm 石墨灰ADLC鈦錶帶
智慧穿戴, GOR 9H MW Watch 2 心率三鐵錶 手錶鋼化玻璃保護貼 2片裝
智慧穿戴, GARMIN QUICKFIT 26mm 石墨灰DLC鈦金錶帶
智慧穿戴, GARMIN Quickfit 22mm 整合型矽膠錶帶
智慧穿戴, o-one 小螢膜 galaxy-gear-S3 保護貼
智慧穿戴, GARMIN 附繩扣環
智慧穿戴, UAG Galaxy Watch 46mm 時尚錶帶-橘
智慧穿戴, 三星 Galaxy Watch Essex 皮革錶帶-Horween皮料/20mm
智慧穿戴, IPX67防水全功能心率健康管理運動智能手錶
智慧穿戴, GARMIN QUICKFIT 20mm 尼龍錶帶
智慧穿戴, Apple watch 42mm 透明水凝膜保護貼
智慧穿戴, Samsung Galaxy Watch Active2 智慧手錶-鋁製/40mm
智慧穿戴, XUNDD for Apple Watch 4 電鍍TPU保護框-40mm
智慧穿戴, 刀鋒Edge Apple Watch Series 4 44mm 鋁合金雙料保護殼 夜幕綠
智慧穿戴, Samsung 三星 Galaxy Watch 皮革質感錶帶 -鱷魚紋黑/22mm
智慧穿戴, GARMIN Quickfit 22mm 咖啡棕皮革錶帶
智慧穿戴, GARMIN QUICKFIT 26mm 石板灰不鏽鋼錶帶
智慧穿戴, GARMIN LEGACY HERO 傳奇英雄系列皮革錶帶
智慧穿戴, Pormate Apple Watch 44mm 滿版強化玻璃保護貼(Guardio)
智慧穿戴, 【Adep】 Apple Watch 42mm 高清鋼化玻璃螢幕保護貼
智慧穿戴, 小米手環3/4 撞色網洞雙色腕帶 替換帶 液態硅膠 錶帶 運動智能錶帶 防水防丟
智慧穿戴, Mood Booster 心和鍊 心和環 平和振波的魔法 (舒心鍊)
智慧穿戴, GARMIN LEGACY HERO 傳奇英雄系列矽膠錶帶
智慧穿戴, Philip Stein翡麗詩丹日間手環-【經典深灰】
智慧穿戴, GARMIN QuickFit 20mm 黑色皮革錶帶
智慧穿戴, o-one 小螢膜 Apple Watch S3-38mm保護貼
智慧穿戴, GARMIN QUICKFIT 22mm 矽膠錶帶
智慧穿戴, Samsung Galaxy Watch 46mm通用 米蘭尼斯磁吸式錶帶
智慧穿戴, Apple watch 40mm 透明水凝膜保護貼
智慧穿戴, GARMIN QUICKFIT 20mm 不鏽鋼錶帶
智慧穿戴, GARMIN Approach S60 中文高爾夫GPS腕錶-尊爵版
智慧穿戴, 小螢膜 AppleWatch 2入保護貼 犀牛皮防護膜 抗衝擊自動修復 亮面
智慧穿戴, D&A Samsung Gear S3 手錶專用玻璃奈米5H 螢幕保護貼(超值2入)
智慧穿戴, GARMIN QUICKFIT 26mm 鈦金屬錶帶
智慧穿戴, GARMIN vivosmart 4 充電傳輸線
智慧穿戴, Philip Stein翡麗詩丹日間手環-【環鑽紫】
智慧穿戴, GARMIN QUICKFIT 22mm 石墨灰DLC鈦金錶帶
智慧穿戴, Apple watch 38mm 糖果矽膠保護軟殼
智慧穿戴, GARMIN QUICKFIT 26mm 矽膠錶帶
智慧穿戴, AmazingThing Garmin Forerunner 235 螢幕保護貼
智慧穿戴, GARMIN Approach CT10 揮桿追蹤系統(完整套組)
智慧穿戴, UAG Galaxy Watch 42mm 時尚錶帶-黑
智慧穿戴, Qii GARMIN fenix 6 玻璃貼 (兩片裝)
智慧穿戴, Pormate Apple Watch 42mm 滿版強化玻璃保護貼(Guardio)
智慧穿戴, Apple watch 38mm 透明水凝膜保護貼
智慧穿戴, Apple watch 40mm 糖果矽膠保護軟殼
智慧穿戴, Philip Stein翡麗詩丹日間手環-【環鑽白】
智慧穿戴, GARMIN QUICKFIT 20mm 岩灰麂皮錶帶
智慧穿戴, mijobs 通用運動矽膠錶帶
智慧穿戴, Pormate Apple Watch 40mm 滿版強化玻璃保護貼(Guardio)
智慧穿戴, UAG Galaxy Watch 46mm 皮革錶帶-棕
智慧穿戴, Apple Watch Nike+ S4(GPS+網路)44mm銀色鋁金屬錶殼+黑色錶帶
智慧穿戴, Apple Watch Nike+ S4(GPS+網路)40mm太空灰鋁金屬錶殼+黑色錶環
智慧穿戴, GOLiFE Care-XC 智慧全彩觸控心率手環
智慧穿戴, T.G Apple Watch 38mm 3D曲面滿版軟邊鋼化膜(手錶保護貼 玻璃膜 鋼化膜)
智慧穿戴, g-IDEA Apple Watch 38mm TPU 透明軟殼/鋼化玻璃貼組
智慧穿戴, UAG Galaxy Watch 42mm 時尚錶帶-橘
智慧穿戴, 刀鋒Edge Apple Watch Series 4 40mm 鋁合金雙料保護殼 夜幕綠
智慧穿戴, GARMIN vívofit jr. 2 迪士尼公主系列腕帶
智慧穿戴, Apple watch 44mm 透明水凝膜保護貼
智慧穿戴, 小螢膜 AppleWatch  2入保護貼 犀牛皮防護膜 抗衝擊自動修復 霧面
智慧穿戴, CITY Apple Watch Series 4 44mm 滿版全膠曲面玻璃貼
智慧穿戴, g-IDEA Apple Watch 42mm TPU 透明軟殼/鋼化玻璃貼組
智慧穿戴, 全包覆經典系列 Apple Watch Series 3/2/1 (42mm) 9H鋼化玻璃貼+錶殼 一體式保護殼
智慧穿戴, NILLKIN HUAWEI Watch GT Amazing H+PRO 鋼化玻璃貼
智慧穿戴, UAG Galaxy Watch 46mm 皮革錶帶-黑
智慧穿戴, ITSKINS Apple Watch(44mm) SPECTRUM SOLID-防摔保護殼
智慧穿戴, Apple Watch S5 Nike GPS版 44mm太空灰鋁錶殼黑色運動錶帶MX3W
智慧穿戴, 小米手環4 探索版透明手環腕帶 舒適矽膠替換帶 運動智能錶帶 防水防丟
智慧穿戴, ITSKINS Apple Watch (44mm) SPECTRUM CLEAR防摔保護殼
智慧穿戴, 【JSmax】M1驅蚊智慧手環
智慧穿戴, mijobs 小米手環 4 / 手環 3 不鏽鋼腕帶(三珠款)
智慧穿戴, UAG Galaxy Watch 46mm Nato錶帶-灰
智慧穿戴, ITSKINS Apple Watch (40mm) SPECTRUM CLEAR防摔保護殼
智慧穿戴, 小米手環4 米蘭尼斯金屬錶帶 商務腕帶 小米手環替換帶 卡扣款
智慧穿戴, ANTIAN 小米手環4 單色矽膠腕帶 替換錶帶 時尚舒適手錶帶
智慧穿戴, GARMIN Approach Z82 球車固定座
智慧穿戴, SUUNTO 9 堅固強勁 超長電池續航力的多項目運動GPS腕錶 (萊姆綠)
智慧穿戴, D&A 小米手環 4 極薄水透膜螢幕保護貼(單入)
智慧穿戴, Apple watch 44mm霧面烤漆錶框
智慧穿戴, mijobs 小米手環 4 / 手環 3 運動腕帶
智慧穿戴, [無卡分期-12期Apple Watch S3(GPS+網路) 42mm銀色鋁+白色錶帶
智慧穿戴, GARMIN Impact 揮棒訓練分析儀
智慧穿戴, ANTIAN 小米手環4 高檔皮質替換手環腕帶 商務錶帶 時尚舒適手錶帶
智慧穿戴, TicWatch S2 探索運動智慧手錶-白色
智慧穿戴, Apple Watch Series 5(GPS) 40mm銀色鋁金屬錶殼+白色運動錶帶
智慧穿戴, [無卡分期-12期]Apple Watch Series 5(GPS)44mm太空灰鋁錶殼黑運動錶帶
智慧穿戴, UAG Apple Watch 38/40mm 潮流矽膠錶帶-黑
智慧穿戴, GARMIN fenix 5 Plus 行動支付音樂GPS複合式心率腕錶-光耀橘
智慧穿戴, MR 小米手環3/4通用金屬編織卡扣式錶帶
智慧穿戴, [無卡分期-12期]Apple Watch Series 5(GPS)44mm灰鋁+黑錶帶
智慧穿戴, SUUNTO Ambit3 Peak Sapphire HR 進階戶外探險與多項目運動GPS腕錶
智慧穿戴, JSmax SC-C90 智慧多功能健康管理運動手環
智慧穿戴, Apple Watch Nike+ S4(GPS)40mm 銀色鋁金屬錶殼+白色錶環
智慧穿戴, 華為HUAWEI WATCH GT 智慧手錶-黑色(曜石黑矽膠錶帶)
智慧穿戴, JSmax SC-C80全功能健康管理運動手環
智慧穿戴, Apple Watch Nike S5(GPS+網路)40mm太空灰鋁金屬錶殼+黑色錶帶
智慧穿戴, 【LTE版】Samsung Galaxy Watch 智慧型手錶 (42mm)-玫瑰金
智慧穿戴, Apple Watch Nike S5(GPS)44mm 太空灰鋁金屬錶殼+黑色錶帶
智慧穿戴, 《Yahoo購物中心》GARMIN Forerunner 645 Music GPS跑錶 櫻桃紅
智慧穿戴, 小米手環4 專用充電線 合金充電底座 結實耐用 USB閃充 迷你便攜 小米手環充電器
智慧穿戴, ANTIAN 小米手環3 單色腕帶 矽膠錶帶
智慧穿戴, Apple Watch Nike S5(GPS)40mm 銀色鋁金屬錶殼+白色錶帶
智慧穿戴, Apple Watch 1/2/3 磁吸充電線
智慧穿戴, 小米手環3充電線充電器(副廠)
智慧穿戴, Qii Garmin vivolife 玻璃貼 (兩片裝)
智慧穿戴, Cooyee Apple Watch 液態膠玻璃貼(含燈)
智慧穿戴, mijobs 小米手環 4 / 手環 3 運動腕帶
智慧穿戴, MR 小米手環3/4通用尼龍編織運動替換錶帶
智慧穿戴, 犀牛盾 Apple Watch 38mm Crashguard NX防摔邊框保護殼
智慧穿戴, 華米Amazfit 米動手錶青春版 專用 高清TPU奈米保謢貼膜(軟膜) 2入組
智慧穿戴, HUAWEI WATCH GT2 42mm-橡膠錶帶
智慧穿戴, D&A 小米手環 4 極薄水透膜螢幕保護貼(超值2入)
智慧穿戴, 2張裝 小米手環3代 水凝膜 高清滿版 透明 防爆防刮 螢幕保護貼
智慧穿戴, o-one 小螢膜 Apple Watch S4-44mm保護貼
智慧穿戴, [無卡分期-12期]Apple Watch Series 5(GPS)44mm金鋁+粉錶帶
智慧穿戴, x-doria Apple Watch 44mm 保護殼 DEFENSE 刀鋒系列 繽紛虹
智慧穿戴, GOLiFE Fit Plus藍牙智慧BMI電子體重計(by PAPAGO)-黑-快速到貨
智慧穿戴, SUUNTO 9 堅固強勁 超長電池續航力的多項目運動GPS腕錶 (經典黑)
智慧穿戴, 美國 Case-Mate Apple Watch 38-40mm 第四代保護殼-透明
智慧穿戴, 全包覆經典系列 Apple Watch Series 5/4 (44mm) 9H鋼化玻璃貼+錶殼 一體式保護殼
智慧穿戴, Apple Watch Series 5(GPS) 44mm銀色鋁金屬錶殼+白色運動錶帶
智慧穿戴, GARMIN Vector3S 單感應踏板式功率計
智慧穿戴, T.G Fitbit Versa 2 撞色運動款透氣錶帶(矽膠錶帶 運動錶帶)
智慧穿戴, GARMIN vivofit jr. 2 星際大戰系列腕帶
智慧穿戴, 防摔專家 Apple Watch 完美包覆 輕薄透明保護殼
智慧穿戴, mijobs 小米手環 4 / 手環 3 經典米蘭腕帶
智慧穿戴, 小米手環4米蘭金屬錶帶腕帶
智慧穿戴, 刀鋒Edge Apple Watch Series 4 44mm 鋁合金雙料保護殼 夜幕綠
智慧穿戴, Apple Watch1/2/3/4/5電鍍金屬錶框 手錶保護邊框
智慧穿戴, SGP / Spigen Apple Watch 44mm Film Neo Flex保護
智慧穿戴, hoco Apple Watch (40mm) 鋼化玻璃貼
智慧穿戴, 蘋果手錶 Apple Watch4 曲面3D鋼化玻璃保護膜保護貼40mm-黑
智慧穿戴, MR 小米手環3/4通用簡約鱷魚皮紋運動替換錶帶
智慧穿戴, Apple Watch Nike+ S4(GPS+網路)40mm 太空灰色鋁金屬+黑色錶帶
智慧穿戴, (贈錶帶)【長江】U-ta S6 旗艦級彩色螢幕觸控防水智慧手環
智慧穿戴, CATALYST APPLE WATCH S1/S2/S3 (38mm) 運動錶帶
智慧穿戴, GOLiFE Smart Cup 觸控顯示智能保溫杯(保溫瓶)-速
智慧穿戴, GARMIN fenix 5 Plus 行動支付音樂GPS複合式心率腕錶 石墨灰-鈦
智慧穿戴, D&A 小米手環 4 極薄水透膜螢幕保護貼(單入)
智慧穿戴, 小米手環4充電線充電器(副廠)-1米
智慧穿戴, Apple Watch series 4 高級強化型 螢幕主機全包覆保護套
智慧穿戴, CITY BOSS for Apple watch一體成形式玻璃加保護殻- 42mm
智慧穿戴, mijobs 通用運動矽膠錶帶
智慧穿戴, Metal-Slim Apple Watch Series 4 44mm 全膠滿版保護貼
智慧穿戴, 小米手環3專用 充電線(副廠)
智慧穿戴, 小米手環3代充電線(副廠) 專用充電器
智慧穿戴, [無卡分期-12期]Apple Watch S5(GPS) 40mm太空灰鋁金屬錶殼+黑色運動錶帶
智慧穿戴, 防摔專家Apple Watch全螢幕3D曲面鋼化玻璃貼(黑邊)
智慧穿戴, Fitbit Versa 2 編織錶帶
智慧穿戴, 小米手環2代 雙色透氣洞腕帶 替換帶(副廠) 加贈保護貼乙入
智慧穿戴, 【SUUNTO 公司貨】Core Anniversary Edition 運動登山錶_黑
智慧穿戴, Apple Watch series 4 免拆錶帶 環型螢幕包覆保護套
智慧穿戴, Apple Watch Series 5(GPS) 40mm銀色鋁金屬錶殼+白色運動錶帶
智慧穿戴, Twelve South HiRise Deluxe iPhone 充電立架 - 黑色
智慧穿戴, 防摔專家 Apple Watch 完美包覆 輕薄透明保護殼-44mm
智慧穿戴, Apple Watch Series 5(GPS) 40mm太空灰鋁金屬錶殼+黑色運動錶帶
智慧穿戴, 熱銷優惠組合 C80+CV15 智能心率運動手環(動態畫面 智慧手錶 運動數據)
智慧穿戴, [無卡分期-12期]Apple Watch Nike S5(GPS)40mm銀色鋁金屬錶殼+白色錶帶
智慧穿戴, QinD Apple Watch (38mm) 雙色矽膠保護套
智慧穿戴, 小米手環4充電線充電器(副廠)
智慧穿戴, Fitbit Versa Family 經典錶帶
智慧穿戴, 皇娥ATTACUS 官方品牌旗艦店-CS012藍牙/ANT+運動心率胸帶
智慧穿戴, MR 小米手環3/4通用簡約鱷魚皮紋運動替換錶帶
智慧穿戴, (贈保護貼)【SHOWHAN】小米手環4透明矽膠腕帶/錶帶/七色
智慧穿戴, MIUI 小米手環4 原廠充電線 迷你便攜專用充電器 USB充電
智慧穿戴, UAG Apple Watch 42/44mm 皮革錶帶-黑
智慧穿戴, 藍牙前扣式心率帶ALATECH CS011(織布綁帶)(心跳胸帶/心率監測器/藍芽4.0/防水/穿戴裝置/心跳計)
智慧穿戴, 蘋果手錶 Apple Watch 3D曲面鋼化玻璃保護膜保護貼-黑色38mm
智慧穿戴, Morbido蒙彼多 Apple Watch 44mm 金屬錶帶連接器(卡扣式)
智慧穿戴, GARMIN Descent MK1 專用充電傳輸線
智慧穿戴, mijobs 小米手環 4 / 手環 3 尼龍回環式腕帶
智慧穿戴, Apple Watch Nike+ S4(GPS+網路)40mm 銀色鋁金屬錶殼+雪峰白錶環
智慧穿戴, Belkin Boost Up 三用無線充電座Apple Watch+iPhone+USB-A黑
智慧穿戴, SUUNTO 5 堅固輕巧質精、絕佳電池續航力的多項目運動GPS腕錶 (石墨灰 復古銅)
智慧穿戴, mijobs 小米手環 4 專用充電線
智慧穿戴, ITSKINS Apple Watch(40mm) SPECTRUM SOLID-防摔保護殼
智慧穿戴, (贈保護貼)【SHOWHAN】小米手環4米蘭金屬錶帶/腕帶/四色
智慧穿戴, g-IDEA Apple Watch 38MM 智慧型藍牙手錶防爆鋼化玻璃貼
智慧穿戴, D&A 小米手環 3 極薄水透膜螢幕保護貼(單入)
智慧穿戴, GOR 9H Garmin Forerunner 735XT 手錶鋼化玻璃保護貼 2片裝
智慧穿戴, Fitbit Inspire/Inspire HR 皮革錶帶
智慧穿戴, GOLiFE Fit Plus藍牙智慧BMI電子體重計(by PAPAGO)-白
智慧穿戴, Apple watch 40mm 霧面烤漆錶框
智慧穿戴, 刀鋒Edge Apple Watch Series 4 40mm 鋁合金雙料保護殼 夜幕綠
智慧穿戴, 小米手環4/3代 雙色透氣洞腕帶 錶帶 替換帶(副廠)
智慧穿戴, Fitbit Ionic 智能健身手錶
智慧穿戴, Apple Watch Nike S5(GPS)44mm 銀色鋁金屬錶殼+白色錶帶
智慧穿戴, GOR Garmin Vivoactive HR 手錶鋼化玻璃保護貼 2片裝
智慧穿戴, SAMGO E07運動觸控防水智慧手環
智慧穿戴, GARMMA Hello Kitty 彩漾心率智慧手環
智慧穿戴, SUUNTO 5 經典白 / 堅固輕巧質精、絕佳電池續航力的多項目運動GPS腕錶
智慧穿戴, Samsung Galaxy Watch Active2 智慧手錶-鋁製/40mm
智慧穿戴, ANTIAN 小米手環3 米蘭尼斯金屬腕帶 卡扣款
智慧穿戴, iMOS Apple Watch series 4 3SAS 螢幕保護貼(兩入組)
智慧穿戴, IS愛思 16-RW 心率運動圓款藍牙智慧手錶
智慧穿戴, UAG Apple Watch 38/40mm Nato錶帶-灰
智慧穿戴, 【AFAMIC 艾法】熱銷優惠組合 C18智能心率運動手環 2入組
智慧穿戴, Apple Watch Series 5(GPS) 40mm金色鋁金屬錶殼+粉沙色運動錶帶
智慧穿戴, 2張裝 Apple Watch 1/2/3代 水凝膜 高清滿版 防爆 手錶保護貼
智慧穿戴, 【Amazfit華米】米動手錶T-Rex軍規認證智能運動心率智慧手錶（原廠公司貨）
智慧穿戴, Apple Watch 不鏽鋼七珠蝶扣錶帶-贈拆錶器(銀-40mm)
智慧穿戴, HUAWEI華為 原廠 Watch 2 專用牛皮錶帶 (盒裝)
智慧穿戴, NILLKIN Apple Watch S1/2/3 (42mm) 3D AW+ 玻璃貼
智慧穿戴, Acer 宏碁 Leap Beads 智慧佛珠
智慧穿戴, Apple watch 44mm 菱格紋錶框黑色
智慧穿戴, 小米手環3絲絨編織尼龍運動防水錶帶腕帶
智慧穿戴, GARMIN vivofit jr. 2 星際大戰系列腕帶
智慧穿戴, [無卡分期-12期]Apple Watch Series 5(GPS)44mm金色鋁錶殼粉色運動錶帶
智慧穿戴, T.G Fitbit Versa 2 高透3D防爆水凝膜螢幕保護貼-滿版(2入)
智慧穿戴, MR AMAZFIT米動手錶青春版米蘭式卡扣替換錶帶-贈拆錶針
智慧穿戴, GARMIN Approach Z82 專用攜行包
智慧穿戴, Apple Watch TPU軟質保護殼-40mm/兩色可選
智慧穿戴, 哥特斯 Apple Watch手錶無線充電器 Lightning手機充電線 二合一
智慧穿戴, Apple Watch S5 NIKE GPS版 44mm 鋁錶殼配運動錶帶
智慧穿戴, Apple Watch S5 NIKE GPS版 40mm 鋁錶殼配運動錶帶
智慧穿戴, 小米手環3半透明腕帶錶帶
智慧穿戴, Apple watch 40mm 菱格紋錶框黑色
智慧穿戴, D&A 小米手環 3 極薄水透膜螢幕保護貼(超值2入)
智慧穿戴, 【長江】U-ta S6 旗艦級彩色螢幕觸控防水智慧手環
